en	translation	gender	meaning_translation
apartment	अपार्टमेंट	m	कमरों का एक सूट जो एक निवास बनाता है
apathy	उदासीनता	f	रुचि, उत्साह या चिंता की कमी
ape	वानर	m	पूंछ की कमी वाला बड़ा प्राइमेट
aperture	द्वार	m	खोलना, छेद या अंतर
apex	शिखर	m	किसी चीज़ का शीर्ष या सबसे ऊंचा भाग
apocalypse	प्रलय	m	बाइबिल की भविष्यवाणी में वर्णित दुनिया का पूर्ण अंतिम विनाश
apology	माफी	f	किसी अपराध या विफलता की पश्चातापी स्वीकृति
apostrophe	विस्मयादिबोधक चिह्न	m	अधिकार या अक्षरों या संख्याओं की चूक को इंगित करने के लिए उपयोग किया जाने वाला विराम चिह्न
apparatus	उपकरण	m	किसी विशेष गतिविधि या उद्देश्य के लिए आवश्यक तकनीकी उपकरण या मशीनरी
apparel	परिधान	m	कपड़े विशेष रूप से किसी विशेष प्रकार के
appeal	अपील	f	गंभीर या तत्काल अनुरोध
appearance	उपस्थिति	f	किसी व्यक्ति या चीज़ का दिखने का तरीका
appetite	भूख	f	शारीरिक आवश्यकता को पूरा करने की प्राकृतिक इच्छा
appetizer	भूख बढ़ाने वाला	m	भूख को उत्तेजित करने के लिए भोजन से पहले लिए गए भोजन या पेय का छोटा व्यंजन
applause	तालियां	f	ताली बजाकर व्यक्त की गई स्वीकृति या प्रशंसा
apple	सेब	m	गुलाब परिवार के पेड़ का गोल फल
appliance	उपकरण	m	एक विशिष्ट कार्य करने के लिए डिज़ाइन किया गया उपकरण या उपकरण का टुकड़ा
applicant	आवेदक	m	वह व्यक्ति जो किसी चीज़ के लिए औपचारिक आवेदन करता है
application	आवेदन	m	किसी प्राधिकारी से किसी चीज़ के लिए औपचारिक अनुरोध
appointment	नियुक्ति	f	किसी विशेष समय और स्थान पर किसी से मिलने की व्यवस्था
appraisal	मूल्यांकन	m	किसी चीज़ के मूल्य या गुणवत्ता का आकलन
appreciation	प्रशंसा	f	किसी व्यक्ति या किसी चीज़ के अच्छे गुणों की पहचान और आनंद
apprehension	आशंका	f	चिंता या डर कि कुछ बुरा या अप्रिय होगा
apprentice	प्रशिक्षु	m	वह व्यक्ति जो किसी कुशल नियोक्ता से व्यापार सीख रहा है
apprenticeship	प्रशिक्षुता	f	प्रशिक्षु की स्थिति
approach	दृष्टिकोण	m	किसी चीज़ से निपटने का तरीका
appropriation	विनियोग	m	किसी की अपनी चीज़ लेने की क्रिया
approval	अनुमोदन	m	आधिकारिक रूप से किसी चीज़ से सहमत होने या संतोषजनक के रूप में स्वीकार करने की क्रिया
apricot	खुबानी	f	पीले-नारंगी मांस और रोएँदार त्वचा वाला रसदार पत्थर फल
April	अप्रैल	m	ग्रेगोरियन कैलेंडर में वर्ष का चौथा महीना
apron	एप्रन	m	किसी के कपड़ों के सामने पहना जाने वाला सुरक्षात्मक वस्त्र
aquatic	जलीय जीव	m	पानी में या उसके पास रहने वाला जीव
arab	अरब	m	मध्य पूर्व और उत्तरी अफ्रीका के अधिकांश हिस्से में निवास करने वाले सामी लोगों का सदस्य
arbitration	मध्यस्थता	f	विवाद को सुलझाने के लिए मध्यस्थ का उपयोग
arc	चाप	m	वक्र की परिधि का एक भाग
arch	मेहराब	m	वक्र सममित संरचना जो एक उद्घाटन फैलाती है और ऊपर भार का समर्थन करती है
archaeologist	पुरातत्वविद्	m	वह व्यक्ति जो कलाकृतियों की खुदाई और विश्लेषण के माध्यम से मानव इतिहास और प्रागितिहास का अध्ययन करता है
archaeology	पुरातत्व	m	भौतिक संस्कृति की वसूली और विश्लेषण के माध्यम से मानव गतिविधि का अध्ययन
archer	तीरंदाज	m	वह व्यक्ति जो धनुष और तीर से शूट करता है
archipelago	द्वीपसमूह	m	द्वीपों का व्यापक समूह
architect	वास्तुकार	m	वह व्यक्ति जो इमारतों को डिजाइन करता है
architecture	वास्तुकला	f	इमारतों को डिजाइन और निर्माण करने की कला या अभ्यास
archive	अभिलेखागार	m	ऐतिहासिक दस्तावेजों या अभिलेखों का संग्रह
arctic	आर्कटिक	m	उत्तरी ध्रुव के आसपास के क्षेत्र
area	क्षेत्र	m	शहर, देश या दुनिया का एक क्षेत्र या हिस्सा
arena	अखाड़ा	m	दर्शकों के लिए सीटों से घिरा स्तरीय क्षेत्र
argument	तर्क	m	विचलन या विपरीत विचारों का आदान-प्रदान
aristocracy	अभिजात वर्ग	m	कुछ समाजों में सर्वोच्च वर्ग
arithmetic	अंकगणित	f	संख्याओं के गुणों और हेरफेर से निपटने वाली गणित की शाखा
arizona	एरिज़ोना	m	संयुक्त राज्य अमेरिका के दक्षिणपश्चिमी क्षेत्र में एक राज्य
arm	बांह	f	कंधे से हाथ तक मानव शरीर के दो ऊपरी अंगों में से प्रत्येक
armament	शस्त्रीकरण	m	सैन्य हथियार और उपकरण
armor	कवच	m	युद्ध में शरीर की रक्षा के लिए सैनिकों या योद्धाओं द्वारा पूर्व में पहने जाने वाले धातु आवरण
army	सेना	f	जमीन पर लड़ने के लिए सुसज्जित संगठित सैन्य बल
aroma	सुगंध	f	विशिष्ट आमतौर पर सुखद गंध
arrangement	व्यवस्था	f	व्यवस्थित करने या व्यवस्थित होने की क्रिया प्रक्रिया या परिणाम
array	श्रृंखला	f	किसी विशेष प्रकार की चीज़ का प्रभावशाली प्रदर्शन या श्रेणी
arrest	गिरफ्तारी	f	किसी को हिरासत में लेने के लिए पकड़ने की क्रिया
arrival	आगमन	m	पहुंचने की क्रिया या प्रक्रिया
arrow	तीर	m	नुकीले सिर और पंखदार पूंछ वाला प्रक्षेप्य
arsenal	शस्त्रागार	m	किसी देश या व्यक्ति द्वारा संग्रहीत हथियारों और सैन्य उपकरणों का संग्रह
art	कला	f	मानव रचनात्मक कौशल और कल्पना की अभिव्यक्ति या अनुप्रयोग
artery	धमनी	f	परिसंचरण तंत्र का हिस्सा बनने वाली पेशीय दीवार वाली नलियों में से कोई भी
artichoke	आर्टिचोक	m	भूमध्यसागरीय पौधा जिसके थीस्ल जैसे फूलों के सिर सब्जी के रूप में खाए जाते हैं
article	लेख	m	विशेष वस्तु या वस्तु
artillery	तोपखाना	m	भूमि पर युद्ध में उपयोग की जाने वाली बड़ी-कैलिबर बंदूकें
artist	कलाकार	m	वह व्यक्ति जो पेशे या शौक के रूप में पेंटिंग या चित्र बनाता है
ascent	चढ़ाई	f	ऊपर की ओर ढलान या पथ जिस पर कोई चल या चढ़ सकता है
ash	राख	f	किसी पदार्थ के जलने के बाद बचा चूर्ण अवशेष
Asia	एशिया	m	दुनिया का सबसे बड़ा और सबसे अधिक आबादी वाला महाद्वीप
aspect	पहलू	m	किसी चीज़ का कोई विशेष भाग या विशेषता
aspiration	आकांक्षा	f	कुछ हासिल करने की आशा या महत्वाकांक्षा
aspirin	एस्पिरिन	m	हल्के या पुराने दर्द को दूर करने के लिए औषधीय रूप से उपयोग किया जाने वाला सिंथेटिक यौगिक
assault	हमला	m	शारीरिक हमला
assembly	सभा	f	एक सामान्य उद्देश्य के लिए एक साथ इकट्ठे हुए लोगों का समूह
assertion	दावा	m	तथ्य या विश्वास का आत्मविश्वासपूर्ण और सशक्त कथन
assessment	मूल्यांकन	m	किसी की प्रकृति, गुणवत्ता या क्षमता का मूल्यांकन या अनुमान
asset	संपत्ति	f	एक उपयोगी या मूल्यवान वस्तु, व्यक्ति या गुण
assignment	कार्य	m	नौकरी या अध्ययन पाठ्यक्रम के हिस्से के रूप में किसी को आवंटित कार्य
assistance	सहायता	f	किसी नौकरी या कार्य में किसी की मदद करने की क्रिया
assistant	सहायक	m	एक व्यक्ति जो वरिष्ठ व्यक्ति के नीचे है और उनके काम में मदद करता है
associate	सहयोगी	m	व्यापार या काम में साथी या सहकर्मी
association	संघ	m	संयुक्त उद्देश्य के लिए संगठित लोगों का समूह
assortment	संग्रह	m	विविध चीजों या लोगों का संग्रह
assumption	धारणा	f	बिना प्रमाण के सत्य या निश्चित मानी गई बात
assurance	आश्वासन	m	विश्वास देने के लिए सकारात्मक घोषणा
asteroid	क्षुद्रग्रह	m	सूर्य की परिक्रमा करता छोटा चट्टानी पिंड
asthma	दमा	m	श्वासनली में ऐंठन के कारण सांस लेने में कठिनाई
astonishment	विस्मय	m	बड़ा आश्चर्य या चकित होना
astrology	ज्योतिष	m	खगोलीय पिंडों की गति और स्थिति का अध्ययन
astronaut	अंतरिक्ष यात्री	m	अंतरिक्ष यान में यात्रा के लिए प्रशिक्षित व्यक्ति
astronomy	खगोल विज्ञान	m	खगोलीय पिंडों, अंतरिक्ष और भौतिक ब्रह्मांड से संबंधित विज्ञान
astrophysics	खगोल भौतिकी	f	तारों और अन्य खगोलीय पिंडों की भौतिक प्रकृति से संबंधित खगोल विज्ञान की शाखा
asylum	शरण	f	किसी राष्ट्र द्वारा दी गई सुरक्षा
athlete	खिलाड़ी	m	खेल और अन्य शारीरिक व्यायाम में कुशल व्यक्ति
athletics	एथलेटिक्स	m	किसी भी प्रकार के शारीरिक खेल और खेल
atlas	मानचित्रावली	f	मानचित्रों या चार्ट की पुस्तक
atmosphere	वातावरण	m	पृथ्वी या अन्य ग्रह को घेरने वाली गैसों का आवरण
atom	परमाणु	m	रासायनिक तत्व की मूल इकाई
atrocity	अत्याचार	m	अत्यंत दुष्ट या क्रूर कार्य
attachment	लगाव	m	किसी चीज से जुड़ा अतिरिक्त भाग
attack	हमला	m	व्यक्ति या स्थान के खिलाफ आक्रामक और हिंसक कार्य
attainment	प्राप्ति	f	लक्ष्य प्राप्त करने की क्रिया या तथ्य
attempt	प्रयास	m	कठिन कार्य प्राप्त करने का प्रयास
attendance	उपस्थिति	f	नियमित रूप से किसी स्थान पर जाने या उपस्थित रहने की क्रिया
attendant	परिचारक	m	जनता को सेवा प्रदान करने के लिए नियोजित व्यक्ति
attention	ध्यान	m	किसी या किसी चीज़ की सूचना
attitude	दृष्टिकोण	m	किसी या किसी चीज़ के बारे में सोचने या महसूस करने का एक निश्चित तरीका
attorney	वकील	m	व्यापार या कानूनी मामलों में दूसरे के लिए कार्य करने के लिए नियुक्त व्यक्ति
attraction	आकर्षण	m	रुचि, खुशी या पसंद जगाने की क्रिया या शक्ति
attribute	गुण	m	किसी या किसी चीज़ के विशिष्ट या अंतर्निहित भाग के रूप में मानी जाने वाली विशेषता
auction	नीलामी	f	सार्वजनिक बिक्री जिसमें वस्तुएं सबसे अधिक बोली लगाने वाले को बेची जाती हैं
audience	दर्शक	m	सार्वजनिक कार्यक्रम में एकत्रित दर्शक या श्रोता
audit	लेखा परीक्षा	f	किसी व्यक्ति या संगठन के खातों का आधिकारिक निरीक्षण
audition	ऑडिशन	m	गायक, अभिनेता, नर्तक या संगीतकार के रूप में भूमिका के लिए साक्षात्कार
auditor	लेखा परीक्षक	m	लेखा परीक्षा करने वाला व्यक्ति
auditorium	सभागार	m	थिएटर, कॉन्सर्ट हॉल या अन्य सार्वजनिक भवन का वह भाग जहां दर्शक बैठते हैं
August	अगस्त	m	ग्रेगोरियन कैलेंडर में वर्ष का आठवां महीना
aunt	चाची	f	किसी के पिता या माता की बहन या किसी के चाचा की पत्नी
austerity	कठोरता	f	व्यवहार या दृष्टिकोण की कठोरता या गंभीरता
Australia	ऑस्ट्रेलिया	m	हिंद और प्रशांत महासागरों से घिरा देश और महाद्वीप
Australian	ऑस्ट्रेलियाई	m	दक्षिणी गोलार्ध में देश और महाद्वीप का मूल निवासी
author	लेखक	m	पुस्तक, लेख या रिपोर्ट का लेखक
authority	अधिकारी	m	आदेश देने, निर्णय लेने और आज्ञाकारिता लागू करने की शक्ति या अधिकार
auto	ऑटो	m	मोटर वाहन
autobiography	आत्मकथा	f	उस व्यक्ति द्वारा लिखित जीवन का विवरण
automation	स्वचालन	m	विनिर्माण या अन्य उत्पादन प्रक्रिया की प्रणाली में बड़े पैमाने पर स्वचालित उपकरण का उपयोग
automobile	ऑटोमोबाइल	m	सड़क वाहन, आमतौर पर चार पहियों के साथ
autonomy	स्वायत्तता	f	स्वशासन का अधिकार या स्थिति
autumn	शरद ऋतु	m	गर्मी के बाद और सर्दी से पहले का मौसम
availability	उपलब्धता	f	उपयोग या प्राप्त करने योग्य होने की गुणवत्ता
avalanche	हिमस्खलन	m	पहाड़ की ढलान से तेजी से नीचे गिरती बर्फ, बर्फ और चट्टानों का द्रव्यमान
avenue	मार्ग	m	शहर या कस्बे में चौड़ी सड़क
average	औसत	m	डेटा के सेट में केंद्रीय या विशिष्ट मूल्य व्यक्त करने वाली संख्या
aversion	घृणा	f	प्रबल नापसंदगी या अनिच्छा
aviation	विमानन	m	विमान उड़ाना या संचालन करना
avocado	एवोकाडो	m	खुरदरी चमड़े की त्वचा, चिकने तैलीय खाद्य मांस वाला नाशपाती के आकार का फल
award	पुरस्कार	m	उपलब्धि के सम्मान में दिया गया पुरस्कार या मान्यता का अन्य निशान
awareness	जागरूकता	f	किसी स्थिति या तथ्य का ज्ञान या धारणा
ax	कुल्हाड़ी	f	लकड़ी काटने के लिए आमतौर पर उपयोग किया जाने वाला उपकरण
axis	अक्ष	m	एक काल्पनिक रेखा जिसके बारे में कोई पिंड घूमता है
baby	बच्चा	m	बहुत छोटा बच्चा, विशेष रूप से नया या हाल ही में पैदा हुआ
bachelor	कुंवारा	m	एक पुरुष जो शादीशुदा नहीं है और कभी नहीं रहा
back	पीठ	f	कंधों से कूल्हों तक मानव शरीर की पिछली सतह
backache	कमरदर्द	m	किसी की पीठ में लंबे समय तक दर्द
backbone	रीढ़	f	खोपड़ी से श्रोणि तक फैली कशेरुकाओं की श्रृंखला
background	पृष्ठभूमि	f	दृश्य या चित्र का वह भाग जो सेटिंग बनाता है
backing	समर्थन	m	मदद या समर्थन
backlog	बकाया	m	किसी चीज का संचय, विशेष रूप से अधूरा काम
backup	बैकअप	m	मदद या समर्थन
bacon	बेकन	m	सुअर की पीठ या बाजू से ठीक किया गया मांस
bacteria	जीवाणु	m	सूक्ष्म एककोशिकीय जीव
badge	बैज	m	धातु, कपड़े या प्लास्टिक का छोटा टुकड़ा जिस पर डिज़ाइन या शब्द होते हैं
badger	बिज्जू	m	भारी निर्मित सर्वभक्षी निशाचर स्तनपायी
badminton	बैडमिंटन	m	रैकेट के साथ खेला जाने वाला खेल
bae	प्रियतम	m	किसी के रोमांटिक साथी के लिए स्नेह का शब्द
bag	थैला	m	लचीली सामग्री से बना शीर्ष पर खुलने वाला कंटेनर
baggage	सामान	m	यात्रा के लिए सूटकेस में पैक किया गया व्यक्तिगत सामान
bail	जमानत	f	पैसे की राशि की शर्त पर आरोपी व्यक्ति की अस्थायी रिहाई
bailout	राहत	f	किसी असफल व्यवसाय या अर्थव्यवस्था को वित्तीय सहायता देने का कार्य
baker	नानबाई	m	वह व्यक्ति जिसका व्यापार रोटी और केक बनाना है
balance	संतुलन	m	वजन का समान वितरण
ball	गेंद	f	ठोस या खोखला गोला, विशेष रूप से वह जिसे खेल में लात मारा, फेंका या मारा जाता है
ballad	गाथा	f	छोटे छंदों में कहानी बयान करने वाली कविता या गीत
ballet	बैले	m	संगीत के लिए किया जाने वाला कलात्मक नृत्य रूप
balloon	गुब्बारा	m	हवा से भरा चमकीले रंग का रबर का थैला
ballot	मतदान	m	मतदान की प्रक्रिया, आमतौर पर गुप्त रूप से
