en	translation	gender	meaning_translation
abbey	邪斜斜邪褌褋褌胁芯	n	
abbreviation	邪斜斜褉械胁懈邪褌褍褉邪	f	
ability	褋锌芯褋芯斜薪芯褋褌褜	f	
abnormality	邪薪芯屑邪谢懈褟	f	
abortion	邪斜芯褉褌	m	
absence	芯褌褋褍褌褋褌胁懈械	n	
absolute	邪斜褋芯谢褞褌	m	
abstract	褉械褎械褉邪褌	m	
abstraction	邪斜褋褌褉邪泻褑懈褟	f	
absurd	邪斜褋褍褉写	m	
absurdity	邪斜褋褍褉写薪芯褋褌褜	f	
abundance	懈蟹芯斜懈谢懈械	n	
abuse	蟹谢芯褍锌芯褌褉械斜谢械薪懈械	n	
academy	邪泻邪写械屑懈褟	f	
accent	邪泻褑械薪褌	m	
access	写芯褋褌褍锌	m	
accessory	邪泻褋械褋褋褍邪褉	m	
accident	邪胁邪褉懈褟	f	
accommodation	卸懈谢褜褢	n	
accomplishment	写芯褋褌懈卸械薪懈械	n	
accord	褋芯谐谢邪褕械薪懈械	n	
account	褋褔褢褌	m	
accounting	斜褍褏谐邪谢褌械褉懈褟	f	
accumulation	薪邪泻芯锌谢械薪懈械	n	
achievement	写芯褋褌懈卸械薪懈械	n	
acid	泻懈褋谢芯褌邪	f	
acquaintance	蟹薪邪泻芯屑褘泄	m	
acquisition	锌褉懈芯斜褉械褌械薪懈械	n	
acquittal	芯锌褉邪胁写邪薪懈械	n	
acre	邪泻褉	m	
act	写械泄褋褌胁懈械	n	
acting	懈谐褉邪	f	
action	写械泄褋褌胁懈械	n	
activity	写械褟褌械谢褜薪芯褋褌褜	f	
actor	邪泻褌褢褉	m	
actress	邪泻褌褉懈褋邪	f	
actuality	写械泄褋褌胁懈褌械谢褜薪芯褋褌褜	f	
adaptation	邪写邪锌褌邪褑懈褟	f	
addiction	蟹邪胁懈褋懈屑芯褋褌褜	f	
addition	写芯斜邪胁谢械薪懈械	n	
additive	写芯斜邪胁泻邪	f	
address	邪写褉械褋	m	
adherence	锌褉懈胁械褉卸械薪薪芯褋褌褜	f	
administration	邪写屑懈薪懈褋褌褉邪褑懈褟	f	
admiral	邪写屑懈褉邪谢	m	
admiration	胁芯褋褏懈褖械薪懈械	n	
admission	锌褉懈蟹薪邪薪懈械	n	
adornment	褍泻褉邪褕械薪懈械	n	
adult	胁蟹褉芯褋谢褘泄	m	
advance	锌褉芯谐褉械褋褋	m	
advantage	锌褉械懈屑褍褖械褋褌胁芯	n	
adventure	锌褉懈泻谢褞褔械薪懈械	n	
adversary	锌褉芯褌懈胁薪懈泻	m	
adversity	薪械胁蟹谐芯写褘	f	
advertisement	褉械泻谢邪屑邪	f	
advertiser	褉械泻谢邪屑芯写邪褌械谢褜	m	
advice	褋芯胁械褌	m	
adviser	褋芯胁械褌薪懈泻	m	
advocacy	蟹邪褖懈褌邪	f	
affair	写械谢芯	n	
affection	锌褉懈胁褟蟹邪薪薪芯褋褌褜	f	
affidavit	邪褎褎懈写械胁懈褌	m	
affinity	褋褉芯写褋褌胁芯	n	
aftercare	锌芯褋谢械芯锌械褉邪褑懈芯薪薪褘泄	m	
afternoon	写械薪褜	m	
age	胁芯蟹褉邪褋褌	m	
agency	邪谐械薪褌褋褌胁芯	n	
agenda	锌芯胁械褋褌泻邪	f	
agent	邪谐械薪褌	m	
aggregate	褋芯胁芯泻褍锌薪芯褋褌褜	f	
agitation	胁芯谢薪械薪懈械	n	
agony	邪谐芯薪懈褟	f	
agreement	褋芯谐谢邪褕械薪懈械	n	
agriculture	褋械谢褜褋泻芯械	n	
aid	锌芯屑芯褖褜	f	
aide	锌芯屑芯褖薪懈泻	m	
aim	褑械谢褜	f	
air	胁芯蟹写褍褏	m	
airhead	锌褍褋褌芯谐芯谢芯胁褘泄	m	
airport	邪褝褉芯锌芯褉褌	m	
airway	写褘褏邪褌械谢褜薪褘泄	m	
alarm	褌褉械胁芯谐邪	f	
alaska	袗谢褟褋泻邪	f	
album	邪谢褜斜芯屑	m	
alcohol	邪谢泻芯谐芯谢褜	m	
alcoholism	邪谢泻芯谐芯谢懈蟹屑	m	
alibi	邪谢懈斜懈	n	
alien	懈薪芯锌谢邪薪械褌褟薪懈薪	m	
alignment	胁褘褉邪胁薪懈胁邪薪懈械	n	
all	胁褋褢	n	
all-nighter	斜械褋褋芯薪薪邪褟	f	
allegiance	胁械褉薪芯褋褌褜	f	
allergy	邪谢谢械褉谐懈褟	f	
alliance	褋芯褞蟹	m	
alligator	邪谢谢懈谐邪褌芯褉	m	
allocation	褉邪褋锌褉械写械谢械薪懈械	n	
allotment	薪邪写械谢	m	
allowance	锌芯褋芯斜懈械	n	
alloy	褋锌谢邪胁	m	
ally	褋芯褞蟹薪懈泻	m	
almond	屑懈薪写邪谢褜	m	
alpaca	邪谢褜锌邪泻邪	f	
alpha	邪谢褜褎邪	f	
alphabet	邪谢褎邪胁懈褌	m	
alternative	邪谢褜褌械褉薪邪褌懈胁邪	f	
altitude	胁褘褋芯褌邪	f	
alto	邪谢褜褌	m	
amateur	谢褞斜懈褌械谢褜	m	
amber	褟薪褌邪褉褜	m	
ambiguity	薪械芯锌褉械写械谢褢薪薪芯褋褌褜	f	
ambition	邪屑斜懈褑懈褟	f	
amendment	锌芯锌褉邪胁泻邪	f	
America	袗屑械褉懈泻邪	f	
American	邪屑械褉懈泻邪薪械褑	m	
amethyst	邪屑械褌懈褋褌	m	
ammunition	斜芯械锌褉懈锌邪褋褘	m	
amnesty	邪屑薪懈褋褌懈褟	f	
amount	泻芯谢懈褔械褋褌胁芯	n	
ampere	邪屑锌械褉	m	
amplitude	邪屑锌谢懈褌褍写邪	f	
amusement	褉邪蟹胁谢械褔械薪懈械	n	
anagram	邪薪邪谐褉邪屑屑邪	f	
analogy	邪薪邪谢芯谐懈褟	f	
analysis	邪薪邪谢懈蟹	m	
anarchy	邪薪邪褉褏懈褟	f	
anatomy	邪薪邪褌芯屑懈褟	f	
ancestor	锌褉械写芯泻	m	
angel	邪薪谐械谢	m	
anger	谐薪械胁	m	
angle	褍谐芯谢	m	
animal	卸懈胁芯褌薪芯械	n	
animation	邪薪懈屑邪褑懈褟	f	
ankle	谢芯写褘卸泻邪	f	
anniversary	谐芯写芯胁褖懈薪邪	f	
announcement	芯斜褗褟胁谢械薪懈械	n	
announcer	写懈泻褌芯褉	m	
annoyance	褉邪蟹写褉邪卸械薪懈械	n	
answer	芯褌胁械褌	m	
ant	屑褍褉邪胁械泄	m	
antarctic	袗薪褌邪褉泻褌懈泻邪	f	
antelope	邪薪褌懈谢芯锌邪	f	
anthem	谐懈屑薪	m	
anthropology	邪薪褌褉芯锌芯谢芯谐懈褟	f	
antibiotic	邪薪褌懈斜懈芯褌懈泻	m	
antibody	邪薪褌懈褌械谢芯	n	
anticipation	锌褉械写胁泻褍褕械薪懈械	n	
antidote	锌褉芯褌懈胁芯褟写懈械	n	
antique	邪薪褌懈泻胁邪褉懈邪褌	m	
antiquity	写褉械胁薪芯褋褌褜	f	
antiseptic	邪薪褌懈褋械锌褌懈泻	m	
anxiety	褌褉械胁芯谐邪	f	
anybody	泻褌芯-薪懈斜褍写褜	m	
anyone	泻褌芯-薪懈斜褍写褜	m	
anything	褔褌芯-薪懈斜褍写褜	n	
anywhere	谐写械-薪懈斜褍写褜	m	
apartment	泻胁邪褉褌懈褉邪	f	
apathy	邪锌邪褌懈褟	f	
ape	芯斜械蟹褜褟薪邪	f	
aperture	芯褌胁械褉褋褌懈械	n	
apex	胁械褉褕懈薪邪	f	
apocalypse	邪锌芯泻邪谢懈锌褋懈褋	m	
apology	懈蟹胁懈薪械薪懈械	n	
apostrophe	邪锌芯褋褌褉芯褎	m	
apparatus	邪锌锌邪褉邪褌	m	
apparel	芯写械卸写邪	f	
appeal	锌褉懈蟹褘胁	m	
appearance	胁薪械褕薪芯褋褌褜	f	
appetite	邪锌锌械褌懈褌	m	
appetizer	蟹邪泻褍褋泻邪	f	
applause	邪锌谢芯写懈褋屑械薪褌褘	m	
apple	褟斜谢芯泻芯	n	
appliance	锌褉懈斜芯褉	m	
applicant	蟹邪褟胁懈褌械谢褜	m	
application	蟹邪褟胁谢械薪懈械	n	
appointment	薪邪蟹薪邪褔械薪懈械	n	
appraisal	芯褑械薪泻邪	f	
appreciation	锌褉懈蟹薪邪褌械谢褜薪芯褋褌褜	f	
apprehension	芯锌邪褋械薪懈械	n	
apprentice	锌芯写屑邪褋褌械褉褜械	n	
apprenticeship	褍褔械薪懈褔械褋褌胁芯	n	
approach	锌芯写褏芯写	m	
appropriation	邪褋褋懈谐薪芯胁邪薪懈械	n	
approval	芯写芯斜褉械薪懈械	n	
apricot	邪斜褉懈泻芯褋	m	
April	邪锌褉械谢褜	m	
apron	褎邪褉褌褍泻	m	
aquatic	胁芯写薪芯械	n	
arab	邪褉邪斜	m	
arbitration	邪褉斜懈褌褉邪卸	m	
arc	写褍谐邪	f	
arch	邪褉泻邪	f	
archaeologist	邪褉褏械芯谢芯谐	m	
archaeology	邪褉褏械芯谢芯谐懈褟	f	
archer	谢褍褔薪懈泻	m	
archipelago	邪褉褏懈锌械谢邪谐	m	
architect	邪褉褏懈褌械泻褌芯褉	m	
architecture	邪褉褏懈褌械泻褌褍褉邪	f	
archive	邪褉褏懈胁	m	
arctic	袗褉泻褌懈泻邪	f	
area	芯斜谢邪褋褌褜	f	
arena	邪褉械薪邪	f	
argument	褋锌芯褉	m	
aristocracy	邪褉懈褋褌芯泻褉邪褌懈褟	f	
arithmetic	邪褉懈褎屑械褌懈泻邪	f	
arizona	袗褉懈蟹芯薪邪	f	
arm	褉褍泻邪	f	
armament	胁芯芯褉褍卸械薪懈械	n	
armor	斜褉芯薪褟	f	
army	邪褉屑懈褟	f	
aroma	邪褉芯屑邪褌	m	
arrangement	褉邪褋锌芯谢芯卸械薪懈械	n	
array	屑邪褋褋懈胁	m	
arrest	邪褉械褋褌	m	
arrival	锌褉懈斜褘褌懈械	n	
arrow	褋褌褉械谢邪	f	
arsenal	邪褉褋械薪邪谢	m	
art	懈褋泻褍褋褋褌胁芯	n	
artery	邪褉褌械褉懈褟	f	
artichoke	邪褉褌懈褕芯泻	m	
article	褋褌邪褌褜褟	f	
artillery	邪褉褌懈谢谢械褉懈褟	f	
artist	褏褍写芯卸薪懈泻	m	
ascent	锌芯写褗褢屑	m	
ash	锌械锌械谢	m	
Asia	袗蟹懈褟	f	
aspect	邪褋锌械泻褌	m	
aspiration	褋褌褉械屑谢械薪懈械	n	
aspirin	邪褋锌懈褉懈薪	m	
assault	薪邪锌邪写械薪懈械	n	
assembly	褋芯斜褉邪薪懈械	n
assertion	褍褌胁械褉卸写械薪懈械	n	褍胁械褉械薪薪芯械 懈 褉械褕懈褌械谢褜薪芯械 蟹邪褟胁谢械薪懈械 褎邪泻褌邪 懈谢懈 褍斜械卸写械薪懈褟
assessment	芯褑械薪泻邪	f	芯褑械薪泻邪 懈谢懈 芯锌褉械写械谢械薪懈械 褏邪褉邪泻褌械褉邪, 泻邪褔械褋褌胁邪 懈谢懈 褋锌芯褋芯斜薪芯褋褌懈
asset	邪泻褌懈胁	m	锌芯谢械蟹薪邪褟 懈谢懈 褑械薪薪邪褟 胁械褖褜, 褔械谢芯胁械泻 懈谢懈 泻邪褔械褋褌胁芯
assignment	蟹邪写邪薪懈械	n	蟹邪写邪褔邪 懈谢懈 褉邪斜芯褌邪, 锌芯褉褍褔械薪薪邪褟 泻芯屑褍-谢懈斜芯
assistance	锌芯屑芯褖褜	f	写械泄褋褌胁懈械 锌芯屑芯褖懈 泻芯屑褍-谢懈斜芯 胁 褉邪斜芯褌械 懈谢懈 蟹邪写邪褔械
assistant	锌芯屑芯褖薪懈泻	m	褔械谢芯胁械泻, 泻芯褌芯褉褘泄 锌芯屑芯谐邪械褌 褋褌邪褉褕械屑褍 胁 褉邪斜芯褌械
associate	锌邪褉褌薪械褉	m	锌邪褉褌薪械褉 懈谢懈 泻芯谢谢械谐邪 胁 斜懈蟹薪械褋械 懈谢懈 薪邪 褉邪斜芯褌械
association	邪褋褋芯褑懈邪褑懈褟	f	谐褉褍锌锌邪 谢褞写械泄, 芯褉谐邪薪懈蟹芯胁邪薪薪褘褏 写谢褟 芯斜褖械泄 褑械谢懈
assortment	邪褋褋芯褉褌懈屑械薪褌	m	褉邪蟹薪芯芯斜褉邪蟹薪邪褟 泻芯谢谢械泻褑懈褟 胁械褖械泄 懈谢懈 谢褞写械泄
assumption	锌褉械写锌芯谢芯卸械薪懈械	n	胁械褖褜, 锌褉懈薪褟褌邪褟 蟹邪 懈褋褌懈薪褍 斜械蟹 写芯泻邪蟹邪褌械谢褜褋褌胁
assurance	褍胁械褉械薪薪芯褋褌褜	f	锌芯蟹懈褌懈胁薪芯械 蟹邪褟胁谢械薪懈械, 锌褉懈蟹胁邪薪薪芯械 胁薪褍褕懈褌褜 褍胁械褉械薪薪芯褋褌褜
asteroid	邪褋褌械褉芯懈写	m	屑邪谢芯械 褋泻邪谢懈褋褌芯械 褌械谢芯, 胁褉邪褖邪褞褖械械褋褟 胁芯泻褉褍谐 褋芯谢薪褑邪
asthma	邪褋褌屑邪	f	褉械褋锌懈褉邪褌芯褉薪芯械 蟹邪斜芯谢械胁邪薪懈械, 胁褘蟹褘胁邪褞褖械械 蟹邪褌褉褍写薪械薪懈械 写褘褏邪薪懈褟
astonishment	懈蟹褍屑谢械薪懈械	n	斜芯谢褜褕芯械 褍写懈胁谢械薪懈械 懈谢懈 懈蟹褍屑谢械薪懈械
astrology	邪褋褌褉芯谢芯谐懈褟	f	懈蟹褍褔械薪懈械 写胁懈卸械薪懈褟 懈 褉邪褋锌芯谢芯卸械薪懈褟 薪械斜械褋薪褘褏 褌械谢
astronaut	泻芯褋屑芯薪邪胁褌	m	褔械谢芯胁械泻, 芯斜褍褔械薪薪褘泄 锌褍褌械褕械褋褌胁芯胁邪褌褜 胁 泻芯褋屑懈褔械褋泻芯屑 泻芯褉邪斜谢械
astronomy	邪褋褌褉芯薪芯屑懈褟	f	薪邪褍泻邪, 懈蟹褍褔邪褞褖邪褟 薪械斜械褋薪褘械 芯斜褗械泻褌褘, 泻芯褋屑芯褋 懈 褎懈蟹懈褔械褋泻褍褞 胁褋械谢械薪薪褍褞
astrophysics	邪褋褌褉芯褎懈蟹懈泻邪	f	褉邪蟹写械谢 邪褋褌褉芯薪芯屑懈懈, 懈蟹褍褔邪褞褖懈泄 褎懈蟹懈褔械褋泻褍褞 锌褉懈褉芯写褍 蟹胁械蟹写
asylum	褍斜械卸懈褖械	n	蟹邪褖懈褌邪, 锌褉械写芯褋褌邪胁谢褟械屑邪褟 谐芯褋褍写邪褉褋褌胁芯屑 斜械卸械薪褑邪屑
athlete	邪褌谢械褌	m	褔械谢芯胁械泻, 蟹邪薪懈屑邪褞褖懈泄褋褟 褋锌芯褉褌芯屑
athletics	谢械谐泻邪褟 邪褌谢械褌懈泻邪	f	褎懈蟹懈褔械褋泻懈械 胁懈写褘 褋锌芯褉褌邪 懈 懈谐褉褘
atlas	邪褌谢邪褋	m	泻薪懈谐邪 泻邪褉褌 懈谢懈 褋褏械屑
atmosphere	邪褌屑芯褋褎械褉邪	f	芯斜芯谢芯褔泻邪 谐邪蟹芯胁, 芯泻褉褍卸邪褞褖懈褏 蟹械屑谢褞 懈谢懈 写褉褍谐褍褞 锌谢邪薪械褌褍
atom	邪褌芯屑	m	芯褋薪芯胁薪邪褟 械写懈薪懈褑邪 褏懈屑懈褔械褋泻芯谐芯 褝谢械屑械薪褌邪
atrocity	蟹胁械褉褋褌胁芯	n	褔褉械蟹胁褘褔邪泄薪芯 蟹谢芯泄 懈谢懈 卸械褋褌芯泻懈泄 锌芯褋褌褍锌芯泻
attachment	锌褉懈谢芯卸械薪懈械	n	写芯锌芯谢薪懈褌械谢褜薪邪褟 褔邪褋褌褜 懈谢懈 褉邪褋褕懈褉械薪懈械, 锌褉懈泻褉械锌谢械薪薪芯械 泻 褔械屑褍-谢懈斜芯
attack	薪邪锌邪写械薪懈械	n	邪谐褉械褋褋懈胁薪芯械 懈 卸械褋褌芯泻芯械 写械泄褋褌胁懈械 锌褉芯褌懈胁 褔械谢芯胁械泻邪 懈谢懈 屑械褋褌邪
attainment	写芯褋褌懈卸械薪懈械	n	写械泄褋褌胁懈械 懈谢懈 褎邪泻褌 写芯褋褌懈卸械薪懈褟 褑械谢懈
attempt	锌芯锌褘褌泻邪	f	褍褋懈谢懈械 写芯褋褌懈褔褜 懈谢懈 胁褘锌芯谢薪懈褌褜 褌褉褍写薪褍褞 蟹邪写邪褔褍
attendance	锌芯褋械褖邪械屑芯褋褌褜	f	写械泄褋褌胁懈械 懈谢懈 褋芯褋褌芯褟薪懈械 褉械谐褍谢褟褉薪芯谐芯 锌褉懈褋褍褌褋褌胁懈褟
attendant	芯斜褋谢褍卸懈胁邪褞褖懈泄	m	褔械谢芯胁械泻, 薪邪薪褟褌褘泄 写谢褟 芯泻邪蟹邪薪懈褟 褍褋谢褍谐 锌褍斜谢懈泻械
attention	胁薪懈屑邪薪懈械	n	蟹邪屑械褔邪薪懈械, 褋写械谢邪薪薪芯械 胁 芯褌薪芯褕械薪懈懈 泻芯谐芯-褌芯 懈谢懈 褔械谐芯-褌芯
attitude	芯褌薪芯褕械薪懈械	n	褍褋褌芯褟胁褕懈泄褋褟 褋锌芯褋芯斜 屑褘褕谢械薪懈褟 懈谢懈 褔褍胁褋褌胁
attorney	邪写胁芯泻邪褌	m	褔械谢芯胁械泻, 薪邪蟹薪邪褔械薪薪褘泄 写械泄褋褌胁芯胁邪褌褜 芯褌 懈屑械薪懈 写褉褍谐芯谐芯 胁 写械谢芯胁褘褏 懈谢懈 褞褉懈写懈褔械褋泻懈褏 胁芯锌褉芯褋邪褏
attraction	锌褉懈胁谢械泻邪褌械谢褜薪芯褋褌褜	f	写械泄褋褌胁懈械 懈谢懈 褋懈谢邪 胁褘蟹褘胁邪薪懈褟 懈薪褌械褉械褋邪, 褍写芯胁芯谢褜褋褌胁懈褟 懈谢懈 褋懈屑锌邪褌懈懈
attribute	邪褌褉懈斜褍褌	m	泻邪褔械褋褌胁芯 懈谢懈 芯褋芯斜械薪薪芯褋褌褜, 褉邪褋褋屑邪褌褉懈胁邪械屑邪褟 泻邪泻 褏邪褉邪泻褌械褉薪邪褟
auction	邪褍泻褑懈芯薪	m	锌褍斜谢懈褔薪邪褟 锌褉芯写邪卸邪, 薪邪 泻芯褌芯褉芯泄 褌芯胁邪褉褘 锌褉芯写邪褞褌褋褟 褌芯屑褍, 泻褌芯 斜芯谢褜褕械 蟹邪锌谢邪褌懈褌
audience	邪褍写懈褌芯褉懈褟	f	褋芯斜褉邪胁褕懈械褋褟 蟹褉懈褌械谢懈 懈谢懈 褋谢褍褕邪褌械谢懈 薪邪 锌褍斜谢懈褔薪芯屑 屑械褉芯锌褉懈褟褌懈懈
audit	邪褍写懈褌	m	芯褎懈褑懈邪谢褜薪邪褟 锌褉芯胁械褉泻邪 褋褔械褌芯胁 芯褌写械谢褜薪芯谐芯 谢懈褑邪 懈谢懈 芯褉谐邪薪懈蟹邪褑懈懈
audition	锌褉芯褋谢褍褕懈胁邪薪懈械	n	褋芯斜械褋械写芯胁邪薪懈械 薪邪 褉芯谢褜 锌械胁褑邪, 邪泻褌械褉邪, 褌邪薪褑芯褉邪 懈谢懈 屑褍蟹褘泻邪薪褌邪
auditor	邪褍写懈褌芯褉	m	褔械谢芯胁械泻, 锌褉芯胁芯写褟褖懈泄 邪褍写懈褌
auditorium	邪褍写懈褌芯褉懈褟	f	褔邪褋褌褜 褌械邪褌褉邪, 泻芯薪褑械褉褌薪芯谐芯 蟹邪谢邪 懈谢懈 写褉褍谐芯谐芯 芯斜褖械褋褌胁械薪薪芯谐芯 蟹写邪薪懈褟, 谐写械 褋懈写褟褌 蟹褉懈褌械谢懈
August	邪胁谐褍褋褌	m	胁芯褋褜屑芯泄 屑械褋褟褑 谐芯写邪 胁 谐褉懈谐芯褉懈邪薪褋泻芯屑 泻邪谢械薪写邪褉械
aunt	褌械褌褟	f	褋械褋褌褉邪 芯褌褑邪 懈谢懈 屑邪褌械褉懈 懈谢懈 卸械薪邪 写褟写懈
austerity	褋褌褉芯谐芯褋褌褜	f	褋褍褉芯胁芯褋褌褜 懈谢懈 褋褌褉芯谐芯褋褌褜 屑邪薪械褉褘 懈谢懈 芯褌薪芯褕械薪懈褟
Australia	袗胁褋褌褉邪谢懈褟	f	褋褌褉邪薪邪 懈 泻芯薪褌懈薪械薪褌, 芯泻褉褍卸械薪薪褘泄 袠薪写懈泄褋泻懈屑 懈 孝懈褏懈屑 芯泻械邪薪邪屑懈
Australian	邪胁褋褌褉邪谢懈械褑	m	褍褉芯卸械薪械褑 懈谢懈 卸懈褌械谢褜 褋褌褉邪薪褘 懈 泻芯薪褌懈薪械薪褌邪 胁 挟卸薪芯屑 锌芯谢褍褕邪褉懈懈
author	邪胁褌芯褉	m	锌懈褋邪褌械谢褜 泻薪懈谐懈, 褋褌邪褌褜懈 懈谢懈 芯褌褔械褌邪
authority	胁谢邪褋褌褜	f	锌褉邪胁芯 懈谢懈 胁谢邪褋褌褜 芯褌写邪胁邪褌褜 锌褉懈泻邪蟹褘, 锌褉懈薪懈屑邪褌褜 褉械褕械薪懈褟 懈 芯斜械褋锌械褔懈胁邪褌褜 锌芯胁懈薪芯胁械薪懈械
auto	邪胁褌芯屑芯斜懈谢褜	m	邪胁褌芯褌褉邪薪褋锌芯褉褌薪芯械 褋褉械写褋褌胁芯
autobiography	邪胁褌芯斜懈芯谐褉邪褎懈褟	f	褉邪褋褋泻邪蟹 芯 卸懈蟹薪懈 褔械谢芯胁械泻邪, 薪邪锌懈褋邪薪薪褘泄 褝褌懈屑 褔械谢芯胁械泻芯屑
automation	邪胁褌芯屑邪褌懈蟹邪褑懈褟	f	懈褋锌芯谢褜蟹芯胁邪薪懈械 胁 芯褋薪芯胁薪芯屑 邪胁褌芯屑邪褌懈褔械褋泻芯谐芯 芯斜芯褉褍写芯胁邪薪懈褟 胁 褋懈褋褌械屑械 锌褉芯懈蟹胁芯写褋褌胁邪
automobile	邪胁褌芯屑芯斜懈谢褜	m	写芯褉芯卸薪芯械 褌褉邪薪褋锌芯褉褌薪芯械 褋褉械写褋褌胁芯, 芯斜褘褔薪芯 褋 褔械褌褘褉褜屑褟 泻芯谢械褋邪屑懈
autonomy	邪胁褌芯薪芯屑懈褟	f	锌褉邪胁芯 懈谢懈 褍褋谢芯胁懈械 褋邪屑芯褍锌褉邪胁谢械薪懈褟
autumn	芯褋械薪褜	f	褋械蟹芯薪 锌芯褋谢械 谢械褌邪 懈 锌械褉械写 蟹懈屑芯泄
availability	写芯褋褌褍锌薪芯褋褌褜	f	泻邪褔械褋褌胁芯 胁芯蟹屑芯卸薪芯褋褌懈 斜褘褌褜 懈褋锌芯谢褜蟹芯胁邪薪薪褘屑 懈谢懈 锌芯谢褍褔械薪薪褘屑
avalanche	谢邪胁懈薪邪	f	屑邪褋褋邪 褋薪械谐邪, 谢褜写邪 懈 泻邪屑薪械泄, 斜褘褋褌褉芯 锌邪写邪褞褖邪褟 褋 谐芯褉薪芯谐芯 褋泻谢芯薪邪
avenue	锌褉芯褋锌械泻褌	m	褕懈褉芯泻邪褟 写芯褉芯谐邪 胁 谐芯褉芯写械
average	褋褉械写薪械械	n	褔懈褋谢芯, 胁褘褉邪卸邪褞褖械械 褑械薪褌褉邪谢褜薪芯械 懈谢懈 褌懈锌懈褔薪芯械 蟹薪邪褔械薪懈械 胁 薪邪斜芯褉械 写邪薪薪褘褏
aversion	芯褌胁褉邪褖械薪懈械	n	褋懈谢褜薪邪褟 薪械锌褉懈褟蟹薪褜 懈谢懈 薪械卸械谢邪薪懈械
aviation	邪胁懈邪褑懈褟	f	褍锌褉邪胁谢械薪懈械 懈谢懈 褝泻褋锌谢褍邪褌邪褑懈褟 胁芯蟹写褍褕薪褘褏 褋褍写芯胁
avocado	邪胁芯泻邪写芯	n	谐褉褍褕械胁懈写薪褘泄 锌谢芯写 褋 谐褉褍斜芯泄 泻芯卸懈褋褌芯泄 泻芯卸械泄
award	薪邪谐褉邪写邪	f	锌褉懈蟹 懈谢懈 写褉褍谐芯泄 蟹薪邪泻 锌褉懈蟹薪邪薪懈褟
awareness	芯褋胁械写芯屑谢械薪薪芯褋褌褜	f	蟹薪邪薪懈械 懈谢懈 胁芯褋锌褉懈褟褌懈械 褋懈褌褍邪褑懈懈 懈谢懈 褎邪泻褌邪
ax	褌芯锌芯褉	m	懈薪褋褌褉褍屑械薪褌, 芯斜褘褔薪芯 懈褋锌芯谢褜蟹褍械屑褘泄 写谢褟 褉褍斜泻懈 写褉芯胁
axis	芯褋褜	f	胁芯芯斜褉邪卸邪械屑邪褟 谢懈薪懈褟, 胁芯泻褉褍谐 泻芯褌芯褉芯泄 胁褉邪褖邪械褌褋褟 褌械谢芯
baby	褉械斜械薪芯泻	m	芯褔械薪褜 屑邪谢械薪褜泻懈泄 褉械斜械薪芯泻, 芯褋芯斜械薪薪芯 薪芯胁芯褉芯卸写械薪薪褘泄
bachelor	褏芯谢芯褋褌褟泻	m	屑褍卸褔懈薪邪, 泻芯褌芯褉褘泄 薪械 卸械薪邪褌 懈 薪懈泻芯谐写邪 薪械 斜褘谢 卸械薪邪褌
back	褋锌懈薪邪	f	蟹邪写薪褟褟 锌芯胁械褉褏薪芯褋褌褜 褔械谢芯胁械褔械褋泻芯谐芯 褌械谢邪 芯褌 锌谢械褔 写芯 斜械写械褉
backache	斜芯谢褜 胁 褋锌懈薪械	f	锌褉芯写芯谢卸懈褌械谢褜薪邪褟 斜芯谢褜 胁 褋锌懈薪械
backbone	锌芯蟹胁芯薪芯褔薪懈泻	m	褉褟写 锌芯蟹胁芯薪泻芯胁, 锌褉芯褋褌懈褉邪褞褖懈褏褋褟 芯褌 褔械褉械锌邪 写芯 褌邪蟹邪
background	褎芯薪	m	褔邪褋褌褜 褋褑械薪褘 懈谢懈 泻邪褉褌懈薪褘, 泻芯褌芯褉邪褟 芯斜褉邪蟹褍械褌 芯斜褋褌邪薪芯胁泻褍
backing	锌芯写写械褉卸泻邪	f	锌芯屑芯褖褜 懈谢懈 锌芯写写械褉卸泻邪
backlog	芯褌褋褌邪胁邪薪懈械	n	薪邪泻芯锌谢械薪懈械 褔械谐芯-谢懈斜芯, 芯褋芯斜械薪薪芯 薪械蟹邪胁械褉褕械薪薪芯泄 褉邪斜芯褌褘
backup	褉械蟹械褉胁薪邪褟 泻芯锌懈褟	f	锌芯屑芯褖褜 懈谢懈 锌芯写写械褉卸泻邪
bacon	斜械泻芯薪	m	胁褟谢械薪芯械 屑褟褋芯 褋芯 褋锌懈薪褘 懈谢懈 斜芯泻芯胁 褋胁懈薪褜懈
bacteria	斜邪泻褌械褉懈褟	f	屑懈泻褉芯褋泻芯锌懈褔械褋泻懈械 芯写薪芯泻谢械褌芯褔薪褘械 芯褉谐邪薪懈蟹屑褘
badge	蟹薪邪褔芯泻	m	薪械斜芯谢褜褕芯泄 泻褍褋芯泻 屑械褌邪谢谢邪, 褌泻邪薪懈 懈谢懈 锌谢邪褋褌懈泻邪 褋 褉懈褋褍薪泻芯屑 懈谢懈 褋谢芯胁邪屑懈
badger	斜邪褉褋褍泻	m	泻褉褍锌薪芯 褋谢芯卸械薪薪芯械 胁褋械褟写薪芯械 薪芯褔薪芯械 屑谢械泻芯锌懈褌邪褞褖械械
badminton	斜邪写屑懈薪褌芯薪	m	懈谐褉邪 褋 褉邪泻械褌泻邪屑懈, 胁 泻芯褌芯褉芯泄 胁芯谢邪薪 锌械褉械斜褉邪褋褘胁邪械褌褋褟 褔械褉械蟹 褋械褌泻褍
bae	谢褞斜懈屑褘泄	m	谢邪褋泻芯胁芯械 芯斜褉邪褖械薪懈械 泻 褉芯屑邪薪褌懈褔械褋泻芯屑褍 锌邪褉褌薪械褉褍
bag	褋褍屑泻邪	f	泻芯薪褌械泄薪械褉 懈蟹 谐懈斜泻芯谐芯 屑邪褌械褉懈邪谢邪 褋 芯褌胁械褉褋褌懈械屑 胁胁械褉褏褍
baggage	斜邪谐邪卸	m	谢懈褔薪褘械 胁械褖懈, 褍锌邪泻芯胁邪薪薪褘械 胁 褔械屑芯写邪薪褘 写谢褟 锌褍褌械褕械褋褌胁懈褟
bail	蟹邪谢芯谐	m	胁褉械屑械薪薪芯械 芯褋胁芯斜芯卸写械薪懈械 芯斜胁懈薪褟械屑芯谐芯, 芯卸懈写邪褞褖械谐芯 褋褍写邪
bailout	褋锌邪褋械薪懈械	n	邪泻褌 芯泻邪蟹邪薪懈褟 褎懈薪邪薪褋芯胁芯泄 锌芯屑芯褖懈 褌械褉锌褟褖械屑褍 薪械褍写邪褔褍 斜懈蟹薪械褋褍
baker	锌械泻邪褉褜	m	褔械谢芯胁械泻, 褔褜械泄 锌褉芯褎械褋褋懈械泄 褟胁谢褟械褌褋褟 胁褘锌械褔泻邪 褏谢械斜邪 懈 褌芯褉褌芯胁
balance	斜邪谢邪薪褋	m	褉邪胁薪芯屑械褉薪芯械 褉邪褋锌褉械写械谢械薪懈械 胁械褋邪
ball	屑褟褔	m	褌胁械褉写邪褟 懈谢懈 锌芯谢邪褟 褋褎械褉邪, 芯褋芯斜械薪薪芯 褌邪, 泻芯褌芯褉褍褞 锌懈薪邪褞褌, 斜褉芯褋邪褞褌 懈谢懈 斜褜褞褌 胁 懈谐褉械
ballad	斜邪谢谢邪写邪	f	锌芯褝屑邪 懈谢懈 锌械褋薪褟, 锌芯胁械褋褌胁褍褞褖邪褟 懈褋褌芯褉懈褞
ballet	斜邪谢械褌	m	褏褍写芯卸械褋褌胁械薪薪邪褟 褎芯褉屑邪 褌邪薪褑邪, 懈褋锌芯谢薪褟械屑邪褟 锌芯写 屑褍蟹褘泻褍
balloon	胁芯蟹写褍褕薪褘泄 褕邪褉	m	褟褉泻芯 芯泻褉邪褕械薪薪褘泄 褉械蟹懈薪芯胁褘泄 屑械褕芯泻, 薪邪写褍褌褘泄 胁芯蟹写褍褏芯屑
ballot	斜褞谢谢械褌械薪褜	m	锌褉芯褑械褋褋 谐芯谢芯褋芯胁邪薪懈褟, 芯斜褘褔薪芯 褌邪泄薪芯谐芯
bamboo	斜邪屑斜褍泻	m	谐懈谐邪薪褌褋泻邪褟 写褉械胁械褋薪邪褟 褌褉邪胁邪, 褉邪褋褌褍褖邪褟 胁 芯褋薪芯胁薪芯屑 胁 褌褉芯锌懈泻邪褏
ban	蟹邪锌褉械褌	m	芯褎懈褑懈邪谢褜薪褘泄 懈谢懈 褞褉懈写懈褔械褋泻懈泄 蟹邪锌褉械褌 薪邪 褔褌芯-谢懈斜芯
banana	斜邪薪邪薪	m	写谢懈薪薪褘泄 懈蟹芯谐薪褍褌褘泄 褎褉褍泻褌 褋 褌芯谢褋褌芯泄 卸械谢褌芯泄 泻芯卸褍褉芯泄
band	谐褉褍锌锌邪	f	锌谢芯褋泻邪褟 褌芯薪泻邪褟 锌芯谢芯褋邪 屑邪褌械褉懈邪谢邪
bandage	斜懈薪褌	m	锌芯谢芯褋邪 屑邪褌械褉懈邪谢邪, 懈褋锌芯谢褜蟹褍械屑邪褟 写谢褟 锌械褉械胁褟蟹泻懈 褉邪薪褘
bang	褏谢芯锌芯泻	m	胁薪械蟹邪锌薪褘泄 谐褉芯屑泻懈泄 褉械蟹泻懈泄 蟹胁褍泻
bank	斜邪薪泻	m	褎懈薪邪薪褋芯胁芯械 褍褔褉械卸写械薪懈械, 泻芯褌芯褉芯械 懈褋锌芯谢褜蟹褍械褌 写械薪褜谐懈, 胁薪械褋械薪薪褘械 泻谢懈械薪褌邪屑懈
banker	斜邪薪泻懈褉	m	褔械谢芯胁械泻, 褉邪斜芯褌邪褞褖懈泄 胁 斜邪薪泻芯胁褋泻芯屑 写械谢械 薪邪 胁褘褋芯泻芯屑 褍褉芯胁薪械
banking	斜邪薪泻芯胁褋泻芯械 写械谢芯	n	斜懈蟹薪械褋, 锌褉芯胁芯写懈屑褘泄 斜邪薪泻芯屑, 懈谢懈 褍褋谢褍谐懈, 锌褉械写谢邪谐邪械屑褘械 斜邪薪泻芯屑
bankruptcy	斜邪薪泻褉芯褌褋褌胁芯	n	褋芯褋褌芯褟薪懈械 锌芯谢薪芯谐芯 芯褌褋褍褌褋褌胁懈褟 写械薪械谐 懈谢懈 褉械褋褍褉褋芯胁
