en	translation	gender	meaning_translation
suspect	sospechoso	m	Persona bajo sospecha de haber cometido delito
suspension	suspensión	f	Acción de suspender algo temporalmente
suspicion	sospecha	f	Sentimiento de que algo está mal
swamp	pantano	m	Área de tierra húmeda y blanda
swan	cisne	m	Ave acuática grande con cuello largo
swap	intercambio	m	Acción de cambiar una cosa por otra entre dos partes
sweat	sudor	m	Humedad producida por cuerpo
sweater	suéter	m	Prenda de punto que cubre torso
sweep	barrido	m	Acto de limpiar área con escoba
sweet	dulce	m	Alimento con sabor azucarado o postre confitado
sweetheart	cariño	m	Persona amada o término afectuoso para pareja
sweetie	dulzura	f	Término cariñoso para persona querida o caramelo
swell	hinchazón	f	Aumento gradual en tamaño
swift	golondrina	f	Ave pequeña de vuelo rápido; rapidez
swimming	natación	f	Deporte o actividad de nadar
swing	columpio	m	Asiento suspendido para balancearse
switch	interruptor	m	Dispositivo para hacer o romper conexión
sword	espada	f	Arma con hoja larga afilada
Sydney	Sídney	f	Ciudad más grande de Australia en Nueva Gales del Sur
symbol	símbolo	m	Cosa representando otra cosa
sympathy	simpatía	f	Sentimientos de compasión por otro
symphony	sinfonía	f	Composición musical elaborada para orquesta
symptom	síntoma	m	Signo físico de enfermedad
syndicate	sindicato	m	Grupo de individuos o empresas con interés común
syndrome	síndrome	m	Conjunto de síntomas característicos de condición médica
synthesis	síntesis	f	Combinación de elementos para formar todo
syrup	jarabe	m	Líquido espeso dulce hecho de azúcar y agua
system	sistema	m	Conjunto de cosas trabajando juntas
table	mesa	f	Mueble con superficie plana sostenida por patas
tablet	tableta	f	Pastilla medicinal o dispositivo computacional portátil
tack	tachuela	f	Clavo pequeño de cabeza grande o rumbo de velero
tackle	entrada	f	Equipamiento para actividad o acción de detener jugador
tact	tacto	m	Habilidad de tratar con personas sin ofender o molestar
tag	etiqueta	f	Rótulo adjunto a objeto con información o juego infantil
tail	cola	f	Parte posterior del cuerpo animal que se extiende
tailor	sastre	m	Persona cuya ocupación es hacer ropa a medida
takeoff	despegue	m	Acción de aeronave al dejar el suelo o imitación
takeover	adquisición	f	Acto de asumir control de algo especialmente empresa
tale	cuento	m	Historia ficticia o narrativa de eventos reales o imaginarios
talent	talento	m	Aptitud natural o habilidad desarrollada en área específica
talk	charla	f	Conversación o discurso formal sobre tema particular
tally	recuento	m	Registro actual de cuentas o puntuación numérica
tan	bronceado	m	Color marrón amarillento o piel oscurecida por sol
tank	tanque	m	Recipiente grande para líquido o vehículo militar blindado
tap	grifo	m	Dispositivo para controlar flujo de líquido o golpecito
tape	cinta	f	Material estrecho de tela papel o plástico adhesivo
tariff	arancel	m	Impuesto sobre importaciones o lista de precios
task	tarea	f	Trabajo asignado o pieza de trabajo que debe hacerse
taste	gusto	m	Sensación de sabor o juicio de belleza y propiedad
tattoo	tatuaje	m	Diseño permanente hecho en piel con tinta
tax	impuesto	m	Contribución obligatoria al ingreso del estado
taxation	tributación	f	Imposición de impuestos obligatorios por gobierno
taxi	taxi	m	Vehículo autorizado para transportar pasajeros por tarifa
taxpayer	contribuyente	m	Persona u organización que paga impuestos al gobierno
tea	té	m	Bebida hecha infusionando hojas secas en agua caliente
teacher	maestro	m	Persona que enseña especialmente en escuela
team	equipo	m	Grupo de personas que trabajan juntas con propósito común
tear	lágrima	f	Gota de líquido salino del ojo o rasgadura
tech	tecnología	f	Aplicación práctica de conocimiento científico o sector tecnológico
technique	técnica	f	Manera de realizar tarea o procedimiento específico
technology	tecnología	f	Aplicación de conocimiento científico para fines prácticos
telegraph	telégrafo	m	Sistema de comunicación a distancia mediante señales
telephone	teléfono	m	Dispositivo para transmitir sonido especialmente voz a distancia
television	televisión	f	Sistema de transmitir imágenes en movimiento con sonido
temper	temperamento	m	Estado de ánimo o tendencia a enojarse fácilmente
temperament	temperamento	m	Naturaleza de persona especialmente en comportamiento
temperance	templanza	f	Moderación o autocontrol especialmente en comer y beber
tempest	tempestad	f	Tormenta violenta con vientos fuertes y lluvia
temple	templo	m	Edificio dedicado a adoración religiosa
tempo	tempo	m	Velocidad a la que se toca pasaje musical
temptation	tentación	f	Deseo de hacer algo especialmente incorrecto o imprudente
tempura	tempura	f	Plato japonés de mariscos o verduras fritas en masa
ten	diez	m	Número cardinal equivalente a producto de dos y cinco
tennis	tenis	m	Juego de raqueta jugado en cancha por dos o cuatro jugadores
tenor	tenor	m	Voz masculina cantante más alta o significado general
tension	tensión	f	Estado de estiramiento tenso o estrés mental o emocional
tent	tienda	f	Refugio portátil hecho de tela sostenida por postes
tenth	décimo	m	Posición ordinal número diez en secuencia
term	término	m	Palabra con significado específico o período de tiempo
termination	terminación	f	Acción de poner fin a algo o final de empleo
terminology	terminología	f	Conjunto de términos técnicos en materia particular
territorial	territorial	m	Relacionado con territorio de país o animal
territory	territorio	m	Área de tierra bajo jurisdicción de gobernante o estado
terror	terror	m	Miedo extremo o uso de violencia para intimidar
test	prueba	f	Procedimiento para evaluar habilidad conocimiento o desempeño
testament	testamento	m	Documento legal de voluntades de persona o evidencia
testimony	testimonio	m	Declaración formal dada como evidencia en tribunal
Texas	Texas	m	Estado en región sur central de Estados Unidos
text	texto	m	Contenido escrito o impreso de libro o documento
textbook	libro de texto	m	Libro usado como recurso estándar en estudio
textile	textil	m	Tipo de tela o material tejido o de punto
thank	agradecimiento	m	Expresión de gratitud o reconocimiento por favor
thanksgiving	Acción de Gracias	f	Fiesta nacional de agradecimiento en Estados Unidos
theater	teatro	m	Edificio donde se presentan obras dramáticas o películas
theatrical	teatral	m	Relacionado con teatro o actuación dramática exagerada
theft	robo	m	Acción de tomar propiedad ajena sin permiso ilegal
theology	teología	f	Estudio de naturaleza de Dios y creencias religiosas
theory	teoría	f	Suposición o sistema de ideas para explicar algo
therapy	terapia	f	Tratamiento médico o psicológico de enfermedad o trastorno
thermal	termal	m	Relacionado con calor o corriente de aire caliente
thermodynamics	termodinámica	f	Rama de física sobre relaciones entre calor y energía
thesis	tesis	f	Declaración o teoría propuesta como premisa o disertación
thick	grosor	m	Medida de espesor de objeto o parte más densa
thickness	espesor	m	Distancia entre superficies opuestas de objeto
thief	ladrón	m	Persona que roba propiedad de otra persona
thing	cosa	f	Objeto inanimado distinto de ser vivo
think	pensamiento	m	Acción de pensar o considerar algo cuidadosamente
thinking	pensamiento	m	Proceso de usar la mente para considerar o razonar
third	tercero	m	Posición ordinal número tres en secuencia
thirst	sed	f	Sensación de necesitar o desear beber líquido
thirteen	trece	m	Número cardinal equivalente a suma de diez y tres
thirteenth	decimotercero	m	Posición ordinal número trece en secuencia
thirtieth	trigésimo	m	Posición ordinal número treinta en secuencia
thirty	treinta	m	Número cardinal equivalente a tres veces diez
thorn	espina	f	Púa aguda y dura en tallo o rama de planta
thoroughfare	vía pública	f	Camino o calle principal entre dos lugares
thought	pensamiento	m	Idea o opinión producida por pensar o reflexión mental
thousand	mil	m	Número cardinal equivalente a producto de cien por diez
thousandth	milésimo	m	Posición ordinal número mil en secuencia
thread	hilo	m	Hebra delgada de fibra textil usada en costura
threat	amenaza	f	Declaración de intención de infligir daño o castigo
three	tres	m	Número cardinal entre dos y cuatro
thrift	ahorro	m	Cualidad de usar dinero y recursos cuidadosamente
throat	garganta	f	Paso que conecta boca con esófago y laringe
throne	trono	m	Silla ceremonial para soberano o persona de autoridad
thrust	empuje	m	Movimiento repentino o violento hacia adelante o fuerza propulsora
thumb	pulgar	m	Dedo corto y grueso de la mano separado de los demás
thunder	trueno	m	Sonido fuerte retumbante causado por expansión de aire en rayo
thunderstorm	tormenta eléctrica	f	Tormenta con truenos relámpagos y lluvia fuerte
Thursday	jueves	m	Día de semana entre miércoles y viernes
ticket	boleto	m	Comprobante de pago para entrada o viaje
tide	marea	f	Ascenso y descenso periódico del nivel del mar
tie	corbata	f	Tira de tela que se ata alrededor del cuello o empate
tiger	tigre	m	Felino grande rayado del género Panthera de Asia
tights	mallas	f	Prenda ajustada que cubre piernas y parte inferior del cuerpo
timber	madera	f	Madera preparada para construcción o árboles cultivados para madera
time	tiempo	m	Progreso continuo de existencia y eventos pasado presente futuro
tin	estaño	m	Metal plateado maleable o recipiente de hojalata
tingle	hormigueo	m	Sensación de ligero pinchazo o picazón en piel
tissue	tejido	m	Materia orgánica de estructura celular o papel delgado suave
title	título	m	Nombre de obra o posición de rango o autoridad
toad	sapo	m	Anfibio sin cola de piel rugosa similar a rana
toast	brindis	m	Pan tostado o acto de brindar con bebidas
tobacco	tabaco	m	Hojas preparadas de planta de nicotina para fumar
today	hoy	m	Este día presente actual en contraste con ayer y mañana
toe	dedo del pie	m	Cada una de las extremidades del pie humano
toil	trabajo arduo	m	Trabajo físico duro y continuo o labor agotadora
toilet	inodoro	m	Aparato sanitario grande para orinar y defecar
tolerance	tolerancia	f	Capacidad de aceptar o soportar algo desagradable
toll	peaje	m	Cargo por usar puente o carretera o número de víctimas
tomato	tomate	m	Fruta roja carnosa comestible de planta solanácea
tomb	tumba	f	Cámara o bóveda grande para enterrar muerto
tomorrow	mañana	m	Día después del presente o el futuro
ton	tonelada	f	Unidad de peso equivalente a dos mil libras o mil kilogramos
tone	tono	m	Calidad o carácter de sonido o voz o tinte de color
tongs	pinzas	f	Herramienta con dos brazos para sostener objetos
tongue	lengua	f	Órgano muscular móvil en boca para gusto y habla
tonic	tónico	m	Sustancia medicinal que da vigor o agua carbonatada
tool	herramienta	f	Dispositivo usado para realizar trabajo particular o función
tooth	diente	m	Cada una de estructuras óseas en mandíbulas para morder
toothache	dolor de muelas	m	Dolor en diente o región alrededor de diente
top	cima	f	Punto o parte más alto o superior de algo
topping	aderezo	m	Capa de comida puesta sobre otra para añadir sabor
torment	tormento	m	Sufrimiento físico o mental severo o causa de esto
tornado	tornado	m	Columna violenta de aire que gira en embudo móvil
torpedo	torpedo	m	Proyectil autopropulsado submarino con explosivos
torrent	torrente	m	Corriente fuerte y rápida de agua o flujo abundante
torture	tortura	f	Acción de infligir dolor severo como castigo o coacción
toss	lanzamiento	m	Acción de lanzar algo ligeramente o casualmente
touch	toque	m	Acción de tocar algo o sentido de tacto
tour	gira	f	Viaje visitando varios lugares o recorrido guiado
tourist	turista	m	Persona que viaja por placer visitando lugares
towel	toalla	f	Pieza de tejido absorbente para secar o limpiar
tower	torre	f	Estructura alta y estrecha que se eleva sobre entorno
town	pueblo	m	Asentamiento humano más grande que aldea y menor que ciudad
townspeople	vecinos	m	Personas que viven en pueblo o ciudad particular
toy	juguete	m	Objeto con el que niño juega para entretenimiento
trace	rastro	m	Marca o indicación de existencia o paso de algo
track	pista	f	Camino o curso hecho por paso repetido o vía de tren
tractor	tractor	m	Vehículo motorizado potente usado en granja para jalar
trade	comercio	m	Compra y venta de mercancías o oficio particular
trademark	marca registrada	f	Símbolo o palabra registrada que representa compañía
trader	comerciante	m	Persona que compra y vende bienes o acciones
tradition	tradición	f	Creencia o costumbre transmitida de generación en generación
tragedy	tragedia	f	Evento que causa gran sufrimiento o drama serio
trail	sendero	m	Camino marcado a través de área silvestre o rastro dejado
train	tren	m	Vehículo ferroviario de pasajeros o carga o serie conectada
training	entrenamiento	m	Acción de enseñar habilidad particular o disciplina
tramp	vagabundo	m	Persona sin hogar que viaja a pie pidiendo o trabajando
transaction	transacción	f	Intercambio o instancia de comprar o vender algo
transfer	transferencia	f	Acto de mover algo o alguien a otro lugar
transit	tránsito	m	Proceso de trasladar personas o cosas de lugar a lugar
translation	traducción	f	Proceso de traducir palabras o texto a otro idioma
transmission	transmisión	f	Acción de transmitir señal o mecanismo de vehículo
transparency	transparencia	f	Condición de ser transparente o diapositiva fotográfica
transport	transporte	m	Sistema de llevar personas o cosas de un lugar a otro
transportation	transporte	m	Acción de transportar o sistema de transporte
trap	trampa	f	Dispositivo para capturar animales o situación difícil
trauma	trauma	m	Lesión física o experiencia emocional profundamente perturbadora
travel	viaje	m	Acción de viajar típicamente a lugares lejanos
traveler	viajero	m	Persona que está viajando o viaja frecuentemente
tray	bandeja	f	Recipiente plano poco profundo para llevar o exhibir artículos
treachery	traición	f	Traición a confianza o acto de engañar a alguien
tread	pisada	f	Manera de caminar o superficie superior de escalón
treasure	tesoro	m	Cantidad de metales preciosos o cosa muy valorada
treasurer	tesorero	m	Persona encargada de fondos de organización
treasury	tesorería	f	Fondos o ingresos de estado o lugar donde se guarda tesoro
treat	golosina	f	Evento o artículo que da gran placer o regalo especial
treatment	tratamiento	m	Manera de comportarse hacia alguien o terapia médica
treaty	tratado	m	Acuerdo formal solemne entre estados o naciones
treble	triple	m	Cantidad tres veces mayor o voz más aguda en coro
tree	árbol	m	Planta perenne leñosa con tronco y ramas
tremble	temblor	m	Acción de temblar típicamente como resultado de ansiedad
trespass	invasión	f	Entrar a propiedad de otro sin permiso o transgresión
trial	juicio	m	Examen formal de evidencia en tribunal o prueba de capacidad
tribe	tribu	f	Grupo social tradicional de personas con cultura común
tribunal	tribunal	m	Corte de justicia o foro para resolver disputas
tribute	tributo	m	Acto o declaración de respeto o pago periódico
trick	truco	m	Acción o esquema astuto para engañar o habilidad
trickle	goteo	m	Flujo pequeño lento de líquido o movimiento gradual
trifle	bagatela	f	Cosa de poco valor o importancia o postre
trim	recorte	m	Decoración o acción de cortar algo ordenadamente
trio	trío	m	Conjunto de tres personas o cosas o grupo musical
trip	viaje	m	Acto de ir a lugar y regresar o tropiezo
triumph	triunfo	m	Gran victoria o logro o estado de júbilo
troop	tropa	f	Grupo de soldados o cantidad de personas o animales
trot	trote	m	Paso de caballo entre caminar y galopar o carrera
trouble	problema	m	Dificultad o inconveniente o esfuerzo molesto
trough	comedero	m	Recipiente largo para comida o agua de animales
trout	trucha	f	Pez comestible de agua dulce de familia del salmón
truce	tregua	f	Acuerdo entre enemigos para detener hostilidades temporalmente
true	verdad	f	Cualidad o estado de ser verdadero o conforme a realidad
trumpet	trompeta	f	Instrumento musical de viento de latón con sonido brillante
trunk	tronco	m	Tallo principal de árbol o equipaje grande o trompa
trust	confianza	f	Creencia firme en confiabilidad o verdad de alguien
truth	verdad	f	Cualidad o estado de ser verdadero o hecho verificado
tube	tubo	m	Cilindro largo hueco para contener o transportar algo
tuberculosis	tuberculosis	f	Enfermedad infecciosa bacteriana que afecta principalmente pulmones
tuck	pliegue	m	Doblez cosido plano en prenda o acción de meter
Tuesday	martes	m	Día de semana entre lunes y miércoles
tuition	matrícula	f	Enseñanza o instrucción o tarifa por enseñanza
tulip	tulipán	m	Planta bulbosa con flores grandes en forma de copa
tumble	caída	f	Caída repentina o desplome o acrobacia
tumor	tumor	m	Hinchazón de tejido causada por crecimiento anormal de células
tuna	atún	m	Pez marino grande usado como alimento
tune	melodía	f	Secuencia de notas musicales agradable y distintiva
turf	césped	m	Capa superficial de tierra con hierba o territorio
Turkey	Turquía	f	País transcontinental entre Europa y Asia
turn	turno	m	Acto de girar o moverse en dirección diferente u oportunidad
turnaround	cambio radical	m	Reversión abrupta o inesperada de situación
turnip	nabo	m	Raíz comestible redonda blanca o amarilla
turnover	volumen de negocios	m	Cantidad de dinero en ventas o rotación de personal
turtle	tortuga	f	Reptil con caparazón duro protector del cuerpo
twelfth	duodécimo	m	Posición ordinal número doce en secuencia
twelve	doce	m	Número cardinal equivalente a suma de diez y dos
twentieth	vigésimo	m	Posición ordinal número veinte en secuencia
twenty	veinte	m	Número cardinal equivalente a dos veces diez
twig	ramita	f	Rama delgada y pequeña que crece de rama más grande
twin	gemelo	m	Uno de dos hijos nacidos al mismo tiempo de misma madre
twinkle	centelleo	m	Destello de luz intermitente o brillo en ojos
twist	giro	m	Acto de girar algo o cambio inesperado en trama
twitter	gorjeo	m	Serie de sonidos cortos agudos de ave o charla trivial
two	dos	m	Número cardinal equivalente a suma de uno y uno
type	tipo	m	Categoría de personas o cosas con características comunes
typhoon	tifón	m	Ciclón tropical en región del Pacífico occidental
tyranny	tiranía	f	Gobierno cruel y opresivo o ejercicio arbitrario de poder
tyrant	tirano	m	Gobernante cruel que ejerce poder absoluto sin restricción legal
ukha	ukha	f	Sopa de pescado tradicional rusa clara con verduras
ultimate	definitivo	m	Final o fundamental en proceso o serie
ultrasound	ultrasonido	m	Ondas sonoras de alta frecuencia usadas en diagnóstico médico
umbrella	paraguas	m	Dispositivo portátil plegable de protección contra lluvia
uncertainty	incertidumbre	f	Estado de no estar seguro de algo o duda
uncle	tío	m	Hermano del padre o madre o esposo de tía
unconscious	inconsciente	m	Parte de mente inaccesible a conciencia
undergraduate	estudiante universitario	m	Estudiante en universidad que aún no se gradúa
underground	subterráneo	m	Espacio debajo de superficie de tierra o movimiento secreto
underneath	debajo	m	Parte o superficie inferior de algo
underside	parte inferior	f	Superficie o parte de abajo de algo
understanding	entendimiento	m	Capacidad de comprender o acuerdo informal
undertaking	empresa	f	Tarea formal o compromiso o negocio funerario
underwater	submarino	m	Situado debajo de superficie del agua
underwear	ropa interior	f	Prendas usadas debajo de ropa exterior en contacto con piel
unemployment	desempleo	m	Estado de estar sin trabajo o número de desempleados
uniform	uniforme	m	Vestimenta distintiva usada por miembros de organización
union	unión	f	Acción de unirse o asociación de trabajadores
unit	unidad	f	Cosa individual considerada como elemento de grupo
unity	unidad	f	Estado de estar unido o formando todo completo
universe	universo	m	Todo lo que existe incluyendo espacio tiempo materia y energía
university	universidad	f	Institución educativa de enseñanza superior e investigación
unknown	desconocido	m	Cosa o persona no conocida o identificada
unseen	invisible	m	No visto o percibido o parte no vista
up	arriba	m	Dirección hacia parte superior o estado favorable
upgrade	mejora	f	Acción de elevar a estándar superior o nueva versión
uplift	elevación	f	Acción de levantar algo o mejoramiento moral o espiritual
upright	vertical	m	Posición erecta perpendicular al suelo o cosa vertical
upset	trastorno	m	Estado de incomodidad o alteración emocional o victoria sorpresa
upside	parte superior	f	Lado superior o boca arriba de algo o aspecto positivo
upstairs	piso superior	m	Piso o pisos por encima de planta baja
upturn	mejora	f	Mejoramiento especialmente en condiciones económicas
uranium	uranio	m	Elemento químico radiactivo pesado usado en energía nuclear
uranus	Urano	m	Séptimo planeta del sistema solar o dios griego del cielo
urge	impulso	m	Deseo fuerte o instinto de actuar de manera particular
usage	uso	m	Manera en que algo se usa o práctica habitual
use	uso	m	Acción de usar algo o propósito para el cual se usa
usual	habitual	m	Lo que comúnmente ocurre o se hace
utility	utilidad	f	Estado de ser útil o proveedor de servicio público
utmost	máximo	m	Mayor o extremo grado cantidad o intensidad
utopia	utopía	f	Lugar o estado ideal imaginado de perfección
utterance	expresión	f	Acto de expresar algo en voz alta o cosa dicha
vacancy	vacante	f	Puesto no ocupado o habitación de hotel disponible
vacation	vacaciones	f	Período extendido de recreación lejos del trabajo o escuela
vaccine	vacuna	f	Sustancia biológica que proporciona inmunidad contra enfermedad
vacuum	vacío	m	Espacio sin aire ni otra materia o aspiradora
validity	validez	f	Cualidad de estar bien fundado en lógica o hecho
valley	valle	m	Área baja de tierra entre colinas o montañas
valuation	valoración	f	Estimación del valor monetario o medida de algo
value	valor	m	Importancia valía o utilidad de algo o principio
van	furgoneta	f	Vehículo motorizado cubierto usado para transportar bienes
vanilla	vainilla	f	Sustancia obtenida de orquídea tropical para dar sabor
vanity	vanidad	f	Orgullo excesivo en apariencia o logros propios
vapor	vapor	m	Sustancia difusa en aire especialmente como resultado de evaporación
variation	variación	f	Cambio o diferencia en condición cantidad o nivel
variety	variedad	f	Cualidad de ser diferente o diverso o tipo particular
varnish	barniz	m	Resina transparente aplicada a madera para brillo
vase	jarrón	m	Recipiente decorativo típicamente de vidrio usado para flores
vault	bóveda	f	Techo arqueado o cámara subterránea segura
vegetable	verdura	f	Planta o parte de planta usada como alimento
vegetation	vegetación	f	Plantas consideradas colectivamente especialmente en área
veil	velo	m	Pieza de tela fina usada para cubrir rostro o cabeza
vein	vena	f	Vaso sanguíneo que lleva sangre hacia corazón
velocity	velocidad	f	Rapidez de algo en dirección dada o tasa de movimiento
vendor	vendedor	m	Persona o compañía que vende bienes o servicios
vengeance	venganza	f	Castigo infligido o retribución exigida por lesión o mal
venture	empresa	f	Proyecto comercial arriesgado o acción audaz
venus	Venus	f	Segundo planeta del sistema solar o diosa romana
verdict	veredicto	m	Decisión sobre asunto disputado especialmente de jurado
verse	verso	m	Escritura dispuesta con patrón métrico rítmico
vertebra	vértebra	f	Cada uno de huesos segmentados de columna vertebral
vest	chaleco	m	Prenda sin mangas usada sobre camisa bajo chaqueta
veteran	veterano	m	Persona con larga experiencia especialmente en fuerzas armadas
veto	veto	m	Derecho constitucional de rechazar decisión o propuesta
vibe	vibra	f	Atmósfera o sentimiento emocional distintivo informal
vibration	vibración	f	Movimiento rápido repetido hacia adelante y atrás
vice	vicio	m	Comportamiento inmoral o malo o dispositivo de sujeción
vicinity	vecindad	f	Área cerca o alrededor de lugar particular
victim	víctima	f	Persona dañada herida o matada como resultado de evento
victor	vencedor	m	Persona que derrota enemigo u oponente
victory	victoria	f	Acto de derrotar enemigo u oponente en batalla
video	video	m	Grabación de imágenes en movimiento visual o tecnología
videoconference	videoconferencia	f	Conferencia con participantes en ubicaciones remotas usando video
view	vista	f	Capacidad de ver algo o opinión o perspectiva visual
village	aldea	f	Grupo de casas y edificios menor que pueblo
villain	villano	m	Persona culpable o capaz de crimen o maldad
vine	vid	f	Planta trepadora o rastrera especialmente la que produce uvas
vinegar	vinagre	m	Líquido ácido punzante hecho de vino fermentado
vineyard	viñedo	m	Plantación de vides de uva especialmente para vinificación
vintage	cosecha	f	Año o lugar en que se produjo vino o período pasado
viola	viola	f	Instrumento de cuerda más grande que violín
violation	violación	f	Acción de violar alguien o algo especialmente ley
violence	violencia	f	Comportamiento con fuerza física para herir o dañar
violet	violeta	f	Planta con flores púrpuras azules o color entre azul y rojo
violin	violín	m	Instrumento musical de cuerda con arco más pequeño de familia
violinist	violinista	m	Persona que toca el violín como profesión o afición
virgin	virgen	f	Persona que nunca ha tenido relaciones sexuales
Virginia	Virginia	f	Estado estadounidense en costa este o nombre propio
virtue	virtud	f	Comportamiento o cualidades morales buenas o ventaja útil
virus	virus	m	Agente infeccioso que se replica dentro de células vivas
visa	visa	f	Endoso en pasaporte permitiendo entrar o salir de país
visibility	visibilidad	f	Estado de poder ser visto o distancia que se puede ver
vision	visión	f	Facultad de ver o imagen mental de futuro
visitor	visitante	m	Persona que visita persona o lugar temporalmente
vital	vital	m	Órgano o parte del cuerpo esencial para vida
vitamin	vitamina	f	Sustancia orgánica esencial en pequeñas cantidades para salud
vocabulary	vocabulario	m	Cuerpo de palabras usadas en lengua particular
