en	translation	gender	meaning_translation
formula	fórmula	f	Expresión matemática o receta
formulation	formulación	f	Creación de una fórmula o plan
fort	fuerte	m	Estructura militar fortificada
forth	adelante	m	Hacia delante
fortieth	cuadragésimo	m	Posición número 40
fortune	fortuna	f	Riqueza o suerte
forty	cuarenta	m	Número 40
fossil	fósil	m	Resto de organismo antiguo preservado
foster	fomento	m	Cuidado temporal o estímulo
foul	falta	f	Violación de regla o cosa repugnante
foundation	fundación	f	Base o institución benéfica
four	cuatro	m	Número 4
fourteen	catorce	m	Número 14
fourteenth	decimocuarto	m	Posición número 14
fourth	cuarto	m	Posición número 4
fowl	ave	f	Ave doméstica o de caza
fox	zorro	m	Mamífero carnívoro pequeño
fraction	fracción	f	Parte pequeña o número quebrado
fracture	fractura	f	Rotura especialmente de hueso
frame	marco	m	Estructura que rodea algo
franchise	franquicia	f	Autorización para vender productos
frank	franco	m	Moneda o persona directa
fraternity	fraternidad	f	Hermandad o asociación
fraud	fraude	m	Engaño para obtener beneficio
fray	riña	f	Pelea o deshilachado
freak	fenómeno	m	Cosa o persona muy inusual
freebie	regalo	m	Algo gratis
freedom	libertad	f	Estado de ser libre
freeze	congelación	f	Acto de convertir en hielo
freight	carga	f	Mercancías transportadas
French	francés	m	De Francia o idioma francés
frequency	frecuencia	f	Tasa de repetición
fret	preocupación	f	Ansiedad o barra en guitarra
Friday	viernes	m	Quinto día de la semana
friend	amigo	m	Persona con quien se tiene afecto
friendship	amistad	f	Relación de amigos
fright	susto	m	Terror repentino
frill	volante	m	Adorno ornamental
front	frente	m	Parte delantera
fruit	fruta	f	Producto comestible de planta
fuel	combustible	m	Material que produce energía
fun	diversión	f	Disfrute o entretenimiento
fund	fondo	m	Suma de dinero para propósito
funeral	funeral	m	Ceremonia de entierro
future	futuro	m	Tiempo que vendrá
gain	ganancia	f	Aumento o beneficio obtenido
game	juego	m	Actividad recreativa con reglas
garage	garaje	m	Edificio para vehículos
garden	jardín	m	Terreno para cultivar plantas
gas	gas	m	Sustancia en estado gaseoso
gate	puerta	f	Entrada o salida con abertura
gear	equipo	m	Herramientas o engranaje
gender	género	m	Clasificación en masculino o femenino
generation	generación	f	Grupo de edad similar
gift	regalo	m	Cosa dada voluntariamente
girl	niña	f	Persona joven femenina
glass	vidrio	m	Material transparente o vaso
goal	meta	f	Objetivo o punto en deporte
god	dios	m	Ser supremo o deidad
gold	oro	m	Metal precioso amarillo
golf	golf	m	Deporte con palos y pelota
government	gobierno	m	Sistema de autoridad política
grade	grado	m	Nivel o calificación
grandfather	abuelo	m	Padre del padre o madre
grandmother	abuela	f	Madre del padre o madre
grant	subvención	f	Suma de dinero dada
grass	hierba	f	Planta verde pequeña
ground	suelo	m	Superficie de la tierra
group	grupo	m	Conjunto de personas o cosas
growth	crecimiento	m	Proceso de crecer
guard	guardia	m	Persona que protege
guess	suposición	f	Opinión sin certeza
guest	invitado	m	Persona recibida como visitante
guide	guía	m	Persona que dirige o libro instructivo
guilt	culpa	f	Sentimiento de haber hecho mal
habit	hábito	m	Costumbre o ropa religiosa
hair	cabello	m	Filamentos que crecen en la piel
half	mitad	f	Una de dos partes iguales
hall	sala	f	Espacio amplio o corredor
hand	mano	f	Parte final del brazo
handle	mango	m	Parte para agarrar o nombre
happiness	felicidad	f	Estado de alegría
harm	daño	m	Perjuicio físico o moral
hat	sombrero	m	Prenda para cubrir la cabeza
hate	odio	m	Sentimiento intenso de aversión
head	cabeza	f	Parte superior del cuerpo
health	salud	f	Estado de bienestar físico
hearing	audiencia	f	Capacidad de oír o reunión legal
heart	corazón	m	Órgano que bombea sangre
heat	calor	m	Energía térmica o competencia preliminar
heaven	cielo	m	Lugar de dicha eterna
height	altura	f	Distancia vertical
hell	infierno	m	Lugar de castigo eterno
help	ayuda	f	Asistencia o apoyo
hero	héroe	m	Persona admirada por valentía
hill	colina	f	Elevación natural del terreno
hint	pista	f	Indicio sutil o sugerencia
history	historia	f	Estudio del pasado
hobby	pasatiempo	m	Actividad de ocio
hold	agarre	m	Acción de agarrar o bodega
hole	agujero	m	Abertura o cavidad
holiday	vacaciones	f	Día festivo o período de descanso
home	hogar	m	Lugar donde se vive
honey	miel	f	Sustancia dulce hecha por abejas
honor	honor	m	Respeto o distinción
hope	esperanza	f	Sentimiento de expectativa
horror	horror	m	Terror intenso
horse	caballo	m	Animal equino domesticado
hospital	hospital	m	Institución de atención médica
host	anfitrión	m	Persona que recibe invitados
hotel	hotel	m	Establecimiento de alojamiento
hour	hora	f	Período de 60 minutos
house	casa	f	Edificio para vivir
housing	vivienda	f	Alojamiento o carcasa
human	humano	m	Ser de la especie Homo sapiens
humor	humor	m	Estado de ánimo o comedia
hunger	hambre	f	Necesidad de comer
hunt	cacería	f	Búsqueda o persecución de presas
hurt	dolor	m	Sufrimiento físico o emocional
husband	esposo	m	Hombre casado respecto a su pareja
ice	hielo	m	Agua congelada
idea	idea	f	Pensamiento o concepto
identity	identidad	f	Características que definen a alguien
ideology	ideología	f	Sistema de ideas políticas
illness	enfermedad	f	Estado de mala salud
imagination	imaginación	f	Facultad de crear imágenes mentales
impact	impacto	m	Efecto fuerte o colisión
implication	implicación	f	Consecuencia o sugerencia indirecta
import	importación	f	Mercancía traída del extranjero
importance	importancia	f	Cualidad de ser significativo
impression	impresión	f	Efecto producido en la mente
improvement	mejora	f	Acto de hacer algo mejor
inch	pulgada	f	Unidad de longitud
income	ingreso	m	Dinero recibido
increase	aumento	m	Crecimiento en tamaño o cantidad
independence	independencia	f	Estado de autogobierno
indication	indicación	f	Señal o signo
individual	individuo	m	Persona única
industry	industria	f	Actividad económica o sector
infection	infección	f	Invasión de microorganismos
inflation	inflación	f	Aumento general de precios
influence	influencia	f	Capacidad de afectar algo
information	información	f	Datos o conocimiento comunicado
initiative	iniciativa	f	Capacidad de comenzar algo
injury	lesión	f	Daño físico al cuerpo
innovation	innovación	f	Introducción de algo nuevo
inquiry	investigación	f	Búsqueda de información
insect	insecto	m	Artrópodo de seis patas
inspiration	inspiración	f	Estímulo creativo o divino
installation	instalación	f	Acto de instalar o equipamiento
instance	instancia	f	Ejemplo u ocasión
institution	institución	f	Organización establecida
instruction	instrucción	f	Enseñanza o dirección
insurance	seguro	m	Protección contra riesgo
intelligence	inteligencia	f	Capacidad mental o información
intention	intención	f	Propósito o plan
interest	interés	m	Curiosidad o beneficio financiero
interior	interior	m	Parte interna
interpretation	interpretación	f	Explicación o traducción oral
interview	entrevista	f	Reunión formal de preguntas
introduction	introducción	f	Presentación o comienzo
invasion	invasión	f	Entrada por fuerza militar
investment	inversión	f	Dinero puesto para ganancia
invitation	invitación	f	Solicitud para asistir
involvement	participación	f	Acto de tomar parte
iron	hierro	m	Metal gris duro o electrodoméstico
island	isla	f	Tierra rodeada de agua
issue	asunto	m	Tema importante o publicación
Italy	Italia	f	País europeo mediterráneo
itch	picazón	f	Sensación que provoca rascarse
ivory	marfil	m	Material duro de colmillos
ivy	hiedra	f	Planta trepadora verde
jack	gato	m	Dispositivo para levantar o carta
jacket	chaqueta	f	Prenda exterior corta
jail	cárcel	f	Prisión para criminales
jam	mermelada	f	Conserva de frutas o atasco
January	enero	m	Primer mes del año
Japan	Japón	m	País insular asiático
Japanese	japonés	m	De Japón o idioma japonés
jar	frasco	m	Recipiente de vidrio o sacudida
jaw	mandíbula	f	Estructura ósea de la boca
jazz	jazz	m	Género musical estadounidense
jealousy	celos	m	Envidia o temor de perder afecto
jeans	jeans	m	Pantalones de mezclilla
jelly	gelatina	f	Sustancia gelatinosa dulce
jellyfish	medusa	f	Animal marino gelatinoso
jerk	tirón	m	Movimiento brusco o persona desagradable
jesus	Jesús	m	Figura central del cristianismo
jewel	joya	f	Piedra preciosa
jewelry	joyería	f	Adornos personales de valor
job	trabajo	m	Empleo o tarea
jock	deportista	m	Atleta o persona atlética
jogging	trote	m	Carrera suave como ejercicio
john	Juan	m	Nombre propio o baño
jot	pizca	f	Cantidad muy pequeña
journal	diario	m	Publicación periódica o registro
journalism	periodismo	m	Profesión de reportar noticias
journalist	periodista	m	Profesional de las noticias
journey	viaje	m	Acto de viajar de un lugar a otro
joy	alegría	f	Sentimiento de gran placer
judge	juez	m	Oficial que decide casos legales
judgement	juicio	m	Decisión u opinión formada
judgment	juicio	m	Decisión u opinión formada
judiciary	poder	m	Sistema de tribunales
jug	jarra	f	Recipiente con asa y pico
juice	jugo	m	Líquido de frutas o verduras
July	julio	m	Séptimo mes del año
jump	salto	m	Acto de impulsarse hacia arriba
jumper	suéter	m	Prenda de punto o saltador
junction	cruce	m	Punto de unión o intersección
June	junio	m	Sexto mes del año
jungle	selva	f	Bosque tropical denso
junior	júnior	m	Persona más joven o de rango inferior
jupiter	Júpiter	m	Planeta más grande del sistema solar
jurisdiction	jurisdicción	f	Autoridad legal oficial
juror	jurado	m	Miembro de un jurado
jury	jurado	m	Grupo que decide en tribunal
justice	justicia	f	Equidad o sistema legal
key	llave	f	Instrumento para abrir cerradura
kick	patada	f	Golpe con el pie
kid	niño	m	Niño o cría de cabra
kill	muerte	f	Acto de matar o presa cazada
kind	tipo	m	Clase o categoría
king	rey	m	Monarca masculino
kitchen	cocina	f	Habitación para preparar comida
knee	rodilla	f	Articulación de la pierna
knife	cuchillo	m	Herramienta cortante con hoja
labor	trabajo	m	Esfuerzo físico o parto
lack	falta	f	Ausencia o carencia de algo
lady	dama	f	Mujer de modales refinados
lake	lago	m	Cuerpo grande de agua dulce
land	tierra	f	Superficie sólida del planeta
lane	carril	m	Subdivisión de carretera o camino
language	idioma	m	Sistema de comunicación verbal
lap	regazo	m	Parte superior de las piernas sentadas
lash	azote	m	Golpe con látigo o pestaña
last	último	m	Final o que viene después de todos
latest	último	m	Más reciente
latin	latín	m	Idioma antiguo romano
latitude	latitud	f	Distancia angular desde ecuador
laugh	risa	f	Sonido de diversión
launch	lanzamiento	m	Acto de comenzar o impulsar
laundry	lavandería	f	Lugar o ropa para lavar
laurel	laurel	m	Árbol aromático perenne
lavender	lavanda	f	Planta aromática de flores púrpura
law	ley	f	Regla establecida por autoridad
lawsuit	demanda	f	Caso legal civil
lawyer	abogado	m	Profesional del derecho
layoff	despido	m	Terminación de empleo
layout	diseño	m	Disposición o plan de algo
lead	plomo	m	Metal pesado gris
leader	líder	m	Persona que dirige un grupo
leadership	liderazgo	m	Acción de dirigir un grupo
leaf	hoja	f	Parte plana y verde de planta
leak	fuga	f	Escape de líquido o gas
lean	inclinación	f	Desviación de vertical
lease	arrendamiento	m	Contrato de alquiler
leather	cuero	m	Material de piel de animal curtida
leave	permiso	m	Autorización de ausencia
lecture	conferencia	f	Discurso educativo
ledge	repisa	f	Superficie horizontal estrecha
left	izquierda	f	Lado opuesto a la derecha
leftover	sobra	f	Comida no consumida
leg	pierna	f	Extremidad para caminar
legality	legalidad	f	Conformidad con la ley
legalization	legalización	f	Acto de hacer legal algo
legend	leyenda	f	Historia tradicional o inscripción
legion	legión	f	Unidad militar romana o multitud
legislation	legislación	f	Proceso de hacer leyes
leisure	ocio	m	Tiempo libre para placer
lemon	limón	m	Fruta cítrica ácida amarilla
lemonade	limonada	f	Bebida de jugo de limón
length	longitud	f	Medida de extremo a extremo
leopard	leopardo	m	Gran felino manchado
lesson	lección	f	Enseñanza o clase
letter	carta	f	Mensaje escrito o símbolo alfabético
lettuce	lechuga	f	Planta de hojas comestibles
level	nivel	m	Posición en escala o superficie plana
liability	responsabilidad	f	Obligación legal o desventaja
liaison	enlace	m	Conexión o comunicación entre grupos
liar	mentiroso	m	Persona que no dice la verdad
liberalization	liberalización	f	Relajación de restricciones
library	biblioteca	f	Colección de libros o edificio
license	licencia	f	Permiso oficial o libertad
lie	mentira	f	Declaración falsa
life	vida	f	Condición de estar vivo
lift	ascensor	m	Dispositivo para elevar o ayuda
light	luz	f	Radiación visible
limit	límite	m	Punto máximo permitido
line	línea	f	Marca larga o fila
link	enlace	m	Conexión o elemento de cadena
list	lista	f	Serie de nombres o elementos
literature	literatura	f	Obras escritas de valor artístico
loan	préstamo	m	Dinero prestado temporalmente
location	ubicación	f	Lugar o posición
lock	cerradura	f	Dispositivo de seguridad
London	Londres	m	Capital de Inglaterra
longevity	longevidad	f	Larga duración de vida
look	mirada	f	Acto de ver o apariencia
lookout	vigilancia	f	Observación atenta o puesto
loom	telar	m	Marco para tejer o aparecer
loophole	laguna	f	Vacío legal o abertura
lord	señor	m	Dueño o título noble
loser	perdedor	m	Persona que pierde
loss	pérdida	f	Acto de perder algo
lot	lote	m	Porción o terreno
lottery	lotería	f	Juego de azar con premios
lotus	loto	m	Planta acuática sagrada
lounge	salón	m	Sala de estar o descanso
love	amor	m	Afecto profundo
lover	amante	m	Persona en relación romántica
low	mínimo	m	Punto bajo o depresión
loyalty	lealtad	f	Fidelidad a persona o causa
luck	suerte	f	Éxito o fracaso por azar
luggage	equipaje	m	Maletas para viajar
lull	pausa	f	Período temporal de calma
lumber	madera	f	Madera cortada para construcción
lump	bulto	m	Masa compacta o hinchazón
lunch	almuerzo	m	Comida del mediodía
lunchtime	hora	f	Tiempo para el almuerzo
lung	pulmón	m	Órgano respiratorio
lure	señuelo	m	Cosa que atrae o anzuelo
luxury	lujo	m	Estado de comodidad costosa
lynx	lince	m	Felino salvaje de orejas puntiagudas
lyric	letra	f	Palabras de una canción
machine	máquina	f	Aparato con partes móviles
macroeconomics	macroeconomía	f	Economía a gran escala
mad	loco	m	Persona sin cordura
madam	señora	f	Tratamiento formal para mujer
madness	locura	f	Estado de demencia
magazine	revista	f	Publicación periódica ilustrada
magic	magia	f	Arte de ilusión o poder sobrenatural
magician	mago	m	Persona con poderes mágicos o habilidades ilusionistas
magistrate	magistrado	m	Juez de bajo rango; funcionario judicial
magnesium	magnesio	m	Elemento químico metálico plateado
magnet	imán	m	Objeto que atrae hierro y otros metales
magnetism	magnetismo	m	Fuerza de atracción; cualidad personal atractiva
magnolia	magnolia	f	Árbol con flores grandes y fragantes
maid	criada	f	Empleada doméstica; sirvienta
mail	correo	m	Sistema postal; cartas y paquetes
main	principal	m	Tubería o cable principal; lo más importante
mainstream	corriente principal	f	Tendencia dominante; cultura mayoritaria
majesty	majestad	f	Dignidad real; grandeza imponente
major	mayor	m	Rango militar; especialización universitaria
majority	mayoría	f	Número mayor; más de la mitad
mall	centro comercial	m	Complejo de tiendas bajo un mismo techo
man	hombre	m	Ser humano adulto masculino
management	gestión	f	Administración; dirección de organización
manager	gerente	m	Director; administrador; supervisor
manner	manera	f	Forma de hacer; comportamiento; estilo
map	mapa	m	Representación geográfica; diagrama
March	marzo	m	Tercer mes del año
mark	marca	f	Señal; huella; calificación; moneda alemana
market	mercado	m	Lugar de compraventa; economía; demanda
marriage	matrimonio	m	Unión legal de dos personas; casamiento
match	fósforo	m	Palito inflamable; partido; pareja adecuada
material	material	m	Sustancia; tela; contenido; materia
matter	asunto	m	Tema; problema; sustancia; importancia
May	mayo	m	Quinto mes del año
mayor	alcalde	m	Funcionario electo de ciudad o municipio
maze	laberinto	m	Red compleja de caminos; confusión
meadow	pradera	f	Campo de hierba; prado
meal	comida	f	Alimento consumido en una ocasión; harina
meaning	significado	m	Sentido; definición; propósito
means	medios	m	Recursos; método; forma de lograr algo
meantime	mientras tanto	m	Tiempo intermedio; intervalo
measure	medida	f	Dimensión; acción; ley; compás musical
measurement	medición	f	Acto de medir; dimensión determinada
meat	carne	f	Tejido muscular animal como alimento
mechanics	mecánica	f	Ciencia del movimiento y fuerzas; funcionamiento
medal	medalla	f	Disco conmemorativo; premio; condecoración
media	medios	m	Medios de comunicación masiva
mediation	mediación	f	Intervención para resolver conflicto
medic	médico	m	Profesional de salud; paramédico militar
medication	medicamento	m	Droga o sustancia para tratar enfermedad
medicine	medicina	f	Ciencia médica; fármaco; remedio
meditation	meditación	f	Reflexión profunda; práctica contemplativa
meeting	reunión	f	Encuentro; junta; asamblea
melody	melodía	f	Secuencia musical agradable; tonada
melon	melón	m	Fruta grande jugosa con corteza dura
member	miembro	m	Parte del cuerpo; integrante de grupo
membership	membresía	f	Condición de miembro; afiliación
membrane	membrana	f	Capa delgada que cubre o separa
memorandum	memorándum	m	Nota breve; documento informativo
memorial	memorial	m	Monumento conmemorativo; homenaje
memory	memoria	f	Capacidad de recordar; recuerdo; almacenamiento
menace	amenaza	f	Peligro; riesgo; intimidación
mentality	mentalidad	f	Modo de pensar; actitud mental
mention	mención	f	Referencia breve; acción de nombrar
mentor	mentor	m	Consejero experimentado; guía
menu	menú	m	Lista de platillos; opciones de comida
merchandise	mercancía	f	Productos para vender; bienes comerciales
merchant	comerciante	m	Vendedor; negociante; mercader
mercury	mercurio	m	Metal líquido plateado; planeta; mensajero divino
mercy	misericordia	f	Compasión; clemencia; perdón
merger	fusión	f	Unión de empresas; combinación
merit	mérito	m	Cualidad digna de alabanza; valor
merlion	merlion	m	Estatua mitad león mitad pez de Singapur
mesh	malla	f	Red; entretejido; engranaje
mess	desorden	m	Suciedad; confusión; comedor militar
messenger	mensajero	m	Portador de mensajes; enviado
metal	metal	m	Elemento químico conductor; material duro
meteor	meteoro	m	Cuerpo celeste que entra en atmósfera
meter	metro	m	Unidad de longitud; medidor; ritmo poético
method	método	m	Procedimiento; técnica; sistema ordenado
metropolis	metrópolis	f	Ciudad grande; centro urbano principal
Mexico	México	m	País de América del Norte
middle	medio	m	Centro; parte equidistante de extremos
milk	leche	f	Líquido blanco nutritivo de mamíferos
mind	mente	f	Facultad mental; intelecto; opinión
minor	menor	m	Persona no adulta; tema secundario; escala musical
minute	minuto	m	Unidad de tiempo de 60 segundos
mirror	espejo	m	Superficie reflectante; modelo a imitar
miss	señorita	f	Tratamiento para mujer soltera; falta
mistake	error	m	Equivocación; falta; malentendido
mix	mezcla	f	Combinación; preparación premezclada
mixture	mezcla	f	Combinación de sustancias; diversidad
moai	moai	m	Estatua monolítica de Isla de Pascua
moan	gemido	m	Sonido de dolor o placer; queja
mob	turba	f	Multitud violenta; mafia; muchedumbre
mobile	móvil	m	Objeto colgante decorativo; teléfono celular
mockery	burla	f	Ridiculización; imitación despectiva
model	modelo	m	Representación; ejemplo; persona que posa
moderation	moderación	f	Evitación de extremos; templanza
modernism	modernismo	m	Movimiento cultural contemporáneo
modesty	modestia	f	Humildad; pudor; sencillez
molecule	molécula	f	Unidad química más pequeña de sustancia
mom	mamá	f	Madre; término cariñoso familiar
moment	momento	m	Instante; ocasión; importancia
momentum	impulso	m	Fuerza de movimiento; ímpetu; inercia
monarchy	monarquía	f	Gobierno de rey o reina; reino
Monday	lunes	m	Segundo día de la semana
money	dinero	m	Medio de intercambio; moneda; riqueza
monk	monje	m	Hombre religioso que vive en monasterio
monkey	mono	m	Primate con cola; persona traviesa
monologue	monólogo	m	Discurso de una sola persona
monopoly	monopolio	m	Control exclusivo de mercado; juego de mesa
monotone	monotonía	f	Sonido sin variación de tono; uniformidad
monster	monstruo	m	Criatura horrible; persona cruel; cosa enorme
montana	Montana	m	Estado montañoso del noroeste de EE.UU.
montmartre	Montmartre	m	Barrio artístico de París con basílica
monument	monumento	m	Estructura conmemorativa; obra notable
mood	humor	m	Estado emocional; atmósfera; modo verbal
moon	luna	f	Satélite natural de la Tierra; mes lunar
moonlight	luz de luna	f	Iluminación nocturna de la luna
mop	trapeador	m	Utensilio para limpiar pisos; mata de pelo
moral	moral	f	Lección ética; principio de conducta
morality	moralidad	f	Principios de bien y mal; virtud
morning	mañana	f	Parte del día hasta mediodía
mortality	mortalidad	f	Condición de ser mortal; tasa de muertes
mortgage	hipoteca	f	Préstamo garantizado con propiedad
mosaic	mosaico	m	Arte de piezas coloreadas; mezcla diversa
mosque	mezquita	f	Templo islámico; lugar de oración musulmán
moss	musgo	m	Planta pequeña verde sin flores
moth	polilla	f	Insecto nocturno parecido a mariposa
mother	madre	f	Progenitora femenina; origen; superiora
motion	movimiento	m	Acción de moverse; propuesta; gesto
motivation	motivación	f	Razón para actuar; incentivo; impulso
mount	monte	m	Montaña; soporte; animal para montar
mountain	montaña	f	Elevación natural grande de terreno
mouse	ratón	m	Roedor pequeño; dispositivo de computadora
mouth	boca	f	Abertura para comer y hablar; entrada
mouthful	bocado	m	Cantidad que cabe en la boca
movement	movimiento	m	Acción de moverse; corriente; parte de sinfonía
movie	película	f	Film cinematográfico; largometraje
mr	señor	m	Tratamiento formal para hombre
mrs	señora	f	Tratamiento formal para mujer casada
murder	asesinato	m	Homicidio intencional; crimen grave
muscle	músculo	m	Tejido corporal contráctil; fuerza
music	música	f	Arte de sonidos organizados; composición
nail	clavo	m	Pieza metálica puntiaguda; uña de dedo
name	nombre	m	Palabra que identifica; reputación; fama
nation	nación	f	País; pueblo con gobierno propio
nature	naturaleza	f	Mundo físico; esencia; carácter
neck	cuello	m	Parte que une cabeza y cuerpo
need	necesidad	f	Requerimiento; carencia; urgencia
negotiation	negociación	f	Discusión para llegar a acuerdo
neighbor	vecino	m	Persona que vive cerca; país limítrofe
neighborhood	vecindario	m	Área residencial; barrio; comunidad local
nest	nido	m	Refugio de aves; hogar acogedor
net	red	f	Malla; trampa; internet; cantidad neta
network	red	f	Sistema interconectado; cadena; contactos
neuron	neurona	f	Célula nerviosa del sistema nervioso
neutral	neutro	m	Posición imparcial; punto muerto; color
neutron	neutrón	m	Partícula subatómica sin carga
newbie	novato	m	Principiante; persona nueva e inexperta
news	noticias	f	Información reciente; novedades; reportaje
newspaper	periódico	m	Publicación diaria de noticias; diario
niche	nicho	m	Hueco en pared; mercado especializado
nick	muesca	f	Corte pequeño; momento preciso; cárcel
nickel	níquel	m	Metal plateado; moneda de cinco centavos
night	noche	f	Período oscuro entre día y día
nightingale	ruiseñor	m	Ave canora nocturna; enfermera famosa
nightmare	pesadilla	f	Sueño terrible; experiencia angustiante
nikujaga	nikujaga	m	Estofado japonés de carne y papas
nine	nueve	m	Número cardinal entre ocho y diez
nineteen	diecinueve	m	Número cardinal 19
nineteenth	decimonoveno	m	Posición ordinal número 19
ninetieth	nonagésimo	m	Posición ordinal número 90
ninety	noventa	m	Número cardinal 90
ninth	noveno	m	Posición ordinal número 9
nip	pellizco	m	Mordisco pequeño; trago; frío intenso
nitrogen	nitrógeno	m	Gas incoloro que forma el aire
no	no	m	Negación; rechazo; voto negativo
nobility	nobleza	f	Aristocracia; cualidad noble; grandeza
noise	ruido	m	Sonido fuerte o desagradable; disturbio
nomination	nominación	f	Propuesta de candidato; designación
nonsense	tontería	f	Palabras sin sentido; absurdo
noodle	fideo	m	Pasta larga delgada; tallarín
noon	mediodía	m	Las doce del día; momento central
norm	norma	f	Estándar; regla; patrón común
normal	normal	m	Estado habitual; persona promedio
north	norte	m	Punto cardinal opuesto al sur
northeast	noreste	m	Dirección entre norte y este
northward	hacia el norte	m	Dirección o movimiento al norte
northwest	noroeste	m	Dirección entre norte y oeste
nose	nariz	f	Órgano del olfato; parte frontal de algo
note	nota	f	Apunte; mensaje breve; sonido musical; billete
notebook	cuaderno	m	Libreta para escribir; computadora portátil
nothing	nada	f	Ausencia de algo; cero; insignificancia
notice	aviso	m	Anuncio; advertencia; atención; notificación
notion	noción	f	Idea; concepto; conocimiento básico
novelist	novelista	m	Autor de novelas; escritor literario
novelty	novedad	f	Cosa nueva; innovación; artículo novedoso
November	noviembre	m	Undécimo mes del año
nucleus	núcleo	m	Centro; parte esencial; corazón de célula
nude	desnudo	m	Persona sin ropa; representación artística
number	número	m	Cifra; cantidad; canción; ejemplar
numeral	numeral	m	Símbolo que representa número
nun	monja	f	Mujer religiosa que vive en convento
nurse	enfermera	f	Profesional de cuidado médico
nut	nuez	f	Fruto seco comestible; tuerca; persona loca
nutria	nutria	f	Mamífero acuático con pelaje denso
nutrient	nutriente	m	Sustancia que proporciona alimento
nutrition	nutrición	f	Proceso de alimentarse; ciencia dietética
nylon	nailon	m	Fibra sintética; tela artificial resistente
oak	roble	m	Árbol de madera dura; símbolo de fuerza
oasis	oasis	m	Lugar verde en desierto; refugio
oat	avena	f	Cereal nutritivo; grano para desayuno
obedience	obediencia	f	Cumplimiento de órdenes; sumisión
