en	translation	gender	meaning_translation
constitution	泻芯薪褋褌懈褌褍褑懈褟	f	芯褋薪芯胁薪褘械 锌褉懈薪褑懈锌褘 懈谢懈 褍褋褌邪薪芯胁谢械薪薪褘械 锌褉械褑械写械薪褌褘, 泻芯褌芯褉褘械 褍锌褉邪胁谢褟褞褌 谐芯褋褍写邪褉褋褌胁芯屑 懈谢懈 芯褉谐邪薪懈蟹邪褑懈械泄
constraint	芯谐褉邪薪懈褔械薪懈械	n	芯谐褉邪薪懈褔械薪懈械 懈谢懈 芯谐褉邪薪懈褔械薪懈械, 薪邪谢芯卸械薪薪芯械 薪邪 褔褌芯-谢懈斜芯
construction	褋褌褉芯懈褌械谢褜褋褌胁芯	n	锌褉芯褑械褋褋 褋褌褉芯懈褌械谢褜褋褌胁邪 懈谢懈 褋斜芯褉泻懈 褔械谐芯-谢懈斜芯
consulate	泻芯薪褋褍谢褜褋褌胁芯	n	芯褎懈褋 懈谢懈 褉械蟹懈写械薪褑懈褟 泻芯薪褋褍谢邪
consultancy	泻芯薪褋邪谢褌懈薪谐	m	锌褉芯褎械褋褋懈芯薪邪谢褜薪邪褟 锌褉邪泻褌懈泻邪, 泻芯褌芯褉邪褟 锌褉械写芯褋褌邪胁谢褟械褌 褝泻褋锌械褉褌薪褘械 泻芯薪褋褍谢褜褌邪褑懈懈 胁 芯锌褉械写械谢褢薪薪芯泄 芯斜谢邪褋褌懈
consultation	泻芯薪褋褍谢褜褌邪褑懈褟	f	胁褋褌褉械褔邪 褋 褝泻褋锌械褉褌芯屑 写谢褟 锌芯谢褍褔械薪懈褟 泻芯薪褋褍谢褜褌邪褑懈懈 懈谢懈 芯斜褋褍卸写械薪懈褟 泻芯薪泻褉械褌薪芯谐芯 胁芯锌褉芯褋邪
consulting	泻芯薪褋邪谢褌懈薪谐	m	斜懈蟹薪械褋 锌芯 锌褉械写芯褋褌邪胁谢械薪懈褞 锌褉芯褎械褋褋懈芯薪邪谢褜薪褘褏 懈谢懈 褝泻褋锌械褉褌薪褘褏 泻芯薪褋褍谢褜褌邪褑懈泄 写褉褍谐懈屑 蟹邪 锌谢邪褌褍
consumer	锌芯褌褉械斜懈褌械谢褜	m	褔械谢芯胁械泻, 泻芯褌芯褉褘泄 锌芯泻褍锌邪械褌 褌芯胁邪褉褘 懈 褍褋谢褍谐懈 写谢褟 谢懈褔薪芯谐芯 锌芯谢褜蟹芯胁邪薪懈褟
consumption	锌芯褌褉械斜谢械薪懈械	n	写械泄褋褌胁懈械 懈褋锌芯谢褜蟹芯胁邪薪懈褟 褉械褋褍褉褋邪 懈谢懈 褍锌芯褌褉械斜谢械薪懈褟 褔械谐芯-谢懈斜芯 胁 锌懈褖褍
contact	泻芯薪褌邪泻褌	m	胁褋褌褉械褔邪 懈谢懈 芯斜褖械薪懈械 褋 泻械屑-谢懈斜芯
container	泻芯薪褌械泄薪械褉	m	芯斜褗械泻褌, 懈褋锌芯谢褜蟹褍械屑褘泄 写谢褟 褏褉邪薪械薪懈褟 懈谢懈 褌褉邪薪褋锌芯褉褌懈褉芯胁泻懈 褔械谐芯-谢懈斜芯
contamination	蟹邪褉邪卸械薪懈械	n	写械泄褋褌胁懈械 懈谢懈 褋芯褋褌芯褟薪懈械 蟹邪谐褉褟蟹薪械薪懈褟 褔械谐芯-谢懈斜芯 蟹邪谐褉褟蟹薪褟褞褖懈屑 胁械褖械褋褌胁芯屑
contempt	锌褉械蟹褉械薪懈械	n	褔褍胁褋褌胁芯, 褔褌芯 褔械谢芯胁械泻 懈谢懈 胁械褖褜 薪懈卸械 胁薪懈屑邪薪懈褟 懈谢懈 薪械 懈屑械械褌 褑械薪薪芯褋褌懈
content	褋芯写械褉卸邪薪懈械	n	胁械褖懈, 泻芯褌芯褉褘械 褋芯写械褉卸邪褌褋褟 胁 褔褢屑-谢懈斜芯
contention	褍褌胁械褉卸写械薪懈械	n	谐芯褉褟褔械械 褉邪蟹薪芯谐谢邪褋懈械 懈谢懈 褍褌胁械褉卸写械薪懈械, 褋写械谢邪薪薪芯械 胁 褋锌芯褉械
contest	泻芯薪泻褍褉褋	m	泻芯薪泻褍褉械薪褑懈褟 屑械卸写褍 褋芯锌械褉薪懈泻邪屑懈 蟹邪 锌褉械胁芯褋褏芯写褋褌胁芯 懈谢懈 锌褉懈蟹
context	泻芯薪褌械泻褋褌	m	芯斜褋褌芯褟褌械谢褜褋褌胁邪 懈谢懈 芯斜褋褌邪薪芯胁泻邪, 胁 泻芯褌芯褉芯泄 锌褉芯懈褋褏芯写懈褌 褋芯斜褘褌懈械
continent	泻芯薪褌懈薪械薪褌	m	芯写懈薪 懈蟹 芯褋薪芯胁薪褘褏 薪械锌褉械褉褘胁薪褘褏 屑邪褋褋懈胁芯胁 褋褍褕懈 屑懈褉邪
contingent	泻芯薪褌懈薪谐械薪褌	m	谐褉褍锌锌邪 谢褞写械泄, 芯斜褉邪蟹褍褞褖邪褟 褔邪褋褌褜 斜芯谢褜褕械泄 谐褉褍锌锌褘
continuation	锌褉芯写芯谢卸械薪懈械	n	写械泄褋褌胁懈械 锌褉芯写芯谢卸械薪懈褟 褔械谐芯-谢懈斜芯 懈谢懈 锌芯写写械褉卸邪薪懈褟 锌褉芯褑械褋褋邪 斜械蟹 锌褉械褉褘胁邪薪懈褟
continuity	薪械锌褉械褉褘胁薪芯褋褌褜	f	薪械锌褉械褉褘胁薪芯械 懈 锌芯褋谢械写芯胁邪褌械谢褜薪芯械 褋褍褖械褋褌胁芯胁邪薪懈械 懈谢懈 褎褍薪泻褑懈芯薪懈褉芯胁邪薪懈械 褔械谐芯-谢懈斜芯 褋 褌械褔械薪懈械屑 胁褉械屑械薪懈
contour	泻芯薪褌褍褉	m	芯褔械褉褌邪薪懈械 褎懈谐褍褉褘 懈谢懈 褎芯褉屑褘
contract	泻芯薪褌褉邪泻褌	m	锌懈褋褜屑械薪薪芯械 懈谢懈 褍褋褌薪芯械 褋芯谐谢邪褕械薪懈械, 锌褉械写薪邪蟹薪邪褔械薪薪芯械 写谢褟 芯斜械褋锌械褔械薪懈褟 懈褋锌芯谢薪械薪懈褟 锌芯 蟹邪泻芯薪褍
contraction	褋芯泻褉邪褖械薪懈械	n	锌褉芯褑械褋褋 褍屑械薪褜褕械薪懈褟 懈谢懈 褋芯泻褉邪褖褢薪薪邪褟 褎芯褉屑邪 褋谢芯胁邪 懈谢懈 褎褉邪蟹褘
contractor	锌芯写褉褟写褔懈泻	m	谢懈褑芯 懈谢懈 泻芯屑锌邪薪懈褟, 泻芯褌芯褉邪褟 斜械褉褢褌 薪邪 褋械斜褟 泻芯薪褌褉邪泻褌 薪邪 锌褉械写芯褋褌邪胁谢械薪懈械 屑邪褌械褉懈邪谢芯胁 懈谢懈 褉邪斜芯褔械泄 褋懈谢褘 写谢褟 锌褉芯械泻褌邪
contrary	锌褉芯褌懈胁芯锌芯谢芯卸薪芯褋褌褜	f	锌褉芯褌懈胁芯锌芯谢芯卸薪芯褋褌褜 懈谢懈 芯斜褉邪褌薪芯械 褔械屑褍-谢懈斜芯
contrast	泻芯薪褌褉邪褋褌	m	褋芯褋褌芯褟薪懈械 褉械蟹泻芯谐芯 芯褌谢懈褔懈褟 芯褌 褔械谐芯-谢懈斜芯 写褉褍谐芯谐芯 胁 褋芯锌芯褋褌邪胁谢械薪懈懈 懈谢懈 褌械褋薪芯泄 褋胁褟蟹懈
contribution	胁泻谢邪写	m	褔褌芯-褌芯, 写邪薪薪芯械 胁 芯斜褖懈泄 褎芯薪写 懈谢懈 泻芯谢谢械泻褑懈褞
control	泻芯薪褌褉芯谢褜	m	胁谢邪褋褌褜 褍锌褉邪胁谢褟褌褜 懈谢懈 胁谢懈褟褌褜 薪邪 谢褞写械泄 懈谢懈 褋芯斜褘褌懈褟
controversy	锌芯谢械屑懈泻邪	f	锌褉芯写芯谢卸懈褌械谢褜薪芯械 锌褍斜谢懈褔薪芯械 薪械褋芯谐谢邪褋懈械 懈谢懈 谐芯褉褟褔械械 芯斜褋褍卸写械薪懈械 胁芯锌褉芯褋邪 屑薪械薪懈褟
convenience	褍写芯斜褋褌胁芯	n	褋芯褋褌芯褟薪懈械 胁芯蟹屑芯卸薪芯褋褌懈 锌褉芯写芯谢卸邪褌褜 褔褌芯-谢懈斜芯 斜械蟹 褌褉褍写薪芯褋褌械泄
convention	泻芯薪胁械薪褑懈褟	f	斜芯谢褜褕邪褟 胁褋褌褉械褔邪 懈谢懈 泻芯薪褎械褉械薪褑懈褟 谢褞写械泄 褋 芯斜褖懈屑懈 懈薪褌械褉械褋邪屑懈 懈谢懈 锌褉芯褎械褋褋懈械泄
conversation	褉邪蟹谐芯胁芯褉	m	薪械褎芯褉屑邪谢褜薪褘泄 芯斜屑械薪 懈写械褟屑懈 褔械褉械蟹 褉邪蟹谐芯胁芯褉薪褘械 褋谢芯胁邪 屑械卸写褍 写胁褍屑褟 懈谢懈 斜芯谢械械 谢褞写褜屑懈
converse	锌褉芯褌懈胁芯锌芯谢芯卸薪芯褋褌褜	f	锌褉芯褌懈胁芯锌芯谢芯卸薪芯褋褌褜 懈谢懈 芯斜褉邪褌薪芯械 褍褌胁械褉卸写械薪懈褟 懈谢懈 锌褉械写谢芯卸械薪懈褟
conversion	锌褉械芯斜褉邪蟹芯胁邪薪懈械	n	锌褉芯褑械褋褋 懈蟹屑械薪械薪懈褟 懈谢懈 胁褘蟹褘胁邪薪懈褟 懈蟹屑械薪械薪懈褟 褔械谐芯-谢懈斜芯 懈蟹 芯写薪芯泄 褎芯褉屑褘 胁 写褉褍谐褍褞
conveyance	褌褉邪薪褋锌芯褉褌懈褉芯胁泻邪	f	写械泄褋褌胁懈械 懈谢懈 锌褉芯褑械褋褋 褌褉邪薪褋锌芯褉褌懈褉芯胁泻懈 泻芯谐芯-谢懈斜芯 懈谢懈 褔械谐芯-谢懈斜芯 懈蟹 芯写薪芯谐芯 屑械褋褌邪 胁 写褉褍谐芯械
conviction	褍斜械卸写械薪懈械	n	褌胁褢褉写芯 褍写械褉卸懈胁邪械屑邪褟 胁械褉邪 懈谢懈 屑薪械薪懈械
cook	锌芯胁邪褉	m	褔械谢芯胁械泻, 泻芯褌芯褉褘泄 谐芯褌芯胁懈褌 懈 谐芯褌芯胁懈褌 械写褍 胁 泻邪褔械褋褌胁械 褉邪斜芯褌褘 懈谢懈 写谢褟 褍写芯胁芯谢褜褋褌胁懈褟
cookery	泻褍谢懈薪邪褉懈褟	f	锌褉邪泻褌懈泻邪 懈谢懈 褍屑械薪懈械 锌褉懈谐芯褌芯胁谢械薪懈褟 懈 锌褉懈谐芯褌芯胁谢械薪懈褟 锌懈褖懈
cookie	锌械褔械薪褜械	n	屑邪谢械薪褜泻懈泄 褋谢邪写泻懈泄 锌懈褉芯谐, 芯斜褘褔薪芯 泻褉褍谐谢褘泄 懈 锌谢芯褋泻懈泄
cooking	锌褉懈谐芯褌芯胁谢械薪懈械	n	锌褉邪泻褌懈泻邪 懈谢懈 褍屑械薪懈械 锌褉懈谐芯褌芯胁谢械薪懈褟 锌懈褖懈 锌褍褌褢屑 芯斜褗械写懈薪械薪懈褟 懈 薪邪谐褉械胁邪薪懈褟 懈薪谐褉械写懈械薪褌芯胁
cool	锌褉芯褏谢邪写邪	f	写芯胁芯谢褜薪芯 薪懈蟹泻邪褟 褌械屑锌械褉邪褌褍褉邪 懈谢懈 褋锌芯泻芯泄薪芯械 褋邪屑芯芯斜谢邪写邪薪懈械 懈谢懈 褋邪屑芯泻芯薪褌褉芯谢褜 胁 褌褉褍写薪褘褏 褋懈褌褍邪褑懈褟褏
cooperation	褋芯褌褉褍写薪懈褔械褋褌胁芯	n	写械泄褋褌胁懈械 懈谢懈 锌褉芯褑械褋褋 褋芯胁屑械褋褌薪芯泄 褉邪斜芯褌褘 写谢褟 写芯褋褌懈卸械薪懈褟 芯斜褖械泄 褑械谢懈 懈谢懈 褑械谢懈
coordinate	泻芯芯褉写懈薪邪褌邪	f	蟹薪邪褔械薪懈械, 泻芯褌芯褉芯械 芯锌褉械写械谢褟械褌 锌芯谢芯卸械薪懈械 褌芯褔泻懈 薪邪 谢懈薪懈懈, 锌芯胁械褉褏薪芯褋褌懈 懈谢懈 胁 锌褉芯褋褌褉邪薪褋褌胁械
cop	泻芯锌	m	锌芯谢懈褑械泄褋泻懈泄, 泻芯褌芯褉褘泄 芯斜械褋锌械褔懈胁邪械褌 褋芯斜谢褞写械薪懈械 蟹邪泻芯薪邪 懈 锌芯写写械褉卸懈胁邪械褌 芯斜褖械褋褌胁械薪薪褘泄 锌芯褉褟写芯泻
copper	屑械写褜	f	泻褉邪褋薪芯胁邪褌芯-泻芯褉懈褔薪械胁褘泄 屑械褌邪谢谢懈褔械褋泻懈泄 褏懈屑懈褔械褋泻懈泄 褝谢械屑械薪褌, 懈褋锌芯谢褜蟹褍械屑褘泄 写谢褟 褝谢械泻褌褉芯锌褉芯胁芯写泻懈 懈 褋褌褉芯懈褌械谢褜褋褌胁邪
copy	泻芯锌懈褟	f	胁械褖褜, 褋芯蟹写邪薪薪邪褟, 褔褌芯斜褘 胁褘谐谢褟写械褌褜 懈谢懈 斜褘褌褜 锌芯褏芯卸械泄 薪邪 褔褌芯-褌芯 写褉褍谐芯械
copyright	邪胁褌芯褉褋泻芯械 锌褉邪胁芯	n	懈褋泻谢褞褔懈褌械谢褜薪芯械 褞褉懈写懈褔械褋泻芯械 锌褉邪胁芯 胁芯褋锌褉芯懈蟹胁芯写懈褌褜, 锌褍斜谢懈泻芯胁邪褌褜 懈 锌褉芯写邪胁邪褌褜 褌胁芯褉褔械褋泻褍褞 褉邪斜芯褌褍
coral	泻芯褉邪谢谢	m	褌胁褢褉写芯械 泻邪屑械薪懈褋褌芯械 胁械褖械褋褌胁芯, 胁褘写械谢褟械屑芯械 屑芯褉褋泻懈屑懈 锌芯谢懈锌邪屑懈 泻邪泻 胁薪械褕薪懈泄 褋泻械谢械褌
cord	褕薪褍褉	m	写谢懈薪邪 谐懈斜泻芯谐芯 屑邪褌械褉懈邪谢邪 懈蟹 褋泻褉褍褔械薪薪褘褏 懈谢懈 褋锌谢械褌褢薪薪褘褏 薪懈褌械泄
cordial	泻芯褉写懈邪谢	m	褋谢邪写泻懈泄 褎褉褍泻褌芯胁褘泄 薪邪锌懈褌芯泻 懈谢懈 谢懈泻褢褉, 锌褉懈谐芯褌芯胁谢械薪薪褘泄 懈蟹 褎褉褍泻褌芯胁芯谐芯 褋芯泻邪 懈 褋锌懈褉褌芯胁
core	褟写褉芯	n	褑械薪褌褉邪谢褜薪邪褟 懈谢懈 薪邪懈斜芯谢械械 胁邪卸薪邪褟 褔邪褋褌褜 褔械谐芯-谢懈斜芯
cork	锌褉芯斜泻邪	f	锌谢邪胁褍褔械械 褋胁械褌谢芯-泻芯褉懈褔薪械胁芯械 胁械褖械褋褌胁芯, 锌芯谢褍褔械薪薪芯械 懈蟹 胁薪械褕薪械泄 泻芯褉褘 锌褉芯斜泻芯胁芯谐芯 写褍斜邪
corn	泻褍泻褍褉褍蟹邪	f	芯褋薪芯胁薪邪褟 蟹械褉薪芯胁邪褟 泻褍谢褜褌褍褉邪 褉械谐懈芯薪邪, 芯褋芯斜械薪薪芯 锌褕械薪懈褑邪 胁 袗薪谐谢懈懈 懈谢懈 泻褍泻褍褉褍蟹邪 胁 袗屑械褉懈泻械
corner	褍谐芯谢	m	屑械褋褌芯 懈谢懈 褍谐芯谢, 谐写械 胁褋褌褉械褔邪褞褌褋褟 写胁械 褋褌芯褉芯薪褘 懈谢懈 泻褉邪褟
corporal	泻邪锌褉邪谢	m	蟹胁邪薪懈械 褍薪褌械褉-芯褎懈褑械褉邪 胁 胁芯芯褉褍卸褢薪薪褘褏 褋懈谢邪褏, 胁褘褕械 褉褟写芯胁芯谐芯 懈 薪懈卸械 褋械褉卸邪薪褌邪
corporation	泻芯褉锌芯褉邪褑懈褟	f	斜芯谢褜褕邪褟 泻芯屑锌邪薪懈褟 懈谢懈 谐褉褍锌锌邪 泻芯屑锌邪薪懈泄, 褍锌芯谢薪芯屑芯褔械薪薪褘褏 写械泄褋褌胁芯胁邪褌褜 泻邪泻 械写懈薪芯械 褞褉懈写懈褔械褋泻芯械 谢懈褑芯
corps	泻芯褉锌褍褋	m	谐谢邪胁薪芯械 锌芯写褉邪蟹写械谢械薪懈械 胁芯芯褉褍卸褢薪薪褘褏 褋懈谢 胁 锌芯谢械
correction	懈褋锌褉邪胁谢械薪懈械	n	懈蟹屑械薪械薪懈械, 泻芯褌芯褉芯械 懈褋锌褉邪胁谢褟械褌 芯褕懈斜泻褍 懈谢懈 薪械褌芯褔薪芯褋褌褜
correlation	泻芯褉褉械谢褟褑懈褟	f	胁蟹邪懈屑薪邪褟 褋胁褟蟹褜 懈谢懈 褋胁褟蟹褜 屑械卸写褍 写胁褍屑褟 懈谢懈 斜芯谢械械 胁械褖邪屑懈, 泻芯褌芯褉褘械 懈屑械褞褌 褌械薪写械薪褑懈褞 懈蟹屑械薪褟褌褜褋褟 胁屑械褋褌械
correspondence	锌械褉械锌懈褋泻邪	f	锌懈褋褜屑邪 懈谢懈 褝谢械泻褌褉芯薪薪褘械 锌懈褋褜屑邪, 芯褌锌褉邪胁谢械薪薪褘械 懈谢懈 锌芯谢褍褔械薪薪褘械
correspondent	泻芯褉褉械褋锌芯薪写械薪褌	m	褔械谢芯胁械泻, 泻芯褌芯褉褘泄 锌懈褕械褌 锌懈褋褜屑邪 懈谢懈 褋芯芯斜褖邪械褌 芯 褋芯斜褘褌懈褟褏 写谢褟 谐邪蟹械褌褘 懈谢懈 胁械褖邪褌械谢褟
corridor	泻芯褉懈写芯褉	m	锌褉芯褏芯写 胁 蟹写邪薪懈懈 褋 泻芯屑薪邪褌邪屑懈, 芯褌泻褉褘胁邪褞褖懈屑懈褋褟 懈蟹 薪械谐芯
corruption	泻芯褉褉褍锌褑懈褟	f	薪械褔械褋褌薪芯械 懈谢懈 屑芯褕械薪薪懈褔械褋泻芯械 锌芯胁械写械薪懈械 褌械褏, 泻褌芯 褍 胁谢邪褋褌懈
cosmetic	泻芯褋屑械褌懈泻邪	f	锌褉芯写褍泻褌, 薪邪薪芯褋懈屑褘泄 薪邪 褌械谢芯 写谢褟 褍谢褍褔褕械薪懈褟 懈谢懈 懈蟹屑械薪械薪懈褟 胁薪械褕薪械谐芯 胁懈写邪
cosmos	泻芯褋屑芯褋	m	胁褋械谢械薪薪邪褟, 褉邪褋褋屑邪褌褉懈胁邪械屑邪褟 泻邪泻 褏芯褉芯褕芯 褍锌芯褉褟写芯褔械薪薪邪褟 懈 谐邪褉屑芯薪懈褔薪邪褟 褋懈褋褌械屑邪
cost	褋褌芯懈屑芯褋褌褜	f	褋褍屑屑邪 写械薪械谐, 薪械芯斜褏芯写懈屑邪褟 写谢褟 锌芯泻褍锌泻懈 懈谢懈 写芯褋褌懈卸械薪懈褟 褔械谐芯-谢懈斜芯
costume	泻芯褋褌褞屑	m	薪邪斜芯褉 芯写械卸写褘, 泻芯褌芯褉褘泄 薪芯褋褟褌, 褔褌芯斜褘 锌褉械写褋褌邪胁谢褟褌褜 芯锌褉械写械谢褢薪薪芯谐芯 锌械褉褋芯薪邪卸邪, 锌械褉懈芯写 懈谢懈 褌械屑褍
cottage	泻芯褌褌械写卸	m	薪械斜芯谢褜褕芯泄 锌褉芯褋褌芯泄 写芯屑, 芯斜褘褔薪芯 胁 褋械谢褜褋泻芯泄 懈谢懈 锌芯谢褍褋械谢褜褋泻芯泄 屑械褋褌薪芯褋褌懈
cotton	褏谢芯锌芯泻	m	屑褟谐泻芯械 斜械谢芯械 胁芯谢芯泻薪懈褋褌芯械 胁械褖械褋褌胁芯, 芯泻褉褍卸邪褞褖械械 褋械屑械薪邪 褏谢芯锌泻芯胁芯谐芯 褉邪褋褌械薪懈褟, 懈褋锌芯谢褜蟹褍械屑芯械 写谢褟 懈蟹谐芯褌芯胁谢械薪懈褟 褌械泻褋褌懈谢褟
couch	写懈胁邪薪	m	写谢懈薪薪褘泄 芯斜懈褌褘泄 锌褉械写屑械褌 屑械斜械谢懈 写谢褟 薪械褋泻芯谢褜泻懈褏 褔械谢芯胁械泻, 褔褌芯斜褘 褋懈写械褌褜
cough	泻邪褕械谢褜	m	胁薪械蟹邪锌薪芯械 胁褘褌邪谢泻懈胁邪薪懈械 胁芯蟹写褍褏邪 懈蟹 谢褢谐泻懈褏 褋 褉械蟹泻懈屑 蟹胁褍泻芯屑 写谢褟 芯褔懈褋褌泻懈 写褘褏邪褌械谢褜薪褘褏 锌褍褌械泄
council	褋芯胁械褌	m	芯褉谐邪薪 谢褞写械泄, 懈蟹斜褉邪薪薪褘褏 懈谢懈 薪邪蟹薪邪褔械薪薪褘褏 写谢褟 锌褉懈薪褟褌懈褟 褉械褕械薪懈泄 懈谢懈 写邪褔懈 褋芯胁械褌芯胁 锌芯 泻芯薪泻褉械褌薪芯屑褍 胁芯锌褉芯褋褍
counsel	褋芯胁械褌	m	褋芯胁械褌, 写邪薪薪褘泄 褎芯褉屑邪谢褜薪芯 懈谢懈 锌褉芯褎械褋褋懈芯薪邪谢褜薪芯
counseling	泻芯薪褋褍谢褜褌懈褉芯胁邪薪懈械	n	锌褉械写芯褋褌邪胁谢械薪懈械 锌褉芯褎械褋褋懈芯薪邪谢褜薪芯泄 锌芯屑芯褖懈 懈 褉褍泻芯胁芯写褋褌胁邪 胁 褉邪蟹褉械褕械薪懈懈 谢懈褔薪褘褏 懈谢懈 锌褋懈褏芯谢芯谐懈褔械褋泻懈褏 锌褉芯斜谢械屑
count	褋褔褢褌	m	芯锌褉械写械谢械薪懈械 芯斜褖械谐芯 褔懈褋谢邪 褔械谐芯-谢懈斜芯
countenance	胁褘褉邪卸械薪懈械 谢懈褑邪	n	谢懈褑芯 褔械谢芯胁械泻邪 懈谢懈 胁褘褉邪卸械薪懈械 谢懈褑邪
counter	锌褉懈谢邪胁芯泻	m	写谢懈薪薪褘泄 锌谢芯褋泻懈泄 锌褉械写屑械褌 屑械斜械谢懈, 懈褋锌芯谢褜蟹褍械屑褘泄 写谢褟 褌褉邪薪蟹邪泻褑懈泄 懈谢懈 写械屑芯薪褋褌褉邪褑懈懈 褌芯胁邪褉芯胁
country	褋褌褉邪薪邪	f	薪邪褑懈褟 褋芯 褋胁芯懈屑 褋芯斜褋褌胁械薪薪褘屑 锌褉邪胁懈褌械谢褜褋褌胁芯屑, 蟹邪薪懈屑邪褞褖邪褟 芯锌褉械写械谢褢薪薪褍褞 褌械褉褉懈褌芯褉懈褞
countryside	褋械谢褜褋泻邪褟 屑械褋褌薪芯褋褌褜	f	蟹械屑谢褟 懈 锌械泄蟹邪卸 褋械谢褜褋泻芯泄 屑械褋褌薪芯褋褌懈
county	谐褉邪褎褋褌胁芯	n	褌械褉褉懈褌芯褉懈邪谢褜薪芯械 写械谢械薪懈械 薪械泻芯褌芯褉褘褏 褋褌褉邪薪 写谢褟 邪写屑懈薪懈褋褌褉邪褌懈胁薪褘褏 懈谢懈 锌芯谢懈褌懈褔械褋泻懈褏 褑械谢械泄
coup	锌械褉械胁芯褉芯褌	m	胁薪械蟹邪锌薪褘泄 薪邪褋懈谢褜褋褌胁械薪薪褘泄 蟹邪褏胁邪褌 胁谢邪褋褌懈 褍 锌褉邪胁懈褌械谢褜褋褌胁邪
couple	锌邪褉邪	f	写胁邪 褔械谢芯胁械泻邪 芯写薪芯谐芯 懈 褌芯谐芯 卸械 褌懈锌邪, 褉邪褋褋屑邪褌褉懈胁邪械屑褘械 胁屑械褋褌械
courage	褋屑械谢芯褋褌褜	f	褋锌芯褋芯斜薪芯褋褌褜 写械谢邪褌褜 褌芯, 褔褌芯 锌褍谐邪械褌
courier	泻褍褉褜械褉	m	褔械谢芯胁械泻 懈谢懈 泻芯屑锌邪薪懈褟, 薪邪薪褟褌邪褟 写谢褟 斜褘褋褌褉芯泄 写芯褋褌邪胁泻懈 褋芯芯斜褖械薪懈泄, 锌芯褋褘谢芯泻 懈谢懈 锌芯褔褌褘
course	泻褍褉褋	m	屑邪褉褕褉褍褌 懈谢懈 薪邪锌褉邪胁谢械薪懈械, 蟹邪 泻芯褌芯褉褘屑 褋谢械写褍械褌 褔褌芯-谢懈斜芯
court	褋褍写	m	褌褉懈斜褍薪邪谢, 胁芯蟹谐谢邪胁谢褟械屑褘泄 褋褍写褜褢泄 写谢褟 芯褌锌褉邪胁谢械薪懈褟 锌褉邪胁芯褋褍写懈褟
courtesy	胁械卸谢懈胁芯褋褌褜	f	胁械卸谢懈胁芯械 锌芯胁械写械薪懈械, 写械屑芯薪褋褌褉懈褉褍褞褖械械 褍胁邪卸械薪懈械 懈 胁薪懈屑邪薪懈械 泻 写褉褍谐懈屑
courthouse	蟹写邪薪懈械 褋褍写邪	n	蟹写邪薪懈械, 胁 泻芯褌芯褉芯屑 锌褉芯胁芯写懈褌褋褟 褋褍写械斜薪芯械 蟹邪褋械写邪薪懈械
courtroom	蟹邪谢 褋褍写邪	m	屑械褋褌芯 懈谢懈 泻芯屑薪邪褌邪, 胁 泻芯褌芯褉芯泄 褋芯斜懈褉邪械褌褋褟 褋褍写 写谢褟 锌褉芯胁械写械薪懈褟 褋褍写械斜薪褘褏 褉邪蟹斜懈褉邪褌械谢褜褋褌胁
courtship	褍褏邪卸懈胁邪薪懈械	n	锌械褉懈芯写, 胁 褌械褔械薪懈械 泻芯褌芯褉芯谐芯 褉邪蟹胁懈胁邪褞褌褋褟 褉芯屑邪薪褌懈褔械褋泻懈械 芯褌薪芯褕械薪懈褟 写芯 斜褉邪泻邪
cousin	写胁芯褞褉芯写薪褘泄 斜褉邪褌	m	褉械斜褢薪芯泻 写褟写懈 懈谢懈 褌褢褌懈
cover	芯斜谢芯卸泻邪	f	褔褌芯-褌芯, 锌芯谢芯卸械薪薪芯械 薪邪 芯斜褗械泻褌, 褔褌芯斜褘 蟹邪褖懈褌懈褌褜 懈谢懈 褋泻褉褘褌褜 械谐芯
coverage	芯褋胁械褖械薪懈械	n	褋褌械锌械薪褜, 胁 泻芯褌芯褉芯泄 褔褌芯-褌芯 锌芯泻褉褘胁邪械褌褋褟 懈谢懈 芯斜褉邪斜邪褌褘胁邪械褌褋褟
cow	泻芯褉芯胁邪	f	锌芯谢薪芯褋褌褜褞 胁褘褉芯褋褕邪褟 褋邪屑泻邪 写芯屑邪褕薪械谐芯 褋泻芯褌邪, 褋芯写械褉卸邪褖邪褟褋褟 写谢褟 屑芯谢芯泻邪 懈谢懈 锌褉芯懈蟹胁芯写褋褌胁邪 谐芯胁褟写懈薪褘
coward	褌褉褍褋	m	褔械谢芯胁械泻, 泻芯褌芯褉芯屑褍 薪械 褏胁邪褌邪械褌 褋屑械谢芯褋褌懈 褋褌芯谢泻薪褍褌褜褋褟 褋 芯锌邪褋薪芯褋褌褜褞, 褌褉褍写薪芯褋褌褜褞 懈谢懈 斜芯谢褜褞
crab	泻褉邪斜	m	褉邪泻芯芯斜褉邪蟹薪芯械 褋 褕懈褉芯泻懈屑 锌谢芯褋泻懈屑 锌邪薪褑懈褉械屑 懈 泻谢械褕薪褟屑懈, 芯斜褘褔薪芯 褏芯写褟褖械械 斜芯泻芯屑
crack	褌褉械褖懈薪邪	f	谢懈薪懈褟 薪邪 锌芯胁械褉褏薪芯褋褌懈, 谐写械 褔褌芯-褌芯 褉邪褋泻芯谢芯谢芯褋褜, 薪械 锌芯谢薪芯褋褌褜褞 褋谢芯屑邪胁褕懈褋褜
cracker	泻褉械泻械褉	m	褌芯薪泻芯械 褋褍褏芯械 锌械褔械薪褜械, 芯斜褘褔薪芯 械写褟褌 褋 褋褘褉芯屑 懈谢懈 写褉褍谐懈屑懈 薪械褋谢邪写泻懈屑懈 薪邪褔懈薪泻邪屑懈
cradle	泻芯谢褘斜械谢褜	f	屑邪谢械薪褜泻邪褟 泻褉芯胁邪褌褜 写谢褟 屑谢邪写械薪褑邪, 褔邪褋褌芯 薪邪 泻邪褔邪谢泻邪褏
craft	褉械屑械褋谢芯	n	写械褟褌械谢褜薪芯褋褌褜, 胁泻谢褞褔邪褞褖邪褟 褍屑械薪懈械 褋芯蟹写邪胁邪褌褜 胁械褖懈 褉褍泻邪屑懈
cram	蟹褍斜褉褢卸泻邪	f	邪泻褌 懈薪褌械薪褋懈胁薪芯谐芯 芯斜褍褔械薪懈褟 胁 褌械褔械薪懈械 泻芯褉芯褌泻芯谐芯 锌械褉懈芯写邪 胁褉械屑械薪懈 写谢褟 锌芯写谐芯褌芯胁泻懈 泻 褝泻蟹邪屑械薪褍
cramp	褋褍写芯褉芯谐邪	f	斜芯谢械蟹薪械薪薪芯械 薪械锌褉芯懈蟹胁芯谢褜薪芯械 褋芯泻褉邪褖械薪懈械 屑褘褕褑褘
crane	卸褍褉邪胁谢褜	m	斜芯谢褜褕邪褟 胁褘褋芯泻邪褟 屑邪褕懈薪邪, 懈褋锌芯谢褜蟹褍械屑邪褟 写谢褟 锌械褉械屑械褖械薪懈褟 褌褟卸褢谢褘褏 锌褉械写屑械褌芯胁, 锌芯写胁械褕懈胁邪褟 懈褏 薪邪 胁褘褋褌褍锌邪褞褖械屑 褉褘褔邪谐械
crash	泻褉褍褕械薪懈械	n	薪邪褋懈谢褜褋褌胁械薪薪芯械 褋褌芯谢泻薪芯胁械薪懈械 屑械卸写褍 褌褉邪薪褋锌芯褉褌薪褘屑懈 褋褉械写褋褌胁邪屑懈 懈谢懈 褋 锌褉械锌褟褌褋褌胁懈械屑
crawl	锌芯谢蟹邪薪懈械	n	邪泻褌 写胁懈卸械薪懈褟 胁锌械褉褢写 薪邪 褉褍泻邪褏 懈 泻芯谢械薪褟褏
cream	泻褉械屑	m	谐褍褋褌邪褟 斜械谢邪褟 懈谢懈 斜谢械写薪芯-卸褢谢褌邪褟 卸懈褉薪邪褟 卸懈写泻芯褋褌褜, 泻芯褌芯褉邪褟 锌芯写薪懈屑邪械褌褋褟 薪邪 胁械褉褏 屑芯谢芯泻邪
creation	褌胁芯褉械薪懈械	n	写械泄褋褌胁懈械 懈谢懈 锌褉芯褑械褋褋 褋芯蟹写邪薪懈褟 褔械谐芯-谢懈斜芯
creator	褋芯蟹写邪褌械谢褜	m	褔械谢芯胁械泻 懈谢懈 胁械褖褜, 泻芯褌芯褉邪褟 褋芯蟹写邪褢褌 褔褌芯-谢懈斜芯
creature	褋褍褖械褋褌胁芯	n	卸懈胁芯褌薪芯械 懈谢懈 褋褍褖械褋褌胁芯, 芯褋芯斜械薪薪芯 薪械褔械谢芯胁械褔械褋泻芯械
credit	泻褉械写懈褌	m	锌褉懈蟹薪邪薪懈械 懈 锌芯褏胁邪谢邪 蟹邪 写芯褋褌懈卸械薪懈械
creditor	泻褉械写懈褌芯褉	m	谢懈褑芯 懈谢懈 褍褔褉械卸写械薪懈械, 泻芯褌芯褉芯屑褍 写褉褍谐邪褟 褋褌芯褉芯薪邪 写芯谢卸薪邪 写械薪褜谐懈
creed	泻褉械写芯	n	褋懈褋褌械屑邪 褉械谢懈谐懈芯蟹薪褘褏 胁械褉芯胁邪薪懈泄
creek	褉褍褔械泄	m	褉褍褔械泄 懈谢懈 屑邪谢褘泄 锌褉懈褌芯泻 褉械泻懈
creep	锌芯谢蟹邪薪懈械	n	屑械写谢械薪薪芯械 写胁懈卸械薪懈械, 芯褋芯斜械薪薪芯 胁锌械褉褢写 褋 褌械谢芯屑 斜谢懈蟹泻芯 泻 蟹械屑谢械
crescent	锌芯谢褍屑械褋褟褑	m	懈蟹芯谐薪褍褌邪褟 褎芯褉屑邪 褉邪褋褌褍褖械泄 懈谢懈 褍斜褘胁邪褞褖械泄 谢褍薪褘
crew	泻芯屑邪薪写邪	f	谐褉褍锌锌邪 谢褞写械泄, 泻芯褌芯褉褘械 褉邪斜芯褌邪褞褌 胁屑械褋褌械 薪邪 泻芯褉邪斜谢械, 褋邪屑芯谢褢褌械 懈谢懈 写褉褍谐芯屑 褌褉邪薪褋锌芯褉褌薪芯屑 褋褉械写褋褌胁械
crib	泻褉芯胁邪褌泻邪	f	屑邪谢械薪褜泻邪褟 泻褉芯胁邪褌褜 褋 胁褘褋芯泻懈屑懈 斜芯褉褌邪屑懈 写谢褟 屑谢邪写械薪褑邪 懈谢懈 芯褔械薪褜 屑邪谢械薪褜泻芯谐芯 褉械斜褢薪泻邪
crime	锌褉械褋褌褍锌谢械薪懈械	n	写械泄褋褌胁懈械 懈谢懈 斜械蟹写械泄褋褌胁懈械, 泻芯褌芯褉芯械 褋芯褋褌邪胁谢褟械褌 锌褉邪胁芯薪邪褉褍褕械薪懈械, 薪邪泻邪蟹褍械屑芯械 锌芯 蟹邪泻芯薪褍
