en	translation	gender	meaning_translation
abbey	मठ	m	भिक्षुओं या भिक्षुणियों की मण्डली द्वारा अधिकृत भवन या भवन समूह
abbreviation	संक्षिप्त रूप	m	किसी शब्द या वाक्यांश का संक्षिप्त रूप
ability	क्षमता	f	कुछ करने का साधन या कौशल होना
abnormality	असामान्यता	f	वह विशेषता या गुण जो सामान्य या अपेक्षित से विचलित हो
abortion	गर्भपात	m	मानव गर्भावस्था की जानबूझकर समाप्ति
absence	अनुपस्थिति	f	किसी स्थान या व्यक्ति से दूर होने की स्थिति
absolute	परम सत्य	m	वह मूल्य या सिद्धांत जिसे सार्वभौमिक रूप से मान्य माना जाता है
abstract	सार	m	किसी पुस्तक, लेख या औपचारिक भाषण की विषयवस्तु का सारांश
abstraction	अमूर्तता	f	घटनाओं या भौतिक वस्तुओं की बजाय विचारों से निपटने की गुणवत्ता
absurd	बेतुकापन	m	हास्यास्पद या जंगली रूप से अनुचित होने की गुणवत्ता या स्थिति
absurdity	मूर्खता	f	पूरी तरह से अनुचित या अतार्किक होने की गुणवत्ता या स्थिति
abundance	प्रचुरता	f	किसी चीज़ की बहुत बड़ी मात्रा
abuse	दुरुपयोग	m	किसी चीज़ का अनुचित उपयोग
academy	अकादमी	f	किसी विशेष क्षेत्र में अध्ययन या प्रशिक्षण का स्थान
accent	उच्चारण	m	किसी विशेष क्षेत्र या समूह से जुड़े भाषा के उच्चारण का विशिष्ट तरीका
access	पहुंच	f	किसी चीज़ तक पहुंचने, प्रवेश करने या उपयोग करने का साधन या अवसर
accessory	सहायक वस्तु	f	वह चीज़ जिसे किसी और चीज़ में जोड़ा जा सकता है
accident	दुर्घटना	f	वह दुर्भाग्यपूर्ण घटना जो अप्रत्याशित रूप से और अनजाने में होती है
accommodation	आवास	m	वह कमरा, कमरों का समूह, या भवन जिसमें कोई रह सकता है
accomplishment	उपलब्धि	f	वह चीज़ जो सफलतापूर्वक हासिल की गई है
accord	समझौता	m	एक आधिकारिक समझौता या संधि
account	विवरण	m	किसी घटना या अनुभव की रिपोर्ट या वर्णन
accounting	लेखाकरण	m	वित्तीय खातों को रखने की क्रिया या प्रक्रिया
accumulation	संचय	m	समय के साथ किसी चीज़ का अधिग्रहण या क्रमिक संग्रह
achievement	सफलता	f	वह चीज़ जो सफलतापूर्वक की गई है
acid	अम्ल	m	रासायनिक पदार्थ जो क्षारों को उदासीन करता है
acquaintance	परिचित	m	वह व्यक्ति जिसे कोई थोड़ा जानता है लेकिन जो करीबी दोस्त नहीं है
acquisition	अधिग्रहण	m	खरीदी गई या प्राप्त की गई संपत्ति या वस्तु
acquittal	बरी होना	m	वह निर्णय कि कोई व्यक्ति उस अपराध का दोषी नहीं है
acre	एकड़	m	भूमि क्षेत्र की इकाई
act	कार्य	m	की गई चीज़; एक कर्म
acting	अभिनय	m	नाटकों, फिल्मों या टेलीविजन में काल्पनिक भूमिकाएं निभाने की कला या व्यवसाय
action	कार्रवाई	f	किसी विशेष उद्देश्य को प्राप्त करने के लिए कुछ करने का तथ्य या प्रक्रिया
activity	गतिविधि	f	वह स्थिति जिसमें चीजें हो रही हैं या की जा रही हैं
actor	अभिनेता	m	वह व्यक्ति जिसका पेशा नाटकों, फिल्मों या टेलीविजन शो में प्रदर्शन करना है
actress	अभिनेत्री	f	वह महिला जिसका पेशा नाटकों, फिल्मों या टेलीविजन शो में प्रदर्शन करना है
actuality	वास्तविकता	f	वास्तविकता में मौजूद होने की स्थिति
adaptation	अनुकूलन	m	अनुकूलित होने या अनुकूलित किए जाने की क्रिया या प्रक्रिया
addiction	व्यसन	m	किसी विशेष पदार्थ, चीज़ या गतिविधि पर निर्भर होने का तथ्य या स्थिति
addition	जोड़	m	किसी और चीज़ में कुछ जोड़ने की क्रिया या प्रक्रिया
additive	योजक	m	कुछ सुधारने या संरक्षित करने के लिए छोटी मात्रा में जोड़ा गया पदार्थ
address	पता	m	उस स्थान का विवरण जहां कोई रहता है या कोई संगठन स्थित है
adherence	पालन	m	किसी व्यक्ति, कारण या विश्वास के प्रति लगाव या प्रतिबद्धता
administration	प्रशासन	m	व्यवसाय, संगठन या प्रणाली चलाने की प्रक्रिया या गतिविधि
admiral	एडमिरल	m	नौसैनिक बेड़े या स्क्वाड्रन का कमांडर
admiration	प्रशंसा	f	किसी व्यक्ति या किसी चीज़ के लिए सम्मान और गर्म अनुमोदन
admission	प्रवेश	m	किसी चीज़ की सच्चाई को स्वीकार करने वाला बयान
adornment	श्रृंगार	m	वह चीज़ जो सजाती या सजाती है
adult	वयस्क	m	वह व्यक्ति जो पूरी तरह से विकसित या विकसित हो चुका है
advance	प्रगति	f	आगे की गति या प्रगति
advantage	लाभ	m	वह स्थिति या परिस्थिति जो किसी को अनुकूल या श्रेष्ठ स्थिति में रखती है
adventure	साहसिक कार्य	m	असामान्य और रोमांचक, आमतौर पर खतरनाक अनुभव या गतिविधि
adversary	विरोधी	m	प्रतियोगिता, संघर्ष या विवाद में किसी का प्रतिद्वंद्वी
adversity	विपत्ति	f	कठिनाइयाँ या दुर्भाग्य
advertisement	विज्ञापन	m	किसी उत्पाद, सेवा या घटना को बढ़ावा देने वाले सार्वजनिक माध्यम में सूचना या घोषणा
advertiser	विज्ञापनदाता	m	वह व्यक्ति या कंपनी जो उत्पादों, सेवाओं या घटनाओं का विज्ञापन करती है
advice	सलाह	f	भविष्य की विवेकपूर्ण कार्रवाई के संबंध में मार्गदर्शन या सिफारिशें
adviser	सलाहकार	m	वह व्यक्ति जो सलाह देता है, आमतौर पर कोई जो किसी विशेष क्षेत्र में विशेषज्ञ है
advocacy	वकालत	f	किसी विशेष कारण या नीति के लिए सार्वजनिक समर्थन
affair	मामला	m	निर्दिष्ट प्रकार की घटना या घटनाओं का क्रम
affection	स्नेह	m	किसी के लिए या किसी चीज़ के लिए कोमल भावना
affidavit	शपथपत्र	m	अदालत में साक्ष्य के रूप में उपयोग के लिए शपथ या प्रतिज्ञान द्वारा पुष्टि किया गया लिखित बयान
affinity	आत्मीयता	f	किसी व्यक्ति या किसी चीज़ के लिए स्वाभाविक या स्वाभाविक पसंद या सहानुभूति
aftercare	उपचारोत्तर देखभाल	f	अस्पताल में रहने या चिकित्सा स्थिति के उपचार के बाद किसी व्यक्ति की देखभाल
afternoon	दोपहर	m	दोपहर या दोपहर के भोजन से लेकर शाम तक का समय
age	आयु	f	वह समय जो किसी व्यक्ति ने जिया है या कोई चीज़ अस्तित्व में रही है
agency	एजेंसी	f	कोई विशेष सेवा प्रदान करने के लिए स्थापित व्यवसाय या संगठन
agenda	कार्यसूची	f	औपचारिक बैठक में चर्चा की जाने वाली वस्तुओं की सूची
agent	एजेंट	m	वह व्यक्ति जो किसी अन्य व्यक्ति या समूह की ओर से कार्य करता है
aggregate	समुच्चय	m	कई भिन्न तत्वों को मिलाकर बनाया गया संपूर्ण
agitation	आंदोलन	m	चिंता या घबराहट की स्थिति
agony	यातना	f	अत्यधिक शारीरिक या मानसिक पीड़ा
agreement	सहमति	f	राय या भावना में सामंजस्य या सहमति
agriculture	कृषि	f	खेती का विज्ञान या अभ्यास
aid	सहायता	f	मदद, आमतौर पर व्यावहारिक प्रकृति की
aide	सहायक	m	किसी महत्वपूर्ण व्यक्ति विशेष रूप से राजनीतिक नेता का सहायक
aim	लक्ष्य	m	उद्देश्य या इरादा
air	हवा	f	पृथ्वी के चारों ओर का अदृश्य गैसीय पदार्थ
airhead	मूर्ख व्यक्ति	m	मूर्ख या बेवकूफ व्यक्ति
airport	हवाई अड्डा	m	नागरिक विमानों के उड़ान भरने, उतरने और रखरखाव के लिए रनवे और इमारतों का परिसर
airway	वायुमार्ग	m	विमान द्वारा नियमित रूप से अनुसरण किया जाने वाला मार्ग
alarm	चिंता	f	खतरे के बारे में चिंताजनक जागरूकता
alaska	अलास्का	m	उत्तरी अमेरिका के उत्तर पश्चिमी छोर में एक अमेरिकी राज्य
album	एल्बम	m	एकल वस्तु के रूप में जारी की गई रिकॉर्डिंग का संग्रह
alcohol	शराब	f	शर्करा के किण्वन द्वारा उत्पादित रंगहीन वाष्पशील ज्वलनशील तरल
alcoholism	शराबबंदी	f	मादक शराब के सेवन की लत
alibi	अलिबी	f	यह दावा या साक्ष्य का टुकड़ा कि जब कथित कार्य हुआ तो कोई और कहीं था
alien	विदेशी	m	किसी अन्य दुनिया से प्राणी
alignment	संरेखण	m	सीधी रेखा में या सही सापेक्ष स्थिति में व्यवस्था
all	सब कुछ	m	किसी विशेष समूह या चीज़ की संपूर्ण मात्रा या सीमा
all-nighter	रात भर की घटना	f	पूरी रात तक चलने वाली घटना या गतिविधि
allegiance	निष्ठा	f	किसी उच्चतर या किसी समूह या कारण के प्रति वफादारी या प्रतिबद्धता
allergy	एलर्जी	f	किसी पदार्थ के प्रति शरीर द्वारा क्षतिकारक प्रतिरक्षा प्रतिक्रिया
alliance	गठबंधन	m	देशों या संगठनों के बीच आपसी लाभ के लिए गठित संघ या संगठन
alligator	मगरमच्छ	m	एक बड़ा अर्धजलीय सरीसृप
allocation	आवंटन	m	कुछ वितरित या विभाजित करने की क्रिया या प्रक्रिया
allotment	भूखंड	m	किसी को आवंटित किसी चीज़ का एक हिस्सा
allowance	भत्ता	m	किसी चीज़ की वह मात्रा जो अनुमत या आवंटित की गई है
alloy	मिश्रधातु	f	दो या अधिक धातु तत्वों को मिलाकर बनाई गई धातु
ally	मित्र राष्ट्र	m	वह राज्य जो सैन्य या अन्य उद्देश्यों के लिए दूसरे के साथ औपचारिक रूप से सहयोग करता है
almond	बादाम	m	आड़ू और बेर से संबंधित पेड़ का अंडाकार खाद्य बीज
alpaca	अल्पाका	m	लामा से संबंधित पालतू दक्षिण अमेरिकी स्तनपायी
alpha	अल्फा	m	ग्रीक वर्णमाला का पहला अक्षर
alphabet	वर्णमाला	f	भाषा की बुनियादी भाषण ध्वनियों का प्रतिनिधित्व करने के लिए उपयोग किए जाने वाले निश्चित क्रम में अक्षरों या प्रतीकों का सेट
alternative	विकल्प	m	दो या अधिक उपलब्ध संभावनाओं में से एक
altitude	ऊंचाई	f	समुद्र तल या जमीनी स्तर के संबंध में किसी वस्तु या बिंदु की ऊंचाई
alto	ऑल्टो	f	चार-भाग सामंजस्य में दूसरी सबसे ऊंची गायन आवाज
amateur	शौकिया	m	वह व्यक्ति जो किसी गतिविधि में पेशे के रूप में नहीं बल्कि आनंद के लिए संलग्न होता है
amber	अंबर	m	विलुप्त शंकुधारी पेड़ों से उत्पन्न कठोर पारभासी जीवाश्म राल
ambiguity	अस्पष्टता	f	एक से अधिक व्याख्याओं के लिए खुली होने की गुणवत्ता
ambition	महत्वाकांक्षा	f	कुछ करने या प्राप्त करने की प्रबल इच्छा
amendment	संशोधन	m	पाठ या कानून के टुकड़े में सुधार के लिए डिज़ाइन किया गया मामूली परिवर्तन या जोड़
America	अमेरिका	m	उत्तरी और दक्षिणी महाद्वीपों वाली भूमि
American	अमेरिकी	m	संयुक्त राज्य अमेरिका का मूल निवासी या नागरिक
amethyst	नीलम	m	क्वार्ट्ज की बैंगनी या बैंगनी किस्म से युक्त एक कीमती पत्थर
ammunition	गोला-बारूद	m	गोलियों और गोले की आपूर्ति
amnesty	आम माफी	f	राजनीतिक अपराधों के लिए दोषी ठहराए गए लोगों के लिए आधिकारिक क्षमा
amount	राशि	f	किसी चीज़ की मात्रा
ampere	एम्पियर	m	अंतर्राष्ट्रीय इकाई प्रणाली में विद्युत धारा की आधार इकाई
amplitude	आयाम	m	संतुलन की स्थिति से मापी गई कंपन या दोलन की अधिकतम सीमा
amusement	मनोरंजन	m	कुछ मज़ेदार या मनोरंजक पाने की स्थिति या अनुभव
anagram	अनाग्राम	m	किसी भिन्न शब्द या वाक्यांश के अक्षरों को पुनर्व्यवस्थित करके बनाया गया शब्द या वाक्यांश
analogy	सादृश्य	m	स्पष्टीकरण या स्पष्टीकरण के उद्देश्य से दो चीजों के बीच तुलना
analysis	विश्लेषण	m	किसी चीज़ के तत्वों या संरचना की विस्तृत जांच
anarchy	अराजकता	f	प्राधिकार की अनुपस्थिति या गैर-मान्यता के कारण अव्यवस्था की स्थिति
anatomy	शरीर रचना विज्ञान	m	मनुष्यों, जानवरों और अन्य जीवों की शारीरिक संरचना से संबंधित विज्ञान की शाखा
ancestor	पूर्वज	m	वह व्यक्ति जिससे कोई वंश है
angel	देवदूत	m	आध्यात्मिक प्राणी जिसे भगवान के परिचारक, एजेंट या दूत के रूप में कार्य करने के लिए माना जाता है
anger	क्रोध	m	झुंझलाहट, अप्रसन्नता या शत्रुता की तीव्र भावना
angle	कोण	m	दो प्रतिच्छेदी रेखाओं या सतहों के बीच का स्थान
animal	पशु	m	जैविक पदार्थ पर भोजन करने वाला जीवित जीव
animation	एनिमेशन	m	जीवन या शक्ति से भरा होने की स्थिति
ankle	टखना	m	पैर को पैर से जोड़ने वाला जोड़
anniversary	वर्षगांठ	f	वह तिथि जिस पर पिछले वर्ष में कोई घटना हुई थी
announcement	घोषणा	f	किसी तथ्य, घटना या इरादे के बारे में सार्वजनिक और आमतौर पर औपचारिक बयान
announcer	उद्घोषक	m	वह व्यक्ति जो कुछ घोषित करता है
annoyance	झुंझलाहट	f	नाराज होने की भावना या स्थिति
answer	उत्तर	m	किसी प्रश्न, कथन या स्थिति की प्रतिक्रिया के रूप में कही गई, लिखी गई या की गई बात
ant	चींटी	f	छोटा कीट जो आमतौर पर डंक मारता है और जटिल सामाजिक कॉलोनियों में रहता है
antarctic	अंटार्कटिक	m	दक्षिणी ध्रुव के आसपास का क्षेत्र
antelope	मृग	m	चिकने बालों और ऊपर की ओर इशारा करने वाले सींगों वाला तेज़ दौड़ने वाला हिरण जैसा रोमंथी स्तनपायी
anthem	गान	m	किसी विशेष समूह, निकाय या कारण के साथ पहचाना जाने वाला उत्साहवर्धक या उत्थान गीत
anthropology	मानवशास्त्र	m	मानव समाजों और संस्कृतियों और उनके विकास का अध्ययन
antibiotic	प्रतिजैविक	m	वह दवा जो सूक्ष्मजीवों विशेष रूप से जीवाणुओं की वृद्धि को रोकती है या नष्ट करती है
antibody	प्रतिरक्षी	m	एक विशिष्ट प्रतिजन के जवाब में उत्पादित रक्त प्रोटीन
anticipation	प्रत्याशा	f	किसी चीज़ की प्रत्याशा की क्रिया
antidote	मारक	m	किसी विशेष जहर का प्रतिकार करने के लिए ली गई या दी गई दवा
antique	प्राचीन वस्तु	f	संग्रहणीय वस्तु जैसे कि फर्नीचर का टुकड़ा या कला का काम
antiquity	प्राचीनता	f	प्राचीन अतीत
antiseptic	एंटीसेप्टिक	m	वह पदार्थ जो रोग पैदा करने वाले सूक्ष्मजीवों की वृद्धि को रोकता है
anxiety	चिंता	f	अनिश्चित परिणाम के साथ किसी चीज़ के बारे में चिंता, घबराहट या बेचैनी की भावना
anybody	कोई भी	m	कोई व्यक्ति या लोग
anyone	कोई भी व्यक्ति	m	कोई व्यक्ति या लोग
anything	कुछ भी	m	कोई भी चीज़ का संदर्भ देने के लिए उपयोग किया जाता है
anywhere	कहीं भी	m	किसी भी स्थान में या उसके लिए
