en	translation	gender	meaning_translation
cocoa	cacao	m	Polvere di cioccolato
coconut	cocco	m	Frutto tropicale
cod	merluzzo	m	Tipo di pesce
code	codice	m	Sistema
coffee	caffè	m	Bevanda
coffin	bara	f	Cassa da sepoltura
coin	moneta	f	Denaro
coincidence	coincidenza	f	Evento casuale
cola	cola	f	Bevanda gassata
cold	freddo	m	Bassa temperatura
collaboration	collaborazione	f	Lavorare insieme
collapse	crollo	m	Fallimento improvviso
collar	colletto	m	Parte del collo dell'indumento
collateral	garanzia	f	Garanzia promessa per il rimborso del prestito
colleague	collega	m	Collega
collection	collezione	f	Raccolta
college	college	m	Scuola
colonel	colonnello	m	Ufficiale militare
colony	colonia	f	Insediamento
color	colore	m	Tonalità
coloring	colorazione	f	Processo di aggiunta del colore
Colosseum	Colosseo	m	Grande anfiteatro romano antico
column	colonna	f	Pilastro
comb	pettine	m	Dispositivo dentato per capelli
combat	combattimento	m	Combattimento
combination	combinazione	f	Miscela
comedy	commedia	f	Spettacolo divertente
comer	nuovo arrivato	m	Persona che arriva da qualche parte
comet	cometa	f	Corpo celeste con coda luminosa
comfort	comfort	m	Agio fisico
comic	fumetto	m	Storia illustrata divertente
command	comando	m	Ordine
commander	comandante	m	Leader militare
comment	commento	m	Osservazione
commentary	commento	m	Osservazioni esplicative su un evento
commerce	commercio	m	Commercio
commercial	pubblicità	f	Pubblicità commerciale
commission	commissione	f	Tariffa
commitment	impegno	m	Promessa
committee	comitato	m	Gruppo
common	comune	m	Area condivisa
commonwealth	commonwealth	m	Comunità politica
communication	comunicazione	f	Contatto
communion	comunione	f	Condivisione di pensieri
communism	comunismo	m	Sistema politico con proprietà comune
communist	comunista	m	Sostenitore dell'ideologia comunista
community	comunità	f	Quartiere
companion	compagno	m	Amico
company	azienda	f	Impresa
comparative	comparativo	m	Confronto tra cose
comparison	confronto	m	Contrasto
compass	bussola	f	Strumento di navigazione che mostra la direzione
compassion	compassione	f	Simpatia
compensation	compenso	m	Pagamento
competence	competenza	f	Capacità di fare qualcosa bene
competition	competizione	f	Gara
compilation	compilazione	f	Raccolta di elementi assemblati insieme
complaint	reclamo	m	Lamentela
completion	completamento	m	Azione di finire qualcosa
complexion	carnagione	f	Colore naturale e aspetto della pelle
complexity	complessità	f	Complicazione
complication	complicazione	f	Elemento complesso o confuso
compliment	complimento	m	Espressione educata di lode
composer	compositore	m	Creatore di musica
composition	composizione	f	Opera musicale
compost	compost	m	Materia organica decomposta usata come fertilizzante
compound	composto	m	Miscela
compromise	compromesso	m	Accordo mediante concessione reciproca
compulsion	compulsione	f	Impulso irresistibile a comportarsi in un certo modo
computer	computer	m	Macchina
comrade	compagno	m	Compagno o collega
conceit	presunzione	f	Orgoglio eccessivo in se stessi
concentration	concentrazione	f	Concentrazione
concept	concetto	m	Idea
conception	concezione	f	Formazione di un'idea
concern	preoccupazione	f	Preoccupazione
concert	concerto	m	Esibizione musicale
concession	concessione	f	Cosa concessa o ceduta
conclusion	conclusione	f	Fine
concrete	calcestruzzo	m	Materiale da costruzione
condemnation	condanna	f	Espressione di disapprovazione
condition	condizione	f	Stato
condominium	condominio	m	Appartamento di proprietà individuale in un edificio
conduct	comportamento	m	Comportamento
conductor	direttore	m	Leader dell'orchestra
conference	conferenza	f	Riunione
confession	confessione	f	Ammissione di colpa o illecito
confidence	fiducia	f	Fiducia
confinement	reclusione	f	Stato di essere confinato
conflict	conflitto	m	Disputa
confusion	confusione	f	Sconcerto
conglomerate	conglomerato	m	Grande società con attività diverse
congratulation	congratulazione	f	Espressione di gioia per un risultato
congregation	congregazione	f	Gruppo riunito per il culto
congress	congresso	m	Assemblea
conjunction	congiunzione	f	Combinazione
connection	connessione	f	Collegamento
conqueror	conquistatore	m	Persona che conquista territori
conquest	conquista	f	Atto di conquistare
conscience	coscienza	f	Senso morale
conscious	coscienza	f	Consapevolezza
consciousness	coscienza	f	Stato di consapevolezza
conscription	coscrizione	f	Arruolamento obbligatorio di persone per il servizio statale
consequence	conseguenza	f	Risultato o effetto di un'azione
consideration	considerazione	f	Pensiero attento su qualcosa
consignment	spedizione	f	Lotto di merci inviate o consegnate			
consistency	consistenza	f	Qualità di mantenere uniformità nella struttura, composizione o comportamento nel tempo
consolation	consolazione	f	Conforto ricevuto dopo una perdita o delusione
consortium	consorzio	m	Associazione o partenariato di organizzazioni che lavorano insieme per uno scopo comune
conspiracy	cospirazione	f	Piano segreto di un gruppo per fare qualcosa di illegale o dannoso
constable	agente	m	Ufficiale di pace con autorità di polizia limitata, tipicamente in un'area specifica
constellation	costellazione	f	Gruppo di stelle che formano un motivo riconoscibile nel cielo notturno
constitution	costituzione	f	Principi fondamentali o precedenti consolidati che governano uno stato o un'organizzazione
constraint	vincolo	m	Limitazione o restrizione imposta a qualcosa
construction	costruzione	f	Processo di costruzione o assemblaggio di qualcosa
consulate	consolato	m	Ufficio o residenza di un console
consultancy	consulenza	f	Pratica professionale che fornisce consulenza esperta in un campo particolare
consultation	consultazione	f	Incontro con un esperto per chiedere consiglio o discutere una questione specifica
consulting	consulenza	f	Attività di fornire consulenza professionale o esperta ad altri a pagamento
consumer	consumatore	m	Persona che acquista beni e servizi per uso personale
consumption	consumo	m	Azione di utilizzare una risorsa o mangiare e bere qualcosa
contact	contatto	m	Incontro o comunicazione con qualcuno
container	contenitore	m	Oggetto utilizzato per contenere o trasportare qualcosa
contamination	contaminazione	f	Azione o stato di rendere qualcosa impuro per esposizione a una sostanza inquinante
contempt	disprezzo	m	Sensazione che una persona o cosa sia al di sotto della considerazione o senza valore
content	contenuto	m	Cose che sono contenute in qualcosa
contention	contesa	f	Disaccordo acceso o affermazione fatta in un argomento
contest	gara	f	Competizione tra rivali per la supremazia o un premio
context	contesto	m	Circostanze o ambiente in cui si verifica un evento
continent	continente	m	Una delle principali estensioni continue di terra del mondo che comprende grandi regioni geografiche
contingent	contingente	m	Gruppo di persone che formano parte di un gruppo più grande, specialmente in un raduno
continuation	continuazione	f	Azione di portare avanti qualcosa o mantenere un processo senza interruzione
continuity	continuità	f	Esistenza o funzionamento ininterrotto e coerente di qualcosa nel tempo
contour	contorno	m	Profilo di una figura o forma
contract	contratto	m	Accordo scritto o parlato che deve essere applicabile per legge
contraction	contrazione	f	Processo di diventare più piccolo
contractor	appaltatore	m	Persona o azienda che assume un contratto per fornire materiali o lavoro per un progetto
contrary	contrario	m	Opposto o inverso di qualcosa
contrast	contrasto	m	Stato di essere sorprendentemente diverso da qualcosa in giustapposizione o stretta associazione
contribution	contributo	m	Qualcosa dato a un fondo comune o raccolta
control	controllo	m	Potere di dirigere o influenzare persone o eventi
controversy	controversia	f	Disaccordo pubblico prolungato o discussione accesa su una questione di opinione
convenience	convenienza	f	Stato di essere in grado di procedere con qualcosa senza difficoltà
convention	convenzione	f	Grande riunione o conferenza di persone con un interesse o professione condivisa
conversation	conversazione	f	Scambio informale di idee attraverso parole parlate tra due o più persone
converse	contrario	m	Opposto o inverso di un'affermazione o proposizione
conversion	conversione	f	Processo di cambiamento o causare qualcosa a cambiare da una forma all'altra
conveyance	trasporto	m	Azione o processo di trasportare qualcuno o qualcosa da un luogo all'altro
conviction	convinzione	f	Credenza o opinione fermamente tenuta
cook	cuoco	m	Persona che prepara e cucina cibo come lavoro o per piacere
cookery	cucina	f	Pratica o abilità di preparare e cucinare cibo
cookie	biscotto	m	Piccola torta dolce, tipicamente rotonda e piatta, fatta di farina, zucchero e burro
cooking	cucina	f	Pratica o abilità di preparare cibo combinando e riscaldando ingredienti
cool	fresco	m	Temperatura abbastanza bassa
cooperation	cooperazione	f	Azione o processo di lavorare insieme verso un obiettivo o scopo comune
coordinate	coordinata	f	Valore che specifica la posizione di un punto su una linea, superficie o nello spazio
cop	poliziotto	m	Agente di polizia che applica la legge e mantiene l'ordine pubblico
copper	rame	m	Elemento chimico metallico di colore rosso-marrone utilizzato per cablaggio elettrico e costruzione
copy	copia	f	Cosa fatta per sembrare o essere come qualcos'altro
copyright	diritto d'autore	m	Diritto legale esclusivo di riprodurre, pubblicare e vendere un'opera creativa
coral	corallo	m	Sostanza dura e pietrosa secreta da polipi marini come scheletro esterno
cord	corda	f	Lunghezza di materiale flessibile fatto di fili intrecciati o tessuti
cordial	cordiale	m	Bevanda dolce aromatizzata alla frutta
core	nucleo	m	Parte centrale o più importante di qualcosa
cork	sughero	m	Sostanza galleggiante di colore marrone chiaro ottenuta dalla corteccia esterna di una quercia mediterranea
corn	mais	m	Principale coltura cerealicola di una regione, specialmente grano in Inghilterra o mais in America
corner	angolo	m	Luogo o angolo dove due lati o bordi si incontrano
corporal	caporale	m	Grado di sottufficiale nelle forze armate, sopra il soldato semplice e sotto il sergente
corporation	società	f	Grande azienda o gruppo di aziende autorizzate ad agire come un'unica entità giuridica
corps	corpo	m	Principale suddivisione di una forza armata sul campo
correction	correzione	f	Cambiamento che rettifica un errore o imprecisione
correlation	correlazione	f	Relazione reciproca o connessione tra due o più cose che tendono a variare insieme
correspondence	corrispondenza	f	Lettere o email inviate o ricevute
correspondent	corrispondente	m	Persona che scrive lettere o rapporti su eventi per un giornale o emittente
corridor	corridoio	m	Passaggio in un edificio con stanze che si aprono su di esso
corruption	corruzione	f	Condotta disonesta o fraudolenta da parte di chi è al potere
cosmetic	cosmetico	m	Prodotto applicato al corpo per migliorare o alterare l'aspetto
cosmos	cosmo	m	Universo visto come sistema ben ordinato e armonioso
cost	costo	m	Quantità di denaro necessaria per acquistare o realizzare qualcosa
costume	costume	m	Set di vestiti indossati per rappresentare un personaggio, periodo o tema particolare
cottage	casetta	f	Piccola casa semplice, tipicamente in una posizione rurale o semi-rurale
cotton	cotone	m	Sostanza fibrosa bianca e morbida che circonda i semi di una pianta tropicale e subtropicale
couch	divano	m	Lungo mobile imbottito per far sedere più persone
cough	tosse	f	Espulsione improvvisa di aria dai polmoni con un suono acuto per liberare le vie respiratorie
council	consiglio	m	Organo di persone elette o nominate per prendere decisioni o dare consigli su una questione particolare
counsel	consiglio	m	Consiglio dato formalmente o professionalmente
counseling	consulenza	f	Fornitura di assistenza e guida professionale nella risoluzione di problemi personali o psicologici
count	conteggio	m	Determinazione del numero totale di qualcosa
countenance	espressione	f	Volto o espressione facciale di una persona
counter	bancone	m	Apparecchio lungo con piano superiore utilizzato per transazioni o esposizione di merci
country	paese	m	Nazione con proprio governo che occupa un territorio particolare
countryside	campagna	f	Terra e paesaggio di un'area rurale
county	contea	f	Divisione territoriale di alcuni paesi per scopi amministrativi o politici
coup	colpo di stato	m	Presa di potere improvvisa e violenta da un governo
couple	coppia	f	Due individui dello stesso tipo considerati insieme
courage	coraggio	m	Capacità di fare qualcosa che spaventa
courier	corriere	m	Persona o azienda impiegata per consegnare messaggi, pacchi o posta rapidamente
course	corso	m	Percorso o direzione seguita da qualcosa
court	tribunale	m	Tribunale presieduto da un giudice per l'amministrazione della giustizia
courtesy	cortesia	f	Comportamento educato che mostra rispetto e considerazione verso gli altri
courthouse	palazzo di giustizia	m	Edificio in cui si tiene un tribunale
courtroom	aula	f	Luogo o stanza in cui un tribunale si riunisce per condurre procedimenti legali
courtship	corteggiamento	m	Periodo durante il quale una relazione romantica si sviluppa prima del matrimonio
cousin	cugino	m	Figlio dello zio o della zia
cover	copertura	f	Qualcosa posto sopra un oggetto per proteggerlo o nasconderlo
coverage	copertura	f	Misura in cui qualcosa è coperto o trattato
cow	mucca	f	Femmina adulta di bovini domestici allevata per latte o produzione di carne
coward	codardo	m	Persona che manca di coraggio per affrontare pericolo, difficoltà o dolore
crab	granchio	m	Crostaceo con guscio piatto e largo e chele, che tipicamente cammina lateralmente
crack	crepa	f	Linea su una superficie dove qualcosa si è diviso senza rompersi completamente
cracker	cracker	m	Biscotto secco sottile tipicamente mangiato con formaggio o altri condimenti salati
cradle	culla	f	Piccolo letto per un neonato, spesso su dondoli
craft	artigianato	m	Attività che coinvolge abilità nel fare cose a mano
cram	studio intensivo	m	Atto di studiare intensamente in un breve periodo per prepararsi a un esame
cramp	crampo	m	Contrazione muscolare involontaria e dolorosa
crane	gru	f	Grande macchina alta utilizzata per spostare oggetti pesanti sospendendoli da un braccio sporgente
crash	schianto	m	Collisione violenta tra veicoli o con un ostacolo
crawl	strisciamento	m	Atto di muoversi in avanti su mani e ginocchia
cream	panna	f	Liquido grasso bianco o giallo pallido che sale in cima al latte
creation	creazione	f	Azione o processo di portare qualcosa all'esistenza
creator	creatore	m	Persona o cosa che porta qualcosa all'esistenza
creature	creatura	f	Animale o essere, specialmente uno non umano
credit	credito	m	Riconoscimento e lode per un risultato
creditor	creditore	m	Persona o istituzione a cui è dovuto denaro da un'altra parte
creed	credo	m	Sistema di credenza religiosa
creek	ruscello	m	Corso d'acqua o affluente minore di un fiume
creep	movimento lento	m	Movimento lento, specialmente in avanti con il corpo vicino al suolo
crescent	mezzaluna	f	Forma curva della luna crescente o calante
crew	equipaggio	m	Gruppo di persone che lavorano insieme su una nave, aereo o altro veicolo
crib	culla	f	Piccolo letto con lati alti per un neonato o bambino molto piccolo
crime	crimine	m	Azione od omissione che costituisce reato punibile per legge
criminal	criminale	m	Persona che ha commesso un reato punibile per legge
crisis	crisi	f	Momento di intenso disagio, problema o pericolo che richiede azione immediata
criterion	criterio	m	Principio o standard con cui qualcosa può essere giudicato o deciso
critic	critico	m	Persona che esprime opinioni o giudizi sfavorevoli su qualcosa
criticism	critica	f	Espressione di disapprovazione basata su difetti percepiti
crocodile	coccodrillo	m	Grande rettile semiacquatico predatore con mascelle lunghe, coda lunga e pelle squamosa spessa
crop	raccolto	m	Pianta coltivata cresciuta come cibo per gli esseri umani o foraggio per il bestiame
cross	croce	f	Segno o forma formata da due linee che si intersecano
crossing	attraversamento	m	Luogo dove strade, linee ferroviarie o altri percorsi si intersecano o dove si può attraversare
crouch	accovacciamento	m	Posizione in cui le ginocchia sono piegate e la parte superiore del corpo è portata avanti e in basso
crow	corvo	m	Grande uccello nero della famiglia dei corvidi con un richiamo aspro
crowd	folla	f	Grande numero di persone riunite insieme in modo disorganizzato o turbolento
crown	corona	f	Copricapo ornamentale indossato da un monarca come simbolo di sovranità
cruelty	crudeltà	f	Indifferenza insensibile o piacere nel causare dolore e sofferenza agli altri
cruise	crociera	f	Viaggio su una nave o barca fatto per piacere, tipicamente con scalo in diversi porti
crumb	briciola	f	Piccolo frammento di pane, torta o cracker
crunch	scricchiolio	m	Suono forte e scricchiolante prodotto quando si morde o si cammina su qualcosa di croccante
crusade	crociata	f	Campagna vigorosa per un cambiamento politico, sociale o religioso
crush	cotta	f	Infatuazione breve ma intensa per qualcuno
crust	crosta	f	Parte esterna dura di una pagnotta di pane
crutch	stampella	f	Lungo bastone con traversa in alto usato come supporto sotto l'ascella da una persona zoppa
cry	grido	m	Urlo o grido inarticolato e forte che esprime emozione
crystal	cristallo	m	Sostanza solida trasparente con una struttura interna simmetrica
cube	cubo	m	Forma geometrica tridimensionale con sei facce quadrate uguali che si incontrano ad angoli retti
cuckoo	cuculo	m	Uccello di medie dimensioni noto per deporre uova nei nidi di altri uccelli
cucumber	cetriolo	m	Frutto cilindrico lungo con buccia verde e polpa acquosa, mangiato come verdura
cuddle	coccola	f	Abbraccio prolungato che esprime affetto
cuff	polsino	m	Parte finale di una manica dove il materiale è ripiegato o una fascia separata è cucita
cult	setta	f	Sistema di venerazione religiosa diretto verso una particolare figura o oggetto
cultivation	coltivazione	f	Azione di preparare e utilizzare il terreno per le colture
culture	cultura	f	Arti, costumi e realizzazioni di una particolare nazione, popolo o gruppo sociale
cup	tazza	f	Piccolo contenitore a forma di ciotola per bere, tipicamente con un manico
cure	cura	f	Sostanza o trattamento che allevia o elimina una malattia o condizione
curfew	coprifuoco	m	Regolamento che richiede alle persone di rimanere in casa durante orari specificati
curiosity	curiosità	f	Forte desiderio di sapere o imparare qualcosa
curl	riccio	m	Forma avvolta o spirale
currency	valuta	f	Sistema di denaro in uso generale in un paese particolare in un momento particolare
current	corrente	f	Corpo d'acqua o aria che si muove in una direzione definita
curriculum	curriculum	m	Materie che compongono un corso di studi in una scuola o università
curry	curry	m	Piatto di carne, verdure o pesce cucinato in una salsa speziata di origine indiana o del sud-est asiatico
curse	maledizione	f	Espressione solenne intesa a invocare danno soprannaturale su qualcuno o qualcosa
curtain	tenda	f	Pezzo di materiale sospeso in alto per formare una copertura o schermo a una finestra o porta
curve	curva	f	Linea o profilo che gradualmente si discosta dall'essere dritto
cushion	cuscino	m	Sacca morbida di stoffa riempita di materiale imbottito utilizzata per sedersi o appoggiarsi
custard	crema	f	Dessert dolce fatto con latte, uova e zucchero, spesso servito come salsa
custody	custodia	f	Cura protettiva o tutela di qualcuno o qualcosa
custom	usanza	f	Modo tradizionale e ampiamente accettato di comportarsi o fare qualcosa in una particolare società
customer	cliente	m	Persona che acquista beni o servizi da un negozio o azienda
cut	taglio	m	Apertura o ferita fatta tagliando
cutback	riduzione	f	Riduzione di qualcosa, tipicamente spesa o fornitura pianificata
cycle	ciclo	m	Serie di eventi che si ripetono regolarmente nello stesso ordine
cycling	ciclismo	m	Sport o attività di andare in bicicletta per ricreazione, esercizio o competizione
dad	papà	m	Proprio padre
daffodil	giunchiglia	f	Pianta bulbosa con fiori gialli brillanti a forma di tromba che fioriscono in primavera
daily	quotidiano	m	Giornale pubblicato ogni giorno tranne la domenica
dairy	latteria	f	Edificio o stanza per la lavorazione, conservazione e distribuzione del latte e dei prodotti lattiero-caseari
daisy	margherita	f	Piccola pianta dei prati con fiori bianchi con disco giallo e raggi bianchi
dam	diga	f	Barriera costruita attraverso un fiume per trattenere l'acqua e formare un bacino
damage	danno	m	Danno fisico che compromette valore, utilità o funzione normale
damn	imprecazione	f	Espressione della parola usata per esprimere rabbia, sorpresa o frustrazione
dance	danza	f	Serie di movimenti che corrispondono alla velocità e al ritmo della musica
dancer	ballerino	m	Persona che danza o la cui professione è danzare
dandelion	dente di leone	m	Erbaccia ampiamente diffusa con fiori gialli e teste di semi soffici portate dal vento
danger	pericolo	m	Possibilità di subire danni o lesioni
dare	sfida	f	Sfida a fare qualcosa di pericoloso o sconsiderato
dark	buio	m	Assenza di luce in un luogo
darkness	oscurità	f	Assenza parziale o totale di luce
darling	tesoro	m	Persona amata
dart	dardo	m	Piccolo missile appuntito lanciato o sparato come arma o in un gioco
dash	corsa	f	Corsa improvvisa o movimento rapido in una direzione particolare
data	dati	m	Fatti e statistiche raccolti insieme per riferimento o analisi
database	database	m	Insieme strutturato di dati conservato in un sistema informatico
date	data	f	Giorno particolare del mese o dell'anno identificato da un numero
daughter	figlia	f	Figlia femmina in relazione ai suoi genitori
dawn	alba	f	Prima apparizione della luce nel cielo prima dell'alba
day	giorno	m	Periodo di ventiquattro ore come unità di tempo
daybreak	alba	f	Ora del mattino quando appare per la prima volta la luce del giorno
daylight	luce del giorno	f	Luce naturale del giorno
daytime	giorno	m	Tempo tra alba e tramonto quando c'è luce naturale dal sole
daze	stordimento	m	Stato di confusione stordita o sbigottimento causato da un colpo o shock
dazzle	abbagliamento	m	Qualità di essere estremamente luminoso, impressionante o abile
dead	morti	m	Persone che sono morte
deadline	scadenza	f	Ultimo momento o data entro cui qualcosa dovrebbe essere completato o presentato
deadlock	stallo	m	Situazione in cui non è possibile fare progressi a causa di disaccordo fondamentale
deal	accordo	m	Accordo stipulato da due o più parti per mutuo beneficio
dealer	rivenditore	m	Persona o azienda che compra e vende merci
dealership	concessionaria	f	Azienda autorizzata a vendere un particolare prodotto, specialmente veicoli
dealing	commercio	m	Azione o attività di comprare e vendere una particolare merce
dear	caro	m	Persona amata o cara
death	morte	f	Azione o fatto di morire o essere ucciso
debate	dibattito	m	Discussione formale su un argomento particolare in cui vengono presentati argomenti opposti
debt	debito	m	Qualcosa, tipicamente denaro, che è dovuto o dovuto a un'altra parte
debtor	debitore	m	Persona o istituzione che deve una somma di denaro a un'altra parte
decade	decennio	m	Periodo di dieci anni, specialmente un periodo come gli anni '80 o '90
deceit	inganno	m	Azione o pratica di ingannare qualcuno occultando o travisando la verità
December	dicembre	m	Dodicesimo e ultimo mese dell'anno nel calendario gregoriano
decency	decenza	f	Comportamento conforme agli standard accettati di moralità o rispettabilità
deception	inganno	m	Atto di far credere a qualcuno qualcosa che non è vero
decision	decisione	f	Conclusione o risoluzione raggiunta dopo considerazione
deck	ponte	m	Struttura di assi che formano una piattaforma o pavimento, specialmente su una nave o fuori da una casa			
declaration	dichiarazione	f	Dichiarazione o annuncio formale o esplicito
decline	declino	m	Perdita graduale e continua di forza, numero o valore
decoration	decorazione	f	Processo o arte di ornare qualcosa
decrease	diminuzione	f	Processo o risultato del diventare più piccolo o meno numeroso
decree	decreto	m	Ordine ufficiale emesso da un'autorità legale
dedication	dedizione	f	Qualità di essere impegnato in un compito o scopo
deduction	deduzione	f	Azione di sottrarre qualcosa da un totale
deep	profondità	f	Mare od oceano
deer	cervo	m	Animale ungulato al pascolo con corna ramificate
default	inadempienza	f	Mancato adempimento di un'obbligazione
defeat	sconfitta	f	Caso di essere sconfitto
defect	difetto	m	Mancanza, imperfezione o carenza in qualcosa
defendant	imputato	m	Individuo o entità accusato in un tribunale
defense	difesa	f	Azione di difendersi da un attacco
deficiency	carenza	f	Mancanza o scarsità di qualcosa di essenziale
deficit	deficit	m	Importo per cui qualcosa è troppo piccolo
definition	definizione	f	Dichiarazione del significato esatto di una parola
deflation	deflazione	f	Azione o processo di deflazionare
degree	grado	m	Quantità, livello o misura in cui qualcosa accade
deity	divinità	f	Dio o dea in una religione politeista
delay	ritardo	m	Periodo di tempo per cui qualcosa è in ritardo
delegate	delegato	m	Persona inviata o autorizzata a rappresentare altri
delegation	delegazione	f	Corpo di delegati o rappresentanti
delicacy	prelibatezza	f	Qualcosa di buono da mangiare che è costoso o raro
delight	gioia	f	Grande piacere o soddisfazione
delivery	consegna	f	Azione di consegnare lettere, pacchi o merci
delta	delta	m	Tratto triangolare di sedimenti depositato alla foce di un fiume
deluge	diluvio	m	Alluvione grave o quantità travolgente di qualcosa
demand	domanda	f	Richiesta insistente e perentoria fatta come per diritto
democracy	democrazia	f	Sistema di governo da parte dell'intera popolazione
demonstration	dimostrazione	f	Azione di mostrare l'esistenza o la verità di qualcosa
denial	negazione	f	Azione di dichiarare qualcosa non vero
denim	denim	m	Tessuto di cotone twill resistente, tipicamente blu
denomination	denominazione	f	Ramo autonomo riconosciuto di una religione
density	densità	f	Grado di compattezza di una sostanza
