en	translation	gender	meaning_translation
abbey	abadía	f	Un edificio o edificios ocupados por una comunidad de monjes o monjas
abbreviation	abreviatura	f	Una forma acortada de una palabra o frase
ability	habilidad	f	La posesión de los medios o habilidad para hacer algo
abnormality	anormalidad	f	Una característica o cualidad que se desvía de lo normal o esperado
abortion	aborto	m	La terminación deliberada de un embarazo humano
absence	ausencia	f	El estado de estar lejos de un lugar o persona
absolute	absoluto	m	Un valor o principio considerado universalmente válido
abstract	resumen	m	Un resumen del contenido de un libro, artículo o discurso formal
abstraction	abstracción	f	La cualidad de tratar con ideas en lugar de eventos u objetos físicos
absurd	absurdo	m	La cualidad o estado de ser ridículo o extremadamente irrazonable
absurdity	absurdidad	f	La cualidad o estado de ser completamente irrazonable o ilógico
abundance	abundancia	f	Una cantidad muy grande de algo
abuse	abuso	m	El uso inadecuado de algo
academy	academia	f	Un lugar de estudio o entrenamiento en un campo especial
accent	acento	m	Un modo distintivo de pronunciación de un idioma
access	acceso	m	Los medios u oportunidad para acercarse, entrar o usar algo
accessory	accesorio	m	Una cosa que se puede agregar a algo más para hacerlo más útil
accident	accidente	m	Un incidente desafortunado que ocurre inesperada e involuntariamente
accommodation	alojamiento	m	Una habitación, grupo de habitaciones o edificio en el que alguien puede vivir o quedarse
accomplishment	logro	m	Algo que se ha logrado con éxito
accord	acuerdo	m	Un acuerdo oficial o tratado
account	cuenta	f	Un informe o descripción de un evento o experiencia
accounting	contabilidad	f	La acción o proceso de llevar cuentas financieras
accumulation	acumulación	f	La adquisición o reunión gradual de algo con el tiempo
achievement	logro	m	Una cosa hecha con éxito, típicamente por esfuerzo, coraje o habilidad
acid	ácido	m	Una sustancia química que neutraliza álcalis
acquaintance	conocido	m	Una persona que uno conoce ligeramente pero que no es un amigo cercano
acquisition	adquisición	f	Un activo u objeto comprado u obtenido
acquittal	absolución	f	Un juicio de que una persona no es culpable del delito con el que ha sido acusada
acre	acre	m	Una unidad de área de tierra igual a 4,840 yardas cuadradas
act	acto	m	Una cosa hecha
acting	actuación	f	El arte u ocupación de interpretar roles ficticios
action	acción	f	El hecho o proceso de hacer algo para lograr un propósito particular
activity	actividad	f	Una condición en la que las cosas están sucediendo o siendo hechas
actor	actor	m	Una persona cuya profesión es actuar en obras de teatro, películas o programas de televisión
actress	actriz	f	Una persona femenina cuya profesión es actuar en obras de teatro, películas o programas de televisión
actuality	realidad	f	El estado de existir en la realidad
adaptation	adaptación	f	La acción o proceso de adaptar o ser adaptado
addiction	adicción	f	El hecho o condición de ser dependiente de una sustancia, cosa o actividad particular
addition	adición	f	La acción o proceso de agregar algo a otra cosa
additive	aditivo	m	Una sustancia agregada a algo en pequeñas cantidades para mejorarlo o preservarlo
address	dirección	f	Los detalles del lugar donde alguien vive o una organización está situada
adherence	adherencia	f	Apego o compromiso con una persona, causa o creencia
administration	administración	f	El proceso o actividad de administrar un negocio, organización o sistema
admiral	almirante	m	Un comandante de una flota o escuadrón naval
admiration	admiración	f	Respeto y aprobación cálida por alguien o algo
admission	admisión	f	Una declaración que reconoce la verdad de algo
adornment	adorno	m	Una cosa que adorna o decora
adult	adulto	m	Una persona que está completamente desarrollada o crecida
advance	avance	m	Movimiento hacia adelante o progreso
advantage	ventaja	f	Una condición o circunstancia que pone a uno en una posición favorable o superior
adventure	aventura	f	Una experiencia o actividad inusual y emocionante, típicamente peligrosa
adversary	adversario	m	El oponente de uno en un concurso, conflicto o disputa
adversity	adversidad	f	Dificultades o infortunio
advertisement	anuncio	m	Un aviso o anuncio en un medio público que promociona un producto, servicio o evento
advertiser	anunciante	m	Una persona o empresa que anuncia productos, servicios o eventos
advice	consejo	m	Orientación o recomendaciones sobre acciones futuras prudentes
adviser	asesor	m	Una persona que da consejos, típicamente alguien que es experto en un campo particular
advocacy	defensa	f	Apoyo público o recomendación de una causa o política particular
affair	asunto	m	Un evento o secuencia de eventos de un tipo especificado
affection	afecto	m	Un sentimiento gentil de cariño o gusto por alguien o algo
affidavit	declaración	f	Una declaración escrita confirmada por juramento o afirmación para uso como evidencia en el tribunal
affinity	afinidad	f	Un gusto o simpatía espontánea o natural por alguien o algo
aftercare	cuidado	m	Cuidado de una persona después de una estadía en un hospital
afternoon	tarde	f	El tiempo desde el mediodía o la hora del almuerzo hasta la noche
age	edad	f	La duración del tiempo que una persona ha vivido o una cosa ha existido
agency	agencia	f	Un negocio u organización establecida para proporcionar un servicio particular
agenda	agenda	f	Una lista de elementos a discutir en una reunión formal
agent	agente	m	Una persona que actúa en nombre de otra persona o grupo
aggregate	agregado	m	Un todo formado por la combinación de varios elementos dispares
agitation	agitación	f	Un estado de ansiedad o excitación nerviosa
agony	agonía	f	Sufrimiento físico o mental extremo
agreement	acuerdo	m	Armonía o concordancia en opinión o sentimiento
agriculture	agricultura	f	La ciencia o práctica de la agricultura
aid	ayuda	f	Ayuda, típicamente de naturaleza práctica
aide	asistente	m	Un asistente de una persona importante
aim	objetivo	m	Un propósito o intención
air	aire	m	La sustancia gaseosa invisible que rodea la tierra
airhead	tonto	m	Una persona tonta o necia
airport	aeropuerto	m	Un complejo de pistas y edificios para el despegue, aterrizaje y mantenimiento de aeronaves civiles
airway	vía	f	Una ruta seguida regularmente por aeronaves
alarm	alarma	f	Una conciencia ansiosa del peligro
alaska	Alaska	f	Un estado de EE. UU. en el extremo noroeste de América del Norte
album	álbum	m	Una colección de grabaciones emitidas como un solo artículo
alcohol	alcohol	m	Un líquido incoloro volátil inflamable producido por fermentación de azúcares
alcoholism	alcoholismo	m	Adicción al consumo de licor alcohólico
alibi	coartada	f	Una reclamación o prueba de que uno estaba en otro lugar cuando ocurrió un acto alegado
alien	extraterrestre	m	Un ser de otro mundo
alignment	alineación	f	Disposición en línea recta o en posiciones relativas correctas
all	todo	m	La cantidad o extensión completa de un grupo o cosa particular
all-nighter	desvelada	f	Un evento o actividad que dura toda la noche
allegiance	lealtad	f	Lealtad o compromiso con un superior o con un grupo o causa
allergy	alergia	f	Una respuesta inmune dañina del cuerpo a una sustancia a la que se ha vuelto hipersensible
alliance	alianza	f	Una unión o asociación formada para beneficio mutuo entre países u organizaciones
alligator	caimán	m	Un gran reptil semiacuático similar a un cocodrilo
allocation	asignación	f	La acción o proceso de distribuir o asignar algo
allotment	parcela	f	Una porción de algo asignado a alguien
allowance	asignación	f	La cantidad de algo que está permitido o asignado
alloy	aleación	f	Un metal hecho combinando dos o más elementos metálicos
ally	aliado	m	Un estado que coopera formalmente con otro para propósitos militares u otros
almond	almendra	f	La semilla comestible ovalada de un árbol relacionado con el melocotón y la ciruela
alpaca	alpaca	f	Un mamífero sudamericano domesticado relacionado con la llama
alpha	alfa	f	La primera letra del alfabeto griego
alphabet	alfabeto	m	Un conjunto de letras o símbolos en un orden fijo
alternative	alternativa	f	Una de dos o más posibilidades disponibles
altitude	altitud	f	La altura de un objeto o punto en relación con el nivel del mar o el nivel del suelo
alto	alto	m	La segunda voz de canto más alta en armonía de cuatro partes
amateur	aficionado	m	Una persona que participa en una actividad por placer
amber	ámbar	m	Resina fosilizada dura translúcida que se origina de árboles coníferos extintos
ambiguity	ambigüedad	f	La cualidad de estar abierto a más de una interpretación
ambition	ambición	f	Un fuerte deseo de hacer o lograr algo
amendment	enmienda	f	Un cambio o adición menor diseñado para mejorar un texto o legislación
America	América	f	Una masa de tierra que comprende los continentes de América del Norte y del Sur
American	estadounidense	m	Un nativo o ciudadano de los Estados Unidos
amethyst	amatista	f	Una piedra preciosa que consiste en una variedad violeta o púrpura de cuarzo
ammunition	munición	f	Un suministro de balas y proyectiles
amnesty	amnistía	f	Un perdón oficial para personas que han sido condenadas por delitos políticos
amount	cantidad	f	Una cantidad de algo
ampere	amperio	m	La unidad base de corriente eléctrica en el Sistema Internacional de Unidades
amplitude	amplitud	f	La extensión máxima de una vibración u oscilación
amusement	diversión	f	El estado o experiencia de encontrar algo divertido o entretenido
anagram	anagrama	m	Una palabra o frase formada reorganizando las letras de una palabra o frase diferente
analogy	analogía	f	Una comparación entre dos cosas con el propósito de explicación o aclaración
analysis	análisis	m	Examen detallado de los elementos o estructura de algo
anarchy	anarquía	f	Un estado de desorden debido a la ausencia o no reconocimiento de autoridad
anatomy	anatomía	f	La rama de la ciencia relacionada con la estructura corporal
ancestor	ancestro	m	Una persona de la cual uno desciende
angel	ángel	m	Un ser espiritual que se cree que actúa como asistente, agente o mensajero de Dios
anger	ira	f	Un fuerte sentimiento de molestia, disgusto u hostilidad
angle	ángulo	m	El espacio entre dos líneas o superficies que se cruzan
animal	animal	m	Un organismo vivo que se alimenta de materia orgánica
animation	animación	f	El estado de estar lleno de vida o vigor
ankle	tobillo	m	La articulación que conecta el pie con la pierna
anniversary	aniversario	m	La fecha en que ocurrió un evento en un año anterior
announcement	anuncio	m	Una declaración pública y típicamente formal sobre un hecho, ocurrencia o intención
announcer	locutor	m	Una persona que anuncia algo, especialmente alguien que presenta programas en radio o televisión
annoyance	molestia	f	El sentimiento o estado de estar molesto
answer	respuesta	f	Una cosa dicha, escrita o hecha para tratar con o como reacción a una pregunta
ant	hormiga	f	Un pequeño insecto típicamente con aguijón
antarctic	Antártida	f	La región alrededor del Polo Sur
antelope	antílope	m	Un mamífero rumiante parecido a un ciervo de carrera rápida
anthem	himno	m	Una canción estimulante o edificante identificada con un grupo, cuerpo o causa particular
anthropology	antropología	f	El estudio de las sociedades y culturas humanas y su desarrollo
antibiotic	antibiótico	m	Una medicina que inhibe el crecimiento o destruye microorganismos
antibody	anticuerpo	m	Una proteína de la sangre producida en respuesta a un antígeno específico
anticipation	anticipación	f	La acción de anticipar algo
antidote	antídoto	m	Una medicina tomada o administrada para contrarrestar un veneno particular
antique	antigüedad	f	Un objeto coleccionable como un mueble o una obra de arte
antiquity	antigüedad	f	El pasado antiguo, especialmente el período de civilizaciones clásicas
antiseptic	antiséptico	m	Una sustancia que previene el crecimiento de microorganismos causantes de enfermedades
anxiety	ansiedad	f	Un sentimiento de preocupación, nerviosismo o inquietud
anybody	cualquiera	m	Cualquier persona o personas
anyone	cualquiera	m	Cualquier persona o personas
anything	cualquier	f	Usado para referirse a una cosa sin importar qué
anywhere	cualquier	m	En o a cualquier lugar
apartment	apartamento	m	Un conjunto de habitaciones que forman una residencia
apathy	apatía	f	Falta de interés, entusiasmo o preocupación
ape	simio	m	Un gran primate que carece de cola
aperture	abertura	f	Una apertura, agujero o brecha
apex	ápice	m	La parte superior o más alta de algo
apocalypse	apocalipsis	m	La destrucción final completa del mundo como se describe en la profecía bíblica
apology	disculpa	f	Un reconocimiento arrepentido de una ofensa o fallo
apostrophe	apóstrofe	m	Un signo de puntuación usado para indicar posesión u omisión de letras o números
apparatus	aparato	m	El equipo técnico o maquinaria necesaria para una actividad o propósito particular
apparel	vestimenta	f	Ropa, especialmente de un tipo particular
appeal	apelación	f	Una solicitud seria o urgente
appearance	apariencia	f	La forma en que alguien o algo se ve
appetite	apetito	m	Un deseo natural de satisfacer una necesidad corporal, especialmente de comida
appetizer	aperitivo	m	Un pequeño plato de comida o bebida tomado antes de una comida
applause	aplauso	m	Aprobación o elogio expresado mediante aplausos
apple	manzana	f	La fruta redonda de un árbol de la familia de las rosas
appliance	electrodoméstico	m	Un dispositivo o equipo diseñado para realizar una tarea específica
applicant	solicitante	m	Una persona que hace una solicitud formal para algo
application	solicitud	f	Una solicitud formal a una autoridad para algo
appointment	cita	f	Un acuerdo para reunirse con alguien en un momento y lugar particular
appraisal	evaluación	f	Una valoración del valor o calidad de algo
appreciation	apreciación	f	El reconocimiento y disfrute de las buenas cualidades de alguien o algo
apprehension	aprehensión	f	Ansiedad o miedo de que algo malo o desagradable suceda
apprentice	aprendiz	m	Una persona que está aprendiendo un oficio de un empleador capacitado
apprenticeship	aprendizaje	m	La posición de un aprendiz
approach	enfoque	m	Una forma de tratar con algo
appropriation	apropiación	f	La acción de tomar algo para uso propio
approval	aprobación	f	La acción de acordar oficialmente algo o aceptar algo como satisfactorio
apricot	albaricoque	m	Una fruta de hueso jugosa con carne amarillo-naranja
April	abril	m	El cuarto mes del año en el calendario gregoriano
apron	delantal	m	Una prenda protectora usada sobre el frente de la ropa
aquatic	acuático	m	Un organismo que vive en o cerca del agua
arab	árabe	m	Un miembro de un pueblo semítico que habita gran parte del Medio Oriente y el norte de África
arbitration	arbitraje	m	El uso de un árbitro para resolver una disputa
arc	arco	m	Una parte de la circunferencia de una curva
arch	arco	m	Una estructura simétrica curva que abarca una apertura
archaeologist	arqueólogo	m	Una persona que estudia la historia y prehistoria humana
archaeology	arqueología	f	El estudio de la actividad humana a través de la recuperación y análisis de la cultura material
archer	arquero	m	Una persona que dispara con arco y flechas
archipelago	archipiélago	m	Un grupo extenso de islas
architect	arquitecto	m	Una persona que diseña edificios
architecture	arquitectura	f	El arte o práctica de diseñar y construir edificios
archive	archivo	m	Una colección de documentos o registros históricos
arctic	Ártico	m	Las regiones alrededor del Polo Norte
area	área	f	Una región o parte de una ciudad, país o el mundo
arena	arena	f	Un área nivelada rodeada de asientos para espectadores
argument	argumento	m	Un intercambio de puntos de vista divergentes u opuestos
aristocracy	aristocracia	f	La clase más alta en ciertas sociedades
arithmetic	aritmética	f	La rama de las matemáticas que se ocupa de las propiedades y manipulación de números
arizona	Arizona	f	Un estado en la región suroeste de los Estados Unidos
arm	brazo	m	Cada una de las dos extremidades superiores del cuerpo humano
armament	armamento	m	Armas y equipo militar
armor	armadura	f	Las cubiertas metálicas usadas anteriormente por soldados o guerreros
army	ejército	m	Una fuerza militar organizada equipada para luchar en tierra
aroma	aroma	m	Un olor distintivo, típicamente agradable
arrangement	arreglo	m	La acción, proceso o resultado de arreglar o ser arreglado
array	conjunto	m	Una exhibición o rango impresionante de un tipo particular de cosa
arrest	arresto	m	La acción de apresar a alguien para ponerlo bajo custodia
arrival	llegada	f	La acción o proceso de llegar
arrow	flecha	f	Un proyectil con punta puntiaguda y cola emplumada
arsenal	arsenal	m	Una colección de armas y equipo militar almacenado por un país o persona
art	arte	m	La expresión o aplicación de la habilidad creativa e imaginación humana
artery	arteria	f	Cualquiera de los tubos de pared muscular que forman parte del sistema de circulación
artichoke	alcachofa	f	Una planta mediterránea con cabezas florales tipo cardo que se comen como verdura
article	artículo	m	Un artículo o objeto particular
artillery	artillería	f	Cañones de gran calibre utilizados en la guerra en tierra
artist	artista	m	Una persona que produce pinturas o dibujos
ascent	ascenso	m	Una pendiente o camino ascendente que uno puede caminar o escalar
ash	ceniza	f	El residuo en polvo que queda después de la quema de una sustancia
Asia	Asia	f	El continente más grande y poblado del mundo
aspect	aspecto	m	Una parte o característica particular de algo
aspiration	aspiración	f	Una esperanza o ambición de lograr algo
aspirin	aspirina	f	Un compuesto sintético utilizado medicinalmente para aliviar el dolor
assault	asalto	m	Un ataque físico
assembly	asamblea	f	Un grupo de personas reunidas en un lugar para un propósito común
assertion	afirmación	f	Una declaración confiada y contundente de hecho o creencia
assessment	evaluación	f	La evaluación o estimación de la naturaleza, calidad o habilidad de alguien o algo
asset	activo	m	Una cosa, persona o cualidad útil o valiosa
assignment	tarea	f	Una tarea o trabajo asignado a alguien como parte de un trabajo o curso de estudio
assistance	asistencia	f	La acción de ayudar a alguien con un trabajo o tarea
assistant	asistente	m	Una persona que ocupa un rango inferior a una persona superior y la ayuda en su trabajo
associate	asociado	m	Un socio o colega en negocios o en el trabajo
association	asociación	f	Un grupo de personas organizadas para un propósito conjunto
assortment	surtido	m	Una colección miscelánea de cosas o personas
assumption	suposición	f	Una cosa que se acepta como verdadera o cierta sin prueba
assurance	garantía	f	Una declaración positiva destinada a dar confianza
asteroid	asteroide	m	Un pequeño cuerpo rocoso que orbita el sol
asthma	asma	f	Una condición respiratoria marcada por espasmos en los bronquios
astonishment	asombro	m	Gran sorpresa o asombro
astrology	astrología	f	El estudio de los movimientos y posiciones relativas de los cuerpos celestes
astronaut	astronauta	m	Una persona entrenada para viajar en una nave espacial
astronomy	astronomía	f	La rama de la ciencia que se ocupa de los objetos celestes
astrophysics	astrofísica	f	La rama de la astronomía relacionada con la naturaleza física de las estrellas
asylum	asilo	m	La protección otorgada por una nación a alguien que ha huido de su país natal
athlete	atleta	m	Una persona competente en deportes y otras formas de ejercicio físico
athletics	atletismo	m	Deportes físicos y juegos de cualquier tipo
atlas	atlas	m	Un libro de mapas o gráficos
atmosphere	atmósfera	f	La envoltura de gases que rodea la tierra u otro planeta
atom	átomo	m	La unidad básica de un elemento químico
atrocity	atrocidad	f	Un acto extremadamente malvado o cruel
attachment	archivo adjunto	m	Una parte o extensión adicional adjunta a algo
attack	ataque	m	Un acto agresivo y violento contra una persona o lugar
attainment	logro	m	La acción o hecho de alcanzar una meta hacia la cual uno ha trabajado
attempt	intento	m	Un esfuerzo para lograr o completar una tarea difícil
attendance	asistencia	f	La acción o estado de ir regularmente o estar presente en un lugar o evento
attendant	asistente	m	Una persona empleada para proporcionar servicio al público
attention	atención	f	Aviso tomado de alguien o algo
attitude	actitud	f	Una forma establecida de pensar o sentir acerca de alguien o algo
attorney	abogado	m	Una persona designada para actuar por otra en asuntos comerciales o legales
attraction	atracción	f	La acción o poder de evocar interés, placer o gusto por alguien o algo
attribute	atributo	m	Una cualidad o característica considerada como parte inherente de alguien o algo
auction	subasta	f	Una venta pública en la que los bienes o propiedades se venden al mejor postor
audience	audiencia	f	Los espectadores o oyentes reunidos en un evento público
audit	auditoría	f	Una inspección oficial de las cuentas de un individuo u organización
audition	audición	f	Una entrevista para un papel como cantante, actor, bailarín o músico
auditor	auditor	m	Una persona que realiza una auditoría
auditorium	auditorio	m	La parte de un teatro, sala de conciertos u otro edificio público donde se sienta la audiencia
August	agosto	m	El octavo mes del año en el calendario gregoriano
aunt	tía	f	La hermana del padre o la madre de uno o la esposa del tío de uno
austerity	austeridad	f	Severidad o gravedad de modales o actitud
Australia	Australia	f	Un país y continente rodeado por los océanos Índico y Pacífico
Australian	australiano	m	Un nativo o habitante del país y continente en el Hemisferio Sur
author	autor	m	Un escritor de un libro, artículo o informe
authority	autoridad	f	El poder o derecho de dar órdenes, tomar decisiones y hacer cumplir la obediencia
auto	auto	m	Un vehículo motorizado
autobiography	autobiografía	f	Un relato de la vida de una persona escrito por esa persona
automation	automatización	f	El uso de equipo en gran parte automático en un sistema de fabricación
automobile	automóvil	m	Un vehículo de carretera, típicamente con cuatro ruedas
autonomy	autonomía	f	El derecho o condición de autogobierno
autumn	otoño	m	La estación después del verano y antes del invierno
availability	disponibilidad	f	La calidad de poder ser usado u obtenido
avalanche	avalancha	f	Una masa de nieve, hielo y rocas que cae rápidamente por una ladera de montaña
avenue	avenida	f	Una calle ancha en una ciudad o pueblo
average	promedio	m	Un número que expresa el valor central o típico en un conjunto de datos
aversion	aversión	f	Un fuerte disgusto o aversión
aviation	aviación	f	El vuelo u operación de aeronaves
avocado	aguacate	m	Una fruta en forma de pera con piel áspera y correosa
award	premio	m	Un premio u otra marca de reconocimiento otorgada en honor de un logro
awareness	conciencia	f	Conocimiento o percepción de una situación o hecho
ax	hacha	f	Una herramienta típicamente utilizada para cortar madera
axis	eje	m	Una línea imaginaria sobre la cual gira un cuerpo
baby	bebé	m	Un niño muy pequeño, especialmente uno recién nacido o recién nacido
bachelor	soltero	m	Un hombre que no está y nunca ha estado casado
back	espalda	f	La superficie posterior del cuerpo humano desde los hombros hasta las caderas
backache	dolor de espalda	m	Un dolor prolongado en la espalda de uno
backbone	columna vertebral	f	La serie de vértebras que se extienden desde el cráneo hasta la pelvis
background	antecedentes	m	La parte de una escena o imagen que forma un escenario
backing	respaldo	m	Ayuda o apoyo
backlog	atraso	m	Una acumulación de algo, especialmente trabajo no completado
backup	respaldo	m	Ayuda o apoyo
bacon	tocino	m	Carne curada del lomo o los costados de un cerdo
bacteria	bacteria	f	Organismos microscópicos unicelulares que pueden existir en diversos ambientes
badge	insignia	f	Una pequeña pieza de metal, tela o plástico con un diseño o palabras
badger	tejón	m	Un mamífero omnívoro nocturno de constitución robusta
badminton	bádminton	m	Un juego con raquetas en el que se juega un volante de un lado a otro sobre una red
bae	amor	m	Un término cariñoso para la pareja romántica de uno
bag	bolsa	f	Un recipiente hecho de material flexible con una abertura en la parte superior
baggage	equipaje	m	Pertenencias personales empacadas en maletas para viajar
bail	fianza	f	La liberación temporal de una persona acusada que espera juicio
bailout	rescate	m	Un acto de dar asistencia financiera a una empresa o economía en quiebra
baker	panadero	m	Una persona cuyo oficio es hacer pan y pasteles
balance	equilibrio	m	Una distribución uniforme del peso que permite a alguien o algo permanecer erguido
ball	pelota	f	Una esfera sólida o hueca, especialmente una que se patea, lanza o golpea en un juego
ballad	balada	f	Un poema o canción que narra una historia en estrofas cortas
ballet	ballet	m	Una forma de danza artística realizada con música
balloon	globo	m	Un saco de goma de colores brillantes inflado con aire
ballot	boleta	f	Un proceso de votación, típicamente en secreto
bamboo	bambú	m	Una hierba leñosa gigante que crece principalmente en los trópicos
ban	prohibición	f	Una prohibición oficial o legal de algo
banana	plátano	m	Una fruta larga y curva con piel gruesa amarilla
band	banda	f	Una tira de material plana y delgada
bandage	vendaje	m	Una tira de material utilizada para vendar una herida
bang	estruendo	m	Un ruido fuerte y repentino
bank	banco	m	Un establecimiento financiero que utiliza el dinero depositado por los clientes
banker	banquero	m	Una persona que trabaja en banca a nivel superior
banking	banca	f	El negocio realizado o los servicios ofrecidos por un banco
bankruptcy	bancarrota	f	El estado de carecer completamente de dinero o recursos
banner	pancarta	f	Una larga tira de tela que lleva un eslogan o diseño
