en	translation	gender	meaning_translation
dollar	dólar	m	Unidad monetaria básica de los Estados Unidos y varios otros países
dolphin	delfín	m	Ballena pequeña dentada gregaria típicamente con un hocico en forma de pico
domain	dominio	m	Área de territorio poseída o controlada por un gobernante o gobierno
domestic	empleado	m	Persona que recibe pago para ayudar con las tareas domésticas
domination	dominación	f	Ejercicio de control o influencia sobre alguien o algo
dominion	dominio	m	Soberanía o control sobre un territorio
don	don	m	Título español antepuesto a un nombre masculino
donation	donación	f	Algo dado a una organización benéfica o causa
donkey	burro	m	Mamífero doméstico con cascos relacionado con el caballo con orejas largas
donut	dona	f	Pastel pequeño frito de masa endulzada, típicamente en forma de anillo
doom	perdición	f	Muerte, destrucción o destino terrible considerado como inevitable
door	puerta	f	Barrera con bisagras, deslizante o giratoria en la entrada de un edificio o habitación
doorway	entrada	f	Entrada a una habitación o edificio a través de una puerta
dope	droga	f	Droga tomada ilegalmente con fines recreativos
dork	tonto	m	Persona aburrida, de mente lenta o socialmente inepta
dormitory	dormitorio	m	Habitación grande para varias personas en una escuela o institución
dose	dosis	f	Cantidad de medicina o droga tomada o recomendada
dot	punto	m	Marca o mancha redonda pequeña
double	doble	m	Cosa que es dos veces más grande de lo usual o compuesta de dos partes
doubt	duda	f	Sentimiento de incertidumbre o falta de convicción
down	plumón	m	Plumas suaves, finas y esponjosas que forman la primera cobertura de un ave joven
downtown	centro	m	Distrito comercial central de una ciudad
dozen	docena	f	Grupo o conjunto de doce artículos o unidades
draft	borrador	m	Versión preliminar de una pieza de escritura
dragon	dragón	m	Monstruo mítico típicamente representado como un reptil grande con alas
drama	drama	m	Obra de teatro para teatro, radio o televisión
drawer	cajón	m	Compartimento de almacenamiento sin tapa hecho para deslizarse horizontalmente
drawing	dibujo	m	Imagen o diagrama hecho con lápiz, bolígrafo o crayón
dream	sueño	m	Serie de pensamientos, imágenes y sensaciones que ocurren durante el sueño
dress	vestido	m	Prenda de una pieza para mujer o niña que cubre el cuerpo
drill	taladro	m	Herramienta o máquina con una punta cortante giratoria para hacer agujeros
drink	bebida	f	Líquido que se puede tragar como refresco o alimento
drive	viaje	m	Viaje o trayecto en un vehículo
driver	conductor	m	Persona que conduce un vehículo
drop	gota	f	Masa redonda pequeña de líquido que cuelga o cae
drug	medicamento	m	Medicina o sustancia utilizada en el tratamiento de enfermedades
drugstore	farmacia	f	Farmacia o tienda donde se venden medicamentos
drum	tambor	m	Instrumento de percusión con una membrana estirada sobre un marco
duck	pato	m	Ave acuática con un pico ancho y romo, patas cortas y pies palmeados
duckling	patito	m	Pato joven
due	cuota	f	Algo que se debe o se merece
duke	duque	m	Hombre que posee el título hereditario más alto en el sistema británico
dump	basurero	m	Sitio para depositar basura
dumpling	bola	f	Pequeña bola salada de masa hervida en agua o caldo
duration	duración	f	Tiempo durante el cual algo continúa o existe
dust	polvo	m	Polvo fino y seco que consiste en partículas diminutas de tierra o materia de desecho
duty	deber	m	Obligación moral o legal
dynamics	dinámica	f	Rama de la mecánica relacionada con el movimiento y las fuerzas
dynasty	dinastía	f	Línea de gobernantes hereditarios de un país
each	unidad	f	Cada uno de dos o más personas o cosas consideradas individualmente
eagle	águila	f	Gran ave de presa con un pico masivo en forma de gancho y alas largas y anchas
ear	oído	m	Órgano de audición y equilibrio en humanos y otros vertebrados
early	comienzo	m	Período o etapa de desarrollo cerca del principio
earth	tierra	f	El planeta en el que vivimos
earthquake	terremoto	m	Sacudida repentina y violenta del suelo
east	este	m	Dirección hacia el punto del horizonte donde sale el sol en los equinoccios
echo	eco	m	Sonido o serie de sonidos causados por reflexión de ondas sonoras
economics	economía	f	Rama del conocimiento relacionada con la producción y consumo de bienes y servicios
economy	economía	f	Riqueza y recursos de un país o región en términos de producción y consumo
edge	borde	m	Límite exterior de un objeto, área o superficie
edition	edición	f	Forma o versión particular de un texto publicado
editor	editor	m	Persona que está a cargo de determinar el contenido final de una publicación
education	educación	f	Proceso de recibir o dar instrucción sistemática en una escuela o universidad
eel	anguila	f	Pez parecido a una serpiente con un cuerpo delgado y alargado
effect	efecto	m	Cambio que es resultado o consecuencia de una acción
effectiveness	eficacia	f	Grado en que algo tiene éxito en producir un resultado deseado
efficiency	eficiencia	f	Estado o cualidad de lograr máxima productividad con mínimo esfuerzo desperdiciado
effort	esfuerzo	m	Intento vigoroso o determinado de lograr algo
egg	huevo	m	Objeto ovalado o redondo puesto por un ave hembra que contiene un embrión
ego	ego	m	Sentido de autoestima o autoimportancia de una persona
eight	ocho	m	Número equivalente al producto de dos y cuatro
either	cualquiera	m	Una u otra de dos cosas o personas
elbow	codo	m	Articulación entre el antebrazo y la parte superior del brazo
election	elección	f	Proceso formal y organizado de elegir a una persona para un cargo político
electricity	electricidad	f	Forma de energía resultante de la existencia de partículas cargadas
electronics	electrónica	f	Rama de la física y tecnología relacionada con circuitos usando transistores
element	elemento	m	Parte fundamental o esencial de algo
elephant	elefante	m	Mamífero muy grande con trompa larga, orejas grandes y colmillos
elevator	ascensor	m	Plataforma alojada en un eje para elevar y bajar personas o cosas
elimination	eliminación	f	Remoción o destrucción completa de algo
email	correo	m	Mensajes distribuidos por medios electrónicos de un usuario de computadora a otro
emergency	emergencia	f	Situación seria, inesperada y a menudo peligrosa que requiere acción inmediata
emission	emisión	f	Producción y descarga de algo, especialmente gas o radiación
emotion	emoción	f	Estado mental natural e instintivo derivado de las circunstancias de uno
emperor	emperador	m	Gobernante soberano de gran poder y rango que gobierna un imperio
emphasis	énfasis	m	Importancia, valor o prominencia especial dada a algo
empire	imperio	m	Grupo extenso de estados o países bajo una sola autoridad suprema
employee	empleado	m	Persona empleada por salario, especialmente a nivel no ejecutivo
employer	empleador	m	Persona u organización que emplea personas
employment	empleo	m	Condición de tener trabajo remunerado
end	fin	m	Parte final de algo, especialmente un período de tiempo o una actividad
ending	final	m	Fin o parte final de algo
endowment	dotación	f	Acción de dotar algo o alguien
endurance	resistencia	f	Hecho o poder de soportar un proceso o situación difícil sin ceder
enemy	enemigo	m	Persona que se opone activamente o es hostil hacia alguien o algo
energy	energía	f	Fuerza y vitalidad requerida para actividad física o mental sostenida
enforcement	aplicación	f	Acto de obligar la observancia o cumplimiento de una ley o regla
engagement	compromiso	m	Acuerdo formal para casarse
engineer	ingeniero	m	Persona que diseña, construye o mantiene motores, máquinas u obras públicas
England	Inglaterra	f	País que es parte del Reino Unido
English	inglés	m	Idioma de Inglaterra ahora ampliamente usado en muchas variedades
enjoyment	disfrute	m	Estado o proceso de tomar placer en algo
enlargement	ampliación	f	Acción o estado de agrandar o ser agrandado
enlightenment	ilustración	f	Acción de iluminar
enrollment	inscripción	f	Acción de inscribirse o ser inscrito
ensemble	conjunto	m	Grupo de músicos, actores o bailarines que actúan juntos
entail	implicación	f	Algo que se requiere como acompañamiento o resultado necesario de algo más
enterprise	empresa	f	Proyecto o emprendimiento, típicamente uno que es difícil o requiere esfuerzo
entertainment	entretenimiento	m	Acción de proporcionar o ser proporcionado con diversión o disfrute
enthusiasm	entusiasmo	m	Disfrute, interés o aprobación intensa y ansiosa
entity	entidad	f	Cosa con existencia distinta e independiente
entrance	entrada	f	Abertura como puerta, pasaje o portón que permite acceso a un lugar
entry	entrada	f	Acto de entrar o venir
environment	ambiente	m	Entorno o condiciones en que vive u opera una persona, animal o planta
envy	envidia	f	Sentimiento de anhelo descontento o resentido despertado por las posesiones de otro
enzyme	enzima	f	Sustancia producida por un organismo vivo que actúa como catalizador
epidemic	epidemia	f	Ocurrencia generalizada de una enfermedad infecciosa en una comunidad
episode	episodio	m	Evento o grupo de eventos que ocurren como parte de una secuencia mayor
epoch	época	f	Período de tiempo en la historia marcado por eventos notables
equality	igualdad	f	Estado de ser igual, especialmente en estatus, derechos y oportunidades
equation	ecuación	f	Declaración de que los valores de dos expresiones matemáticas son iguales
equator	ecuador	m	Línea imaginaria trazada alrededor de la tierra equidistante de ambos polos
equipment	equipo	m	Artículos necesarios para un propósito particular
equity	equidad	f	Cualidad de ser justo e imparcial
eraser	borrador	m	Objeto usado para eliminar marcas de lápiz
erection	erección	f	Acción de erigir una estructura u objeto
error	error	m	Equivocación
eruption	erupción	f	Acto o instancia de entrar en erupción
escape	escape	m	Acto de liberarse de confinamiento o control
escort	escolta	f	Persona, vehículo o grupo que acompaña a otro para protección
essence	esencia	f	Naturaleza intrínseca o cualidad indispensable de algo
establishment	establecimiento	m	Acción de establecer algo o ser establecido
estate	finca	f	Área extensa de tierra en el campo con una casa grande
esteem	estima	f	Respeto y admiración, típicamente por una persona
estimate	estimación	f	Cálculo o juicio aproximado del valor, número, cantidad o extensión de algo
estimation	estimación	f	Proceso de formar un juicio aproximado del valor o calidad de algo
eternal	eterno	m	Algo que dura o existe para siempre
eternity	eternidad	f	Tiempo infinito o interminable
ethic	ética	f	Conjunto de principios morales
etiquette	etiqueta	f	Código consuetudinario de comportamiento cortés en la sociedad
euphemism	eufemismo	m	Palabra o expresión suave o indirecta sustituida por una considerada demasiado dura
euro	euro	m	Moneda europea única
Europe	Europa	f	Continente en el Hemisferio Norte
evacuation	evacuación	f	Acción de evacuar a una persona o un lugar
eve	víspera	f	Día o período de tiempo inmediatamente anterior a un evento u ocasión
evening	tarde	f	Período de tiempo al final del día
event	evento	m	Cosa que sucede, especialmente de importancia
evergreen	perenne	f	Planta que retiene hojas verdes durante todo el año
everlasting	eterno	m	Algo que dura para siempre o por mucho tiempo
evidence	evidencia	f	Conjunto de hechos o información disponible que indica si una creencia es verdadera
evil	maldad	f	Inmoralidad y maldad profunda
evolution	evolución	f	Proceso por el cual diferentes tipos de organismos vivos se han desarrollado
ex	ex	m	Antiguo esposo, esposa u otra pareja en una relación
exaggeration	exageración	f	Declaración que representa algo como mejor o peor de lo que realmente es
exam	examen	m	Prueba formal del conocimiento o competencia de una persona
examination	examen	m	Inspección o investigación detallada
example	ejemplo	m	Cosa característica de su tipo o que ilustra una regla general
exception	excepción	f	Persona o cosa que es excluida de una declaración general
excess	exceso	m	Cantidad de algo que es más de lo necesario, permitido o deseable
exchange	intercambio	m	Acto de dar una cosa y recibir otra a cambio
excitement	emoción	f	Sentimiento de gran entusiasmo y ansia
exclamation	exclamación	f	Grito o comentario repentino
excursion	excursión	f	Viaje o viaje corto
excuse	excusa	f	Razón o explicación presentada para defender o justificar una falta
execution	ejecución	f	Realización o puesta en efecto de un plan, orden o curso de acción
executive	ejecutivo	m	Persona con responsabilidad gerencial senior en una organización empresarial
exemption	exención	f	Proceso de liberar o estado de estar libre de una obligación
exercise	ejercicio	m	Actividad que requiere esfuerzo físico realizada para mantener o mejorar la salud
exertion	esfuerzo	m	Esfuerzo físico o mental
exhaust	escape	m	Gases de desecho o aire expulsado de un motor o máquina
exhibition	exposición	f	Exhibición pública de obras de arte o artículos de interés
exile	exilio	m	Estado de estar excluido del país nativo de uno
existence	existencia	f	Hecho o estado de vivir o tener realidad objetiva
exodus	éxodo	m	Salida masiva de personas
expanse	extensión	f	Área amplia y continua de algo
expansion	expansión	f	Acción de volverse más grande o más extenso
expectation	expectativa	f	Creencia fuerte de que algo sucederá o será el caso en el futuro
expedition	expedición	f	Viaje emprendido por un grupo de personas con un propósito particular
expenditure	gasto	m	Acción de gastar fondos
expense	gasto	m	Costo requerido para algo
experience	experiencia	f	Contacto práctico con y observación de hechos o eventos
experiment	experimento	m	Procedimiento científico realizado para hacer un descubrimiento
expert	experto	m	Persona que tiene conocimiento integral y autorizado de un área particular
explanation	explicación	f	Declaración o relato que hace algo claro
explosion	explosión	f	Estallido o fragmentación violenta y destructiva de algo
export	exportación	f	Venta y envío de bienes o servicios a otro país
exposition	exposición	f	Descripción y explicación integral de una idea o teoría
exposure	exposición	f	Estado de estar expuesto al contacto con algo
express	expreso	m	Tren u otro vehículo que viaja a alta velocidad con pocas paradas intermedias
expression	expresión	f	Proceso de dar a conocer los pensamientos o sentimientos de uno
extension	extensión	f	Parte que se agrega a algo para ampliarlo o prolongarlo
extent	extensión	f	Área cubierta por algo
exterior	exterior	m	Superficie o estructura exterior de algo
extinction	extinción	f	Estado o proceso de que una especie se extinga
extract	extracto	m	Preparación que contiene el ingrediente activo de una sustancia en forma concentrada
extraction	extracción	f	Acción de sacar algo, especialmente usando esfuerzo o fuerza
extravagance	extravagancia	f	Falta de moderación en el gasto de dinero o uso de recursos
extreme	extremo	m	Grado más alto o más intenso de algo
extremist	extremista	m	Persona que tiene opiniones políticas o religiosas extremas o fanáticas
eye	ojo	m	Órgano de la vista en humanos y animales vertebrados
fable	fábula	f	Historia corta con animales como personajes que transmite una moraleja
fabric	tela	f	Paño u otro material producido tejiendo o tejiendo fibras
face	cara	f	Parte frontal de la cabeza de una persona desde la frente hasta el mentón
facility	instalación	f	Lugar, servicio o equipo proporcionado para un propósito particular
facing	revestimiento	m	Capa exterior que cubre la superficie de una pared
facsimile	facsímil	m	Copia exacta, especialmente de material escrito o impreso
fact	hecho	m	Cosa que se sabe o se demuestra que es verdad
faction	facción	f	Pequeño grupo disidente organizado dentro de uno más grande
factor	factor	m	Circunstancia, hecho o influencia que contribuye a un resultado
factory	fábrica	f	Edificio donde se fabrican o ensamblan bienes principalmente por máquina
failure	fracaso	m	Falta de éxito
fair	feria	f	Reunión de puestos y atracciones para entretenimiento público
fairness	justicia	f	Tratamiento o comportamiento imparcial y justo sin favoritismo
fairy	hada	f	Ser imaginario pequeño de forma humana que tiene poderes mágicos
faith	fe	f	Confianza o seguridad completa en alguien o algo
fake	falsificación	f	Cosa que no es genuina
falcon	halcón	m	Ave de presa diurna con alas largas y puntiagudas y pico dentado
fall	otoño	m	Estación después del verano y antes del invierno
falsehood	falsedad	f	Estado de no ser verdadero
fame	fama	f	Estado de ser conocido o mencionado por muchas personas
familiarity	familiaridad	f	Conocimiento cercano o familiaridad con algo
family	familia	f	Grupo que consiste en padres e hijos que viven juntos en un hogar
famine	hambruna	f	Escasez extrema de alimentos
fan	ventilador	m	Aparato con aspas giratorias que crea corriente de aire para enfriamiento
fancy	fantasía	f	Facultad de la imaginación
fantasy	fantasía	f	Facultad o actividad de imaginar cosas imposibles o improbables
fare	tarifa	f	Dinero que un pasajero en transporte público tiene que pagar
farewell	despedida	f	Acto de separarse o marcar la partida de alguien
farm	granja	f	Área de tierra y sus edificios usados para cultivar y criar animales
farmer	agricultor	m	Persona que posee o administra una granja
farmhand	peón	m	Persona que trabaja en una granja
farmhouse	casa	f	Casa adjunta a una granja
farming	agricultura	f	Actividad o negocio de cultivar y criar ganado
farmland	tierra	f	Tierra usada para agricultura
fascination	fascinación	f	Poder de fascinar a alguien
fascism	fascismo	m	Sistema autoritario y nacionalista de gobierno y organización social
fashion	moda	f	Tendencia popular, especialmente en estilos de vestir
fat	grasa	f	Sustancia aceitosa o grasosa natural que ocurre en cuerpos animales
fatality	fatalidad	f	Ocurrencia de muerte por accidente, guerra o enfermedad
fate	destino	m	Desarrollo de eventos más allá del control de una persona
father	padre	m	Hombre en relación con su hijo o hijos
fatigue	fatiga	f	Cansancio extremo resultante de esfuerzo mental o físico
fault	falla	f	Característica poco atractiva o insatisfactoria
favor	favor	m	Acto de bondad más allá de lo debido o usual
favorite	favorito	m	Persona o cosa que es especialmente popular o particularmente bien apreciada
fear	miedo	m	Emoción desagradable causada por la creencia de que alguien o algo es peligroso
feast	festín	m	Comida grande, típicamente en celebración de algo
feather	pluma	f	Cualquiera de los apéndices planos que crecen de la piel de un ave
feature	característica	f	Atributo o aspecto distintivo de algo
February	febrero	m	Segundo mes del año
federation	federación	f	Grupo de estados con un gobierno central pero independencia en asuntos internos
fee	tarifa	f	Pago hecho a una persona profesional o a un organismo profesional o público
feed	pienso	m	Alimento para ganado doméstico
feedback	retroalimentación	f	Información sobre reacciones a un producto o desempeño de una persona
feel	sensación	f	Sensación dada por un objeto o material cuando se toca
feeling	sentimiento	m	Estado emocional o reacción
fellow	compañero	m	Hombre o muchacho
fellowship	compañerismo	m	Asociación amistosa, especialmente con personas que comparten intereses
felony	delito	m	Crimen grave, típicamente uno que involucra violencia
fence	cerca	f	Barrera, barandilla u otra estructura vertical que encierra un área de terreno
ferment	fermento	m	Agitación y excitación entre un grupo de personas
fern	helecho	m	Planta sin flores que tiene frondas plumosas o frondosas
fertilizer	fertilizante	m	Sustancia química o natural añadida al suelo para aumentar su fertilidad
festival	festival	m	Día o período de celebración
festivity	festividad	f	Celebración de algo de manera alegre y exuberante
fever	fiebre	f	Temperatura corporal anormalmente alta
fiber	fibra	f	Hilo o filamento del cual se forma un tejido vegetal o textil
fiction	ficción	f	Literatura en forma de prosa que describe eventos e individuos imaginarios
fidelity	fidelidad	f	Fidelidad a una persona, causa o creencia
field	campo	m	Área de tierra abierta, especialmente plantada con cultivos o pasto
fifteen	quince	m	Número equivalente al producto de tres y cinco
fifteenth	decimoquinto	m	Que constituye el número quince en una secuencia
fifth	quinto	m	Que constituye el número cinco en una secuencia
fiftieth	quincuagésimo	m	Que constituye el número cincuenta en una secuencia
fifty	cincuenta	m	Número equivalente al producto de cinco y diez
fig	higo	m	Fruta en forma de pera con carne oscura dulce y muchas semillas pequeñas
fight	pelea	f	Confrontación o lucha violenta
fighter	luchador	m	Persona o animal que lucha
figure	figura	f	Número, especialmente uno que forma parte de estadísticas oficiales
fill	relleno	m	Cantidad de algo que es tanto como uno quiere
film	película	f	Tira delgada y flexible de plástico u otro material recubierto con emulsión
finance	finanza	f	Gestión de grandes cantidades de dinero
fine	multa	f	Suma de dinero exigida como penalización por un tribunal de justicia
finger	dedo	m	Cada una de las cuatro partes delgadas y articuladas unidas a cada mano
finish	final	m	Fin o parte o etapa final de algo
fir	abeto	m	Árbol conífero de hoja perenne con conos erectos y hojas en forma de aguja
fire	fuego	m	Combustión o quema en la que las sustancias se combinan químicamente con oxígeno
firework	pirotecnia	f	Dispositivo que contiene pólvora y otros químicos combustibles
firm	firma	f	Empresa comercial, especialmente una que involucra una asociación
first	primero	m	Que viene antes que todos los demás en tiempo u orden
fish	pez	m	Animal vertebrado de sangre fría sin extremidades con branquias y aletas
fishery	pesquería	f	Lugar donde se crían peces con fines comerciales
fishing	pesca	f	Actividad de pescar, ya sea para alimento o como deporte
fist	puño	m	Mano de una persona cuando los dedos están doblados hacia la palma
fit	ajuste	m	La forma particular en que algo encaja
fitness	condición física	f	El estado de estar físicamente en forma y saludable
five	cinco	m	El número equivalente a la suma de dos y tres
fix	solución	f	Una solución a un problema
flag	bandera	f	Una pieza de tela usada como símbolo de un país
flair	talento	m	Una aptitud especial o instintiva para hacer algo bien
flame	llama	f	Un cuerpo caliente e incandescente de gas generado por algo en fuego
flap	solapa	f	Una pieza de algo delgado, con bisagra o unida solo por un lado
flare	bengala	f	Una explosión súbita y breve de llama o luz brillante
flash	destello	m	Una explosión súbita y breve de luz brillante
flat	apartamento	m	Un conjunto de habitaciones que forman una residencia individual
flavor	sabor	m	La calidad distintiva de un alimento o bebida
flavoring	aromatizante	m	Una sustancia usada para dar un sabor diferente o más agradable
flea	pulga	f	Un pequeño insecto saltador sin alas que se alimenta de sangre
flesh	carne	f	La sustancia blanda que consiste en músculo y grasa
flextime	horario flexible	m	Un sistema de trabajo con horario flexible
flick	movimiento	m	Un movimiento repentino y brusco
flicker	parpadeo	m	Un movimiento inestable de una llama o luz
flight	vuelo	m	La acción o proceso de volar por el aire
fling	aventura	f	Un período corto de disfrute o comportamiento salvaje
flint	pedernal	m	Una roca gris dura que consiste en sílice casi puro
flock	bandada	f	Un número de aves de un tipo alimentándose o viajando juntas
flood	inundación	f	Un desbordamiento de una gran cantidad de agua
floor	piso	m	La superficie inferior de una habitación sobre la cual se puede caminar
flop	fracaso	m	Un fracaso total
flour	harina	f	Un polvo obtenido moliendo granos
flow	flujo	m	La acción o hecho de moverse en una corriente continua
flower	flor	f	La parte de una planta que contiene semillas
fluid	fluido	m	Una sustancia que no tiene forma fija
flurry	ráfaga	f	Una pequeña masa arremolinada de algo
flush	rubor	m	Un enrojecimiento de la cara o piel
flute	flauta	f	Un instrumento de viento hecho de un tubo con agujeros
flutter	aleteo	m	Un movimiento rápido, ligero e irregular
flux	flujo	m	La acción o proceso de fluir
fly	mosca	f	Un insecto volador caracterizado por un par de alas transparentes
focus	enfoque	m	El centro de interés o actividad
fodder	forraje	m	Alimento para ganado y otros animales de granja
fog	niebla	f	Una nube espesa de gotas de agua suspendidas en la atmósfera
foil	papel de aluminio	m	Metal martillado en lámina delgada y flexible
fold	pliegue	m	Una forma producida por el drapeado suave de una prenda
folk	gente	f	Personas
folly	locura	f	Falta de buen juicio
food	alimento	m	Cualquier sustancia nutritiva que las personas o animales comen
fool	tonto	m	Una persona que actúa imprudentemente
foot	pie	m	La extremidad inferior de la pierna debajo del tobillo
football	fútbol americano	m	Una forma de juego de equipo jugado en América del Norte
force	fuerza	f	Fuerza o energía como atributo de acción física
fore	proa	f	Situado o colocado en frente
forefront	vanguardia	f	La posición o lugar más importante
foreground	primer plano	m	La parte de una vista más cercana al observador
forehead	frente	f	La parte de la cara sobre las cejas
foreigner	extranjero	m	Una persona nacida en o proveniente de otro país
foresight	previsión	f	La capacidad de predecir lo que sucederá en el futuro
forest	bosque	m	Un área grande cubierta principalmente con árboles
fork	tenedor	m	Un utensilio con dos o más puntas usado para levantar comida
form	formulario	m	La forma visible o configuración de algo
formality	formalidad	f	La observancia rígida de reglas de convención
formation	formación	f	La acción de formar o proceso de ser formado
formula	fórmula	f	Una relación matemática o regla expresada en símbolos
formulation	formulación	f	La acción de crear o preparar algo
fort	fuerte	m	Un edificio fortificado o posición estratégica
forth	avance	m	Movimiento hacia adelante
