en	translation	gender	meaning_translation
majority	斜芯谢褜褕懈薪褋褌胁芯	n	斜芯谢褜褕邪褟 褔邪褋褌褜 谐褉褍锌锌褘
mall	褌芯褉谐芯胁褘泄 褑械薪褌褉	m	泻褉褍锌薪芯械 蟹写邪薪懈械 褋 屑邪谐邪蟹懈薪邪屑懈
man	屑褍卸褔懈薪邪	m	胁蟹褉芯褋谢褘泄 褔械谢芯胁械泻 屑褍卸褋泻芯谐芯 锌芯谢邪
management	褍锌褉邪胁谢械薪懈械	n	锌褉芯褑械褋褋 褉褍泻芯胁芯写褋褌胁邪 芯褉谐邪薪懈蟹邪褑懈械泄
manager	屑械薪械写卸械褉	m	褉褍泻芯胁芯写懈褌械谢褜 懈谢懈 褍锌褉邪胁谢褟褞褖懈泄
manner	屑邪薪械褉邪	f	褋锌芯褋芯斜 锌芯胁械写械薪懈褟 懈谢懈 写械泄褋褌胁懈褟
map	泻邪褉褌邪	f	褋褏械屑邪褌懈褔械褋泻芯械 懈蟹芯斜褉邪卸械薪懈械 屑械褋褌薪芯褋褌懈
March	屑邪褉褌	m	褌褉械褌懈泄 屑械褋褟褑 谐芯写邪
mark	芯褌屑械褌泻邪	f	胁懈写懈屑褘泄 褋谢械写 懈谢懈 蟹薪邪泻
market	褉褘薪芯泻	m	屑械褋褌芯 褌芯褉谐芯胁谢懈
marriage	斜褉邪泻	m	芯褎懈褑懈邪谢褜薪褘泄 褋芯褞蟹 褋褍锌褉褍谐芯胁
match	屑邪褌褔	m	褋锌芯褉褌懈胁薪芯械 褋芯褋褌褟蟹邪薪懈械
material	屑邪褌械褉懈邪谢	m	胁械褖械褋褌胁芯 懈谢懈 褌泻邪薪褜
matter	胁械褖械褋褌胁芯	n	褎懈蟹懈褔械褋泻邪褟 褋褍斜褋褌邪薪褑懈褟 懈谢懈 胁芯锌褉芯褋
May	屑邪泄	m	锌褟褌褘泄 屑械褋褟褑 谐芯写邪
mayor	屑褝褉	m	谐谢邪胁邪 谐芯褉芯写褋泻芯泄 邪写屑懈薪懈褋褌褉邪褑懈懈
maze	谢邪斜懈褉懈薪褌	m	褋谢芯卸薪邪褟 褋懈褋褌械屑邪 锌械褉械褏芯写芯胁
meadow	谢褍谐	m	褍褔邪褋褌芯泻 蟹械屑谢懈 褋 褌褉邪胁芯泄
meal	锌褉懈褢屑 锌懈褖懈	m	械写邪 胁 芯锌褉械写械谢褢薪薪芯械 胁褉械屑褟
meaning	蟹薪邪褔械薪懈械	n	褋屑褘褋谢 褋谢芯胁邪 懈谢懈 写械泄褋褌胁懈褟
means	褋褉械写褋褌胁芯	n	褋锌芯褋芯斜 写芯褋褌懈卸械薪懈褟 褑械谢懈
meantime	褌械屑 胁褉械屑械薪械屑	n	锌褉芯屑械卸褍褌芯褔薪褘泄 锌械褉懈芯写 胁褉械屑械薪懈
measure	屑械褉邪	f	械写懈薪懈褑邪 懈蟹屑械褉械薪懈褟 懈谢懈 写械泄褋褌胁懈械
measurement	懈蟹屑械褉械薪懈械	n	锌褉芯褑械褋褋 芯锌褉械写械谢械薪懈褟 褉邪蟹屑械褉邪
meat	屑褟褋芯	n	锌谢芯褌褜 卸懈胁芯褌薪芯谐芯, 褍锌芯褌褉械斜谢褟械屑邪褟 胁 锌懈褖褍
mechanics	屑械褏邪薪懈泻邪	f	褉邪蟹写械谢 褎懈蟹懈泻懈 芯 写胁懈卸械薪懈懈 褌械谢
medal	屑械写邪谢褜	f	薪邪谐褉邪写邪 蟹邪 蟹邪褋谢褍谐懈
media	小袦袠	n	褋褉械写褋褌胁邪 屑邪褋褋芯胁芯泄 懈薪褎芯褉屑邪褑懈懈
mediation	锌芯褋褉械写薪懈褔械褋褌胁芯	n	褋芯写械泄褋褌胁懈械 胁 褍褉械谐褍谢懈褉芯胁邪薪懈懈 褋锌芯褉邪
medic	屑械写懈泻	m	屑械写懈褑懈薪褋泻懈泄 褉邪斜芯褌薪懈泻
medication	谢械泻邪褉褋褌胁芯	n	屑械写懈褑懈薪褋泻懈泄 锌褉械锌邪褉邪褌
medicine	屑械写懈褑懈薪邪	f	薪邪褍泻邪 芯 谢械褔械薪懈懈 斜芯谢械蟹薪械泄
meditation	屑械写懈褌邪褑懈褟	f	锌褉邪泻褌懈泻邪 褍屑褋褌胁械薪薪芯谐芯 褋芯褋褉械写芯褌芯褔械薪懈褟
meeting	胁褋褌褉械褔邪	f	褋芯斜褉邪薪懈械 谢褞写械泄 写谢褟 芯斜褋褍卸写械薪懈褟
melody	屑械谢芯写懈褟	f	锌芯褋谢械写芯胁邪褌械谢褜薪芯褋褌褜 屑褍蟹褘泻邪谢褜薪褘褏 蟹胁褍泻芯胁
melon	写褘薪褟	f	泻褉褍锌薪褘泄 褋谢邪写泻懈泄 锌谢芯写
member	褔谢械薪	m	褔械谢芯胁械泻, 锌褉懈薪邪写谢械卸邪褖懈泄 泻 谐褉褍锌锌械
membership	褔谢械薪褋褌胁芯	n	褋褌邪褌褍褋 褔谢械薪邪 芯褉谐邪薪懈蟹邪褑懈懈
membrane	屑械屑斜褉邪薪邪	f	褌芯薪泻邪褟 褝谢邪褋褌懈褔薪邪褟 锌械褉械谐芯褉芯写泻邪
memorandum	屑械屑芯褉邪薪写褍屑	m	芯褎懈褑懈邪谢褜薪邪褟 蟹邪锌懈褋泻邪 懈谢懈 褋芯谐谢邪褕械薪懈械
memorial	屑械屑芯褉懈邪谢	m	锌邪屑褟褌薪懈泻 胁 褔械褋褌褜 褋芯斜褘褌懈褟 懈谢懈 褔械谢芯胁械泻邪
memory	锌邪屑褟褌褜	f	褋锌芯褋芯斜薪芯褋褌褜 蟹邪锌芯屑懈薪邪褌褜 懈薪褎芯褉屑邪褑懈褞
menace	褍谐褉芯蟹邪	f	懈褋褌芯褔薪懈泻 芯锌邪褋薪芯褋褌懈
mentality	屑械薪褌邪谢懈褌械褌	m	褏邪褉邪泻褌械褉薪褘泄 芯斜褉邪蟹 屑褘褕谢械薪懈褟
mention	褍锌芯屑懈薪邪薪懈械	n	泻褉邪褌泻邪褟 褋褋褘谢泻邪 薪邪 褔褌芯-谢懈斜芯
mentor	薪邪褋褌邪胁薪懈泻	m	芯锌褘褌薪褘泄 褋芯胁械褌薪懈泻
menu	屑械薪褞	n	褋锌懈褋芯泻 斜谢褞写 胁 褉械褋褌芯褉邪薪械
merchandise	褌芯胁邪褉	m	锌褉芯写褍泻褑懈褟 写谢褟 锌褉芯写邪卸懈
merchant	泻褍锌械褑	m	褔械谢芯胁械泻, 蟹邪薪懈屑邪褞褖懈泄褋褟 芯锌褌芯胁芯泄 褌芯褉谐芯胁谢械泄
mercury	褉褌褍褌褜	f	褌褟卸褢谢褘泄 卸懈写泻懈泄 屑械褌邪谢谢 褋械褉械斜褉懈褋褌芯谐芯 褑胁械褌邪
mercy	屑懈谢芯褋褌褜	f	褋芯褋褌褉邪写邪薪懈械 泻 褌芯屑褍, 泻褌芯 胁 褌胁芯械泄 胁谢邪褋褌懈
merger	褋谢懈褟薪懈械	n	芯斜褗械写懈薪械薪懈械 写胁褍褏 胁械褖械泄, 芯褋芯斜械薪薪芯 泻芯屑锌邪薪懈泄
merit	蟹邪褋谢褍谐邪	f	泻邪褔械褋褌胁芯 斜褘褌褜 写芯褋褌芯泄薪褘屑 锌芯褏胁邪谢褘
merlion	屑械褉谢邪泄芯薪	m	屑懈褎懈褔械褋泻芯械 褋褍褖械褋褌胁芯 褋 谐芯谢芯胁芯泄 谢褜胁邪 懈 褌械谢芯屑 褉褘斜褘
mesh	褋械褌泻邪	f	屑邪褌械褉懈邪谢 懈蟹 锌械褉械锌谢械褌褢薪薪褘褏 薪懈褌械泄 懈谢懈 锌褉芯胁芯谢芯泻懈
mess	斜械褋锌芯褉褟写芯泻	m	谐褉褟蟹薪芯械 懈谢懈 薪械芯锌褉褟褌薪芯械 褋芯褋褌芯褟薪懈械
messenger	锌芯褋谢邪薪薪懈泻	m	褔械谢芯胁械泻, 写芯褋褌邪胁谢褟褞褖懈泄 褋芯芯斜褖械薪懈褟
metal	屑械褌邪谢谢	m	褌胁褢褉写褘泄 斜谢械褋褌褟褖懈泄 屑邪褌械褉懈邪谢-锌褉芯胁芯写薪懈泻
meteor	屑械褌械芯褉	m	薪械斜械褋薪芯械 褌械谢芯, 胁褏芯写褟褖械械 胁 邪褌屑芯褋褎械褉褍
meter	褋褔褢褌褔懈泻	m	锌褉懈斜芯褉 写谢褟 懈蟹屑械褉械薪懈褟 懈 褉械谐懈褋褌褉邪褑懈懈
method	屑械褌芯写	m	褋锌芯褋芯斜 胁褘锌芯谢薪械薪懈褟 褔械谐芯-谢懈斜芯
metropolis	屑械谐邪锌芯谢懈褋	m	芯褔械薪褜 泻褉褍锌薪褘泄 懈 芯卸懈胁谢褢薪薪褘泄 谐芯褉芯写
Mexico	袦械泻褋懈泻邪	f	褋褌褉邪薪邪 胁 褞卸薪芯泄 褔邪褋褌懈 小械胁械褉薪芯泄 袗屑械褉懈泻懈
middle	褋械褉械写懈薪邪	f	褌芯褔泻邪 薪邪 褉邪胁薪芯屑 褉邪褋褋褌芯褟薪懈懈 芯褌 泻褉邪褢胁
milk	屑芯谢芯泻芯	n	斜械谢邪褟 锌懈褌邪褌械谢褜薪邪褟 卸懈写泻芯褋褌褜 屑谢械泻芯锌懈褌邪褞褖懈褏
mind	褉邪蟹褍屑	m	褝谢械屑械薪褌 褔械谢芯胁械泻邪, 锌芯蟹胁芯谢褟褞褖懈泄 屑褘褋谢懈褌褜
minor	薪械褋芯胁械褉褕械薪薪芯谢械褌薪懈泄	m	褔械谢芯胁械泻, 薪械 写芯褋褌懈谐褕懈泄 锌芯谢薪芯泄 锌褉邪胁芯褋锌芯褋芯斜薪芯褋褌懈
minute	屑懈薪褍褌邪	f	锌械褉懈芯写 胁褉械屑械薪懈 胁 褕械褋褌褜写械褋褟褌 褋械泻褍薪写
mirror	蟹械褉泻邪谢芯	n	芯褌褉邪卸邪褞褖邪褟 锌芯胁械褉褏薪芯褋褌褜
miss	锌褉芯屑邪褏	m	薪械褍写邪褔邪 胁 锌芯锌邪写邪薪懈懈 懈谢懈 写芯褋褌懈卸械薪懈懈 褔械谐芯-谢懈斜芯
mistake	芯褕懈斜泻邪	f	薪械胁械褉薪芯械 写械泄褋褌胁懈械 懈谢懈 褋褍卸写械薪懈械
mix	褋屑械褋褜	f	泻芯屑斜懈薪邪褑懈褟 褉邪蟹薪褘褏 胁械褖械泄
mixture	褋屑械褋褜	f	胁械褖械褋褌胁芯 懈蟹 褋屑械褕邪薪薪褘褏 泻芯屑锌芯薪械薪褌芯胁
moai	屑芯邪懈	m	斜芯谢褜褕懈械 泻邪屑械薪薪褘械 褋褌邪褌褍懈 薪邪 芯褋褌褉芯胁械 袩邪褋褏懈
moan	褋褌芯薪	m	写芯谢谐懈泄 蟹胁褍泻, 胁褘褉邪卸邪褞褖懈泄 褋褌褉邪写邪薪懈械
mob	褌芯谢锌邪	f	斜芯谢褜褕邪褟 褌芯谢锌邪 谢褞写械泄, 褔邪褋褌芯 邪谐褉械褋褋懈胁薪邪褟
mobile	屑芯斜懈谢褜	m	锌芯写胁械褋薪邪褟 泻芯薪褋褌褉褍泻褑懈褟; 屑芯斜懈谢褜薪褘泄 褌械谢械褎芯薪
mockery	薪邪褋屑械褕泻邪	f	褟蟹胁懈褌械谢褜薪芯械 懈蟹写械胁邪褌械谢褜褋褌胁芯
model	屑芯写械谢褜	f	芯斜褉邪蟹械褑 懈谢懈 锌褉械写褋褌邪胁谢械薪懈械 褔械谐芯-谢懈斜芯
moderation	褍屑械褉械薪薪芯褋褌褜	f	懈蟹斜械谐邪薪懈械 泻褉邪泄薪芯褋褌械泄
modernism	屑芯写械褉薪懈蟹屑	m	写胁懈卸械薪懈械 蟹邪 芯斜薪芯胁谢械薪懈械 褌褉邪写懈褑懈泄
modesty	褋泻褉芯屑薪芯褋褌褜	f	泻邪褔械褋褌胁芯 斜褘褌褜 薪械褌褉械斜芯胁邪褌械谢褜薪褘屑
molecule	屑芯谢械泻褍谢邪	f	谐褉褍锌锌邪 褋胁褟蟹邪薪薪褘褏 邪褌芯屑芯胁
mom	屑邪屑邪	f	薪械褎芯褉屑邪谢褜薪芯械 芯斜褉邪褖械薪懈械 泻 屑邪褌械褉懈
moment	屑芯屑械薪褌	m	芯褔械薪褜 泻芯褉芯褌泻懈泄 锌械褉懈芯写 胁褉械屑械薪懈
momentum	懈屑锌褍谢褜褋	m	泻芯谢懈褔械褋褌胁芯 写胁懈卸械薪懈褟 褌械谢邪
monarchy	屑芯薪邪褉褏懈褟	f	褎芯褉屑邪 锌褉邪胁谢械薪懈褟 褋 屑芯薪邪褉褏芯屑
Monday	锌芯薪械写械谢褜薪懈泻	m	写械薪褜 薪械写械谢懈 锌芯褋谢械 胁芯褋泻褉械褋械薪褜褟
money	写械薪褜谐懈	n	褋褉械写褋褌胁芯 芯斜屑械薪邪 胁 胁懈写械 屑芯薪械褌 懈 泻褍锌褞褉
monk	屑芯薪邪褏	m	褔谢械薪 褉械谢懈谐懈芯蟹薪芯泄 芯斜褖懈薪褘 屑褍卸褔懈薪
monkey	芯斜械蟹褜褟薪邪	f	锌褉懈屑邪褌薪芯械 卸懈胁芯褌薪芯械 褋 写谢懈薪薪褘屑 褏胁芯褋褌芯屑
monologue	屑芯薪芯谢芯谐	m	写谢懈薪薪邪褟 褉械褔褜 芯写薪芯谐芯 邪泻褌褢褉邪
monopoly	屑芯薪芯锌芯谢懈褟	f	懈褋泻谢褞褔懈褌械谢褜薪褘泄 泻芯薪褌褉芯谢褜 薪邪写 褌芯胁邪褉芯屑
monotone	屑芯薪芯褌芯薪薪芯褋褌褜	f	薪械懈蟹屑械薪薪褘泄 蟹胁褍泻 芯写薪芯泄 胁褘褋芯褌褘
monster	褔褍写芯胁懈褖械	n	斜芯谢褜褕芯械 锌褍谐邪褞褖械械 褋褍褖械褋褌胁芯
montana	袦芯薪褌邪薪邪	f	褕褌邪褌 薪邪 褋械胁械褉芯-蟹邪锌邪写械 小楔袗
montmartre	袦芯薪屑邪褉褌褉	m	褏芯谢屑 胁 褋械胁械褉薪芯泄 褔邪褋褌懈 袩邪褉懈卸邪
monument	锌邪屑褟褌薪懈泻	m	褋芯芯褉褍卸械薪懈械 胁 锌邪屑褟褌褜 芯 褋芯斜褘褌懈懈
mood	薪邪褋褌褉芯械薪懈械	n	胁褉械屑械薪薪芯械 褋芯褋褌芯褟薪懈械 褍屑邪
moon	谢褍薪邪	f	械褋褌械褋褌胁械薪薪褘泄 褋锌褍褌薪懈泻 袟械屑谢懈
moonlight	谢褍薪薪褘泄 褋胁械褌	m	褋胁械褌 谢褍薪褘
mop	褕胁邪斜褉邪	f	锌褉懈褋锌芯褋芯斜谢械薪懈械 写谢褟 屑褘褌褜褟 锌芯谢芯胁
moral	屑芯褉邪谢褜	f	褍褉芯泻, 懈蟹胁谢械褔褢薪薪褘泄 懈蟹 懈褋褌芯褉懈懈
morality	薪褉邪胁褋褌胁械薪薪芯褋褌褜	f	锌褉懈薪褑懈锌褘 褉邪蟹谢懈褔械薪懈褟 写芯斜褉邪 懈 蟹谢邪
morning	褍褌褉芯	n	锌械褉懈芯写 胁褉械屑械薪懈 芯褌 胁芯褋褏芯写邪 写芯 锌芯谢褍写薪褟
mortality	褋屑械褉褌薪芯褋褌褜	f	褋芯褋褌芯褟薪懈械 锌芯写胁械褉卸械薪薪芯褋褌懈 褋屑械褉褌懈
mortgage	懈锌芯褌械泻邪	f	泻褉械写懈褌 锌芯写 蟹邪谢芯谐 薪械写胁懈卸懈屑芯褋褌懈
mosaic	屑芯蟹邪懈泻邪	f	泻邪褉褌懈薪邪 懈蟹 屑邪谢械薪褜泻懈褏 褑胁械褌薪褘褏 泻褍褋芯褔泻芯胁
mosque	屑械褔械褌褜	f	蟹写邪薪懈械 写谢褟 懈褋谢邪屑褋泻芯谐芯 斜芯谐芯褋谢褍卸械薪懈褟
moss	屑芯褏	m	屑邪谢械薪褜泻芯械 斜械褋褑胁械褌泻芯胁芯械 褉邪褋褌械薪懈械
moth	屑芯褌褘谢褢泻	m	薪芯褔薪芯械 薪邪褋械泻芯屑芯械, 褉芯写褋褌胁械薪薪芯械 斜邪斜芯褔泻械
mother	屑邪褌褜	f	卸械薪褖懈薪邪 锌芯 芯褌薪芯褕械薪懈褞 泻 褋胁芯懈屑 写械褌褟屑
motion	写胁懈卸械薪懈械	n	锌褉芯褑械褋褋 锌械褉械屑械褖械薪懈褟
motivation	屑芯褌懈胁邪褑懈褟	f	锌褉懈褔懈薪邪 写谢褟 写械泄褋褌胁懈褟
mount	锌芯写褋褌邪胁泻邪	f	芯褋薪芯胁邪 写谢褟 蟹邪泻褉械锌谢械薪懈褟 褔械谐芯-谢懈斜芯
mountain	谐芯褉邪	f	泻褉褍锌薪芯械 锌褉懈褉芯写薪芯械 胁芯蟹胁褘褕械薪懈械
mouse	屑褘褕褜	f	屑邪谢械薪褜泻懈泄 谐褉褘蟹褍薪 褋 芯褋褌褉芯泄 屑芯褉写芯泄
mouth	褉芯褌	m	芯褌胁械褉褋褌懈械 写谢褟 械写褘 懈 褉械褔懈
mouthful	谐谢芯褌芯泻	m	泻芯谢懈褔械褋褌胁芯 锌懈褖懈 胁芯 褉褌褍 蟹邪 褉邪蟹
movement	写胁懈卸械薪懈械	n	邪泻褌 锌械褉械屑械褖械薪懈褟; 芯褉谐邪薪懈蟹芯胁邪薪薪邪褟 谐褉褍锌锌邪
movie	褎懈谢褜屑	m	懈褋褌芯褉懈褟, 蟹邪锌懈褋邪薪薪邪褟 泻邪屑械褉芯泄
mr	谐芯褋锌芯写懈薪	m	芯斜褉邪褖械薪懈械 泻 屑褍卸褔懈薪械 锌械褉械写 褎邪屑懈谢懈械泄
mrs	谐芯褋锌芯卸邪	f	芯斜褉邪褖械薪懈械 泻 蟹邪屑褍卸薪械泄 卸械薪褖懈薪械
murder	褍斜懈泄褋褌胁芯	n	锌褉械写薪邪屑械褉械薪薪芯械 褍斜懈泄褋褌胁芯 褔械谢芯胁械泻邪
muscle	屑褘褕褑邪	f	胁芯谢芯泻薪懈褋褌邪褟 褌泻邪薪褜, 锌褉芯懈蟹胁芯写褟褖邪褟 写胁懈卸械薪懈械
music	屑褍蟹褘泻邪	f	蟹胁褍泻懈, 芯褉谐邪薪懈蟹芯胁邪薪薪褘械 写谢褟 泻褉邪褋芯褌褘
nail	谐胁芯蟹写褜	m	屑械褌邪谢谢懈褔械褋泻懈泄 泻褉械锌褢卸; 薪芯谐芯褌褜
name	懈屑褟	n	褋谢芯胁芯 写谢褟 芯斜芯蟹薪邪褔械薪懈褟 褔械谢芯胁械泻邪
nation	薪邪褑懈褟	f	斜芯谢褜褕邪褟 谐褉褍锌锌邪 谢褞写械泄 褋 芯斜褖械泄 懈褋褌芯褉懈械泄
nature	锌褉懈褉芯写邪	f	褎懈蟹懈褔械褋泻懈泄 屑懈褉 胁 褑械谢芯屑
neck	褕械褟	f	褔邪褋褌褜 褌械谢邪, 褋芯械写懈薪褟褞褖邪褟 谐芯谢芯胁褍 褋 褌褍谢芯胁懈褖械屑
need	锌芯褌褉械斜薪芯褋褌褜	f	薪械芯斜褏芯写懈屑芯褋褌褜 胁 褔褢屑-谢懈斜芯
negotiation	锌械褉械谐芯胁芯褉褘	m	芯斜褋褍卸写械薪懈械 写谢褟 写芯褋褌懈卸械薪懈褟 褋芯谐谢邪褕械薪懈褟
neighbor	褋芯褋械写	m	褔械谢芯胁械泻, 卸懈胁褍褖懈泄 褉褟写芯屑
neighborhood	褉邪泄芯薪	m	褔邪褋褌褜 谐芯褉芯写邪 懈谢懈 芯斜褖懈薪褘
nest	谐薪械蟹写芯	n	屑械褋褌芯, 褋写械谢邪薪薪芯械 锌褌懈褑械泄 写谢褟 褟懈褑
net	褋械褌褜	f	屑邪褌械褉懈邪谢 褋 褟褔械泄泻邪屑懈 写谢褟 谢芯胁谢懈
network	褋械褌褜	f	褋懈褋褌械屑邪 胁蟹邪懈屑芯褋胁褟蟹邪薪薪褘褏 褝谢械屑械薪褌芯胁
neuron	薪械泄褉芯薪	m	褋锌械褑懈邪谢懈蟹懈褉芯胁邪薪薪邪褟 薪械褉胁薪邪褟 泻谢械褌泻邪
neutral	薪械泄褌褉邪谢	m	褋芯褋褌芯褟薪懈械 薪械胁芯胁谢械褔褢薪薪芯褋褌懈 胁 泻芯薪褎谢懈泻褌
neutron	薪械泄褌褉芯薪	m	褋褍斜邪褌芯屑薪邪褟 褔邪褋褌懈褑邪 斜械蟹 蟹邪褉褟写邪
newbie	薪芯胁懈褔芯泻	m	褔械谢芯胁械泻, 薪芯胁褘泄 胁 泻邪泻芯屑-谢懈斜芯 写械谢械
news	薪芯胁芯褋褌懈	f	懈薪褎芯褉屑邪褑懈褟 芯 薪械写邪胁薪懈褏 褋芯斜褘褌懈褟褏
newspaper	谐邪蟹械褌邪	f	锌械褔邪褌薪芯械 懈蟹写邪薪懈械 褋 薪芯胁芯褋褌褟屑懈
niche	薪懈褕邪	f	褍谐谢褍斜谢械薪懈械 胁 褋褌械薪械; 褋锌械褑懈邪谢懈蟹懈褉芯胁邪薪薪褘泄 褋械谐屑械薪褌
nick	蟹邪褉褍斜泻邪	f	屑邪谢械薪褜泻懈泄 薪邪写褉械蟹 懈谢懈 屑械褌泻邪
nickel	薪懈泻械谢褜	m	褋械褉械斜褉懈褋褌芯-斜械谢褘泄 屑械褌邪谢谢; 锌褟褌懈褑械薪褌芯胁邪褟 屑芯薪械褌邪
night	薪芯褔褜	f	锌械褉懈芯写 褌械屑薪芯褌褘 芯褌 蟹邪泻邪褌邪 写芯 褉邪褋褋胁械褌邪
nightingale	褋芯谢芯胁械泄	m	锌褌懈褑邪, 懈蟹胁械褋褌薪邪褟 屑械谢芯写懈褔薪褘屑 锌械薪懈械屑
nightmare	泻芯褕屑邪褉	m	锌褍谐邪褞褖懈泄 褋芯薪
nikujaga	薪懈泻褍写蟹褟谐邪	n	褟锌芯薪褋泻芯械 斜谢褞写芯 褋 屑褟褋芯屑 懈 泻邪褉褌芯褎械谢械屑
nine	写械胁褟褌泻邪	f	褔懈褋谢芯, 褉邪胁薪芯械 褋褍屑屑械 褔械褌褘褉褢褏 懈 锌褟褌懈
nineteen	写械胁褟褌薪邪写褑邪褌褜	n	褔懈褋谢芯, 褉邪胁薪芯械 褋褍屑屑械 写械褋褟褌懈 懈 写械胁褟褌懈
nineteenth	写械胁褟褌薪邪写褑邪褌褘泄	m	锌芯褉褟写泻芯胁褘泄 薪芯屑械褉 写械胁褟褌薪邪写褑邪褌褜
ninetieth	写械胁褟薪芯褋褌褘泄	m	锌芯褉褟写泻芯胁褘泄 薪芯屑械褉 写械胁褟薪芯褋褌芯
ninety	写械胁褟薪芯褋褌芯	n	褔懈褋谢芯, 褉邪胁薪芯械 锌褉芯懈蟹胁械写械薪懈褞 写械胁褟褌懈 懈 写械褋褟褌懈
ninth	写械胁褟褌褘泄	m	锌芯褉褟写泻芯胁褘泄 薪芯屑械褉 写械胁褟褌褜
nip	褖懈锌芯泻	m	芯褋褌褉褘泄 褍泻褍褋 懈谢懈 褖懈锌芯泻
nitrogen	邪蟹芯褌	m	斜械褋褑胁械褌薪褘泄 谐邪蟹, 芯褋薪芯胁邪 邪褌屑芯褋褎械褉褘
no	薪械褌	n	芯褌褉懈褑邪褌械谢褜薪褘泄 芯褌胁械褌
nobility	斜谢邪谐芯褉芯写褋褌胁芯	n	泻邪褔械褋褌胁芯 斜褘褌褜 斜谢邪谐芯褉芯写薪褘屑 锌芯 褏邪褉邪泻褌械褉褍
noise	褕褍屑	m	谐褉芯屑泻懈泄 懈谢懈 薪械锌褉懈褟褌薪褘泄 蟹胁褍泻
nomination	薪芯屑懈薪邪褑懈褟	f	胁褘写胁懈卸械薪懈械 泻邪薪写懈写邪褌邪
nonsense	褔械锌褍褏邪	f	褋谢芯胁邪 斜械蟹 褋屑褘褋谢邪
noodle	谢邪锌褕邪	f	锌芯谢芯褋泻邪 褌械褋褌邪 懈蟹 屑褍泻懈
noon	锌芯谢写械薪褜	m	写胁械薪邪写褑邪褌褜 褔邪褋芯胁 写薪褟
norm	薪芯褉屑邪	f	芯斜褘褔薪芯械 懈谢懈 褌懈锌懈褔薪芯械
normal	薪芯褉屑邪	f	芯斜褘褔薪芯械 懈谢懈 褌懈锌懈褔薪芯械 褋芯褋褌芯褟薪懈械
north	褋械胁械褉	m	薪邪锌褉邪胁谢械薪懈械 泻 褋械胁械褉薪芯屑褍 锌芯谢褞褋褍
northeast	褋械胁械褉芯-胁芯褋褌芯泻	m	薪邪锌褉邪胁谢械薪懈械 屑械卸写褍 褋械胁械褉芯屑 懈 胁芯褋褌芯泻芯屑
northward	褋械胁械褉薪芯械 薪邪锌褉邪胁谢械薪懈械	n	薪邪锌褉邪胁谢械薪懈械 泻 褋械胁械褉褍
northwest	褋械胁械褉芯-蟹邪锌邪写	m	薪邪锌褉邪胁谢械薪懈械 屑械卸写褍 褋械胁械褉芯屑 懈 蟹邪锌邪写芯屑
nose	薪芯褋	m	褔邪褋褌褜 谢懈褑邪 褋 薪芯蟹写褉褟屑懈
note	蟹邪锌懈褋泻邪	f	泻褉邪褌泻邪褟 蟹邪锌懈褋褜; 屑褍蟹褘泻邪谢褜薪褘泄 褌芯薪
notebook	褌械褌褉邪写褜	f	泻薪懈卸泻邪 写谢褟 蟹邪锌懈褋械泄
nothing	薪懈褔褌芯	n	芯褌褋褍褌褋褌胁懈械 褔械谐芯-谢懈斜芯
notice	褍胁械写芯屑谢械薪懈械	n	芯褎懈褑懈邪谢褜薪芯械 懈蟹胁械褖械薪懈械
notion	锌芯薪褟褌懈械	n	锌褉械写褋褌邪胁谢械薪懈械 芯 褔褢屑-谢懈斜芯
novelist	褉芯屑邪薪懈褋褌	m	邪胁褌芯褉 褉芯屑邪薪芯胁
novelty	薪芯胁懈薪泻邪	f	泻邪褔械褋褌胁芯 斜褘褌褜 薪芯胁褘屑
November	薪芯褟斜褉褜	m	芯写懈薪薪邪写褑邪褌褘泄 屑械褋褟褑 谐芯写邪
nucleus	褟写褉芯	n	褑械薪褌褉邪谢褜薪邪褟 褔邪褋褌褜 邪褌芯屑邪 懈谢懈 泻谢械褌泻懈
nude	芯斜薪邪卸褢薪薪邪褟 薪邪褌褍褉邪	f	懈蟹芯斜褉邪卸械薪懈械 芯斜薪邪卸褢薪薪芯谐芯 褌械谢邪
number	褔懈褋谢芯	n	邪褉懈褎屑械褌懈褔械褋泻邪褟 胁械谢懈褔懈薪邪
numeral	褑懈褎褉邪	f	褋懈屑胁芯谢, 芯斜芯蟹薪邪褔邪褞褖懈泄 褔懈褋谢芯
nun	屑芯薪邪褏懈薪褟	f	褔谢械薪 褉械谢懈谐懈芯蟹薪芯泄 芯斜褖懈薪褘 卸械薪褖懈薪
nurse	屑械写褋械褋褌褉邪	f	褋锌械褑懈邪谢懈褋褌 锌芯 褍褏芯写褍 蟹邪 斜芯谢褜薪褘屑懈
nut	芯褉械褏	m	锌谢芯写 褋 褌胁褢褉写芯泄 芯斜芯谢芯褔泻芯泄
nutria	薪褍褌褉懈褟	f	泻褉褍锌薪褘泄 谐褉褘蟹褍薪, 锌芯褏芯卸懈泄 薪邪 斜芯斜褉邪
nutrient	锌懈褌邪褌械谢褜薪芯械 胁械褖械褋褌胁芯	n	胁械褖械褋褌胁芯, 芯斜械褋锌械褔懈胁邪褞褖械械 锌懈褌邪薪懈械
nutrition	锌懈褌邪薪懈械	n	锌褉芯褑械褋褋 锌芯谢褍褔械薪懈褟 锌懈褖懈
nylon	薪械泄谢芯薪	m	锌褉芯褔薪褘泄 褋懈薪褌械褌懈褔械褋泻懈泄 锌芯谢懈屑械褉
oak	写褍斜	m	泻褉褍锌薪芯械 写械褉械胁芯 褋 卸械谢褍写褟屑懈
oasis	芯邪蟹懈褋	m	锌谢芯写芯褉芯写薪芯械 屑械褋褌芯 胁 锌褍褋褌褘薪械
oat	芯胁褢褋	m	蟹械褉薪芯胁邪褟 泻褍谢褜褌褍褉邪
obedience	锌芯褋谢褍褕邪薪懈械	n	胁褘锌芯谢薪械薪懈械 锌褉懈泻邪蟹芯胁
objection	胁芯蟹褉邪卸械薪懈械	n	胁褘褉邪卸械薪懈械 薪械褋芯谐谢邪褋懈褟
obligation	芯斜褟蟹邪褌械谢褜褋褌胁芯	n	褌芯, 褔褌芯 褔械谢芯胁械泻 芯斜褟蟹邪薪 写械谢邪褌褜
obscurity	斜械蟹胁械褋褌薪芯褋褌褜	f	褋芯褋褌芯褟薪懈械 薪械懈蟹胁械褋褌薪芯褋褌懈
observance	褋芯斜谢褞写械薪懈械	n	锌褉邪泻褌懈泻邪 褋谢械写芯胁邪薪懈褟 蟹邪泻芯薪褍 懈谢懈 芯斜褘褔邪褞
observation	薪邪斜谢褞写械薪懈械	n	胁薪懈屑邪褌械谢褜薪芯械 褉邪褋褋屑芯褌褉械薪懈械
observer	薪邪斜谢褞写邪褌械谢褜	m	褔械谢芯胁械泻, 泻芯褌芯褉褘泄 薪邪斜谢褞写邪械褌
obsession	芯写械褉卸懈屑芯褋褌褜	f	褋芯褋褌芯褟薪懈械 薪邪胁褟蟹褔懈胁芯泄 屑褘褋谢懈
obstruction	锌褉械锌褟褌褋褌胁懈械	n	褌芯, 褔褌芯 屑械褕邪械褌 锌褉芯褏芯写褍
occasion	褋谢褍褔邪泄	m	芯褋芯斜芯械 褋芯斜褘褌懈械
occupation	锌褉芯褎械褋褋懈褟	f	褉邪斜芯褌邪 懈谢懈 蟹邪薪褟褌懈械
occurrence	锌褉芯懈褋褕械褋褌胁懈械	n	褋谢褍褔邪泄 褔械谐芯-谢懈斜芯
ocean	芯泻械邪薪	m	芯褔械薪褜 斜芯谢褜褕芯械 锌褉芯褋褌褉邪薪褋褌胁芯 屑芯褉褟
October	芯泻褌褟斜褉褜	m	写械褋褟褌褘泄 屑械褋褟褑 谐芯写邪
octopus	芯褋褜屑懈薪芯谐	m	屑芯谢谢褞褋泻 褋 胁芯褋械屑褜褞 褖褍锌邪谢褜褑邪屑懈
odd	薪械褔褢褌薪芯械 褔懈褋谢芯	n	褔懈褋谢芯, 薪械 写械谢褟褖械械褋褟 薪邪 写胁邪
oddity	褋褌褉邪薪薪芯褋褌褜	f	薪械芯斜褘褔薪邪褟 芯褋芯斜械薪薪芯褋褌褜
odds	褕邪薪褋褘	m	胁械褉芯褟褌薪芯褋褌褜 褔械谐芯-谢懈斜芯
odor	蟹邪锌邪褏	m	褏邪褉邪泻褌械褉薪褘泄 邪褉芯屑邪褌
off	胁褘泻谢褞褔械薪薪芯械 褋芯褋褌芯褟薪懈械	n	褋芯褋褌芯褟薪懈械 薪械邪泻褌懈胁薪芯褋褌懈
offense	锌褉邪胁芯薪邪褉褍褕械薪懈械	n	薪邪褉褍褕械薪懈械 蟹邪泻芯薪邪
offensive	薪邪褋褌褍锌谢械薪懈械	n	邪褌邪泻褍褞褖邪褟 胁芯械薪薪邪褟 泻邪屑锌邪薪懈褟
offer	锌褉械写谢芯卸械薪懈械	n	胁褘褉邪卸械薪懈械 谐芯褌芯胁薪芯褋褌懈 写邪褌褜 褔褌芯-谢懈斜芯
offering	锌芯写薪芯褕械薪懈械	n	褌芯, 褔褌芯 锌褉械写谢邪谐邪械褌褋褟 胁 写邪褉
office	芯褎懈褋	m	锌芯屑械褖械薪懈械 写谢褟 褉邪斜芯褌褘
officer	芯褎懈褑械褉	m	谢懈褑芯, 蟹邪薪懈屑邪褞褖械械 写芯谢卸薪芯褋褌褜 胁 邪褉屑懈懈
official	褔懈薪芯胁薪懈泻	m	谢懈褑芯, 蟹邪薪懈屑邪褞褖械械 谐芯褋褍写邪褉褋褌胁械薪薪褍褞 写芯谢卸薪芯褋褌褜
oil	屑邪褋谢芯	n	胁褟蟹泻邪褟 卸懈写泻芯褋褌褜 懈蟹 薪械褎褌懈
okra	芯泻褉邪	f	褉邪褋褌械薪懈械 褋 写谢懈薪薪褘屑懈 褋褌褉褍褔泻邪屑懈
okroshka	芯泻褉芯褕泻邪	f	褏芯谢芯写薪褘泄 褋褍锌 懈蟹 芯胁芯褖械泄 懈 泻胁邪褋邪
old-timer	褋褌邪褉芯卸懈谢	m	褔械谢芯胁械泻 褋 写芯谢谐懈屑 芯锌褘褌芯屑
olive	屑邪褋谢懈薪邪	f	屑邪谢械薪褜泻懈泄 锌谢芯写 褋 泻芯褋褌芯褔泻芯泄
omelet	芯屑谢械褌	m	斜谢褞写芯 懈蟹 胁蟹斜懈褌褘褏 褟懈褑
omission	褍锌褍褖械薪懈械	n	褌芯, 褔褌芯 斜褘谢芯 锌褉芯锌褍褖械薪芯
