en	translation	gender	meaning_translation
cliff	acantilado	m	Cara rocosa empinada; precipicio
climate	clima	m	Tiempo; atmósfera; condiciones ambientales
climax	clímax	m	Punto culminante; momento más intenso
climb	ascenso	m	Subida; acción de escalar
clinic	clínica	f	Centro médico; consultorio ambulatorio
clip	sujetador	m	Dispositivo de fijación; video corto
cloak	capa	f	Manto exterior; cobertura; disfraz
clock	reloj	m	Instrumento para medir el tiempo
close	final	m	Fin; conclusión; cierre
closet	armario	m	Guardarropa; espacio de almacenamiento
closure	cierre	m	Acción de cerrar; resolución psicológica
cloth	tela	f	Tejido; material; paño
clothes	ropa	f	Prendas; vestimenta; indumentaria
clothing	vestimenta	f	Prendas; ropa que se usa en el cuerpo
cloud	nube	f	Formación en el cielo; computación en la nube
clover	trébol	m	Planta de tres hojas; símbolo de suerte
club	club	m	Organización; arma; grupo; asociación
clue	pista	f	Indicio o señal; evidencia de misterio
clutch	embrague	m	Agarre firme; dispositivo de transmisión
coach	entrenador	m	Instructor; autobús; vehículo
coal	carbón	m	Roca combustible negra; combustible
coalition	coalición	f	Alianza; asociación temporal; unión política
coast	costa	f	Orilla; playa; borde del océano
coat	abrigo	m	Chaqueta; capa protectora; prenda exterior
coating	revestimiento	m	Capa protectora; recubrimiento superficial
cock	gallo	m	Ave macho; grifo o válvula
cocktail	cóctel	m	Bebida alcohólica mezclada; aperitivo
cocoa	cacao	m	Polvo de chocolate; bebida de chocolate caliente
coconut	coco	m	Fruta tropical; nuez de cáscara dura
cod	bacalao	m	Tipo de pescado blanco del Atlántico
code	código	m	Sistema de reglas; programación; cifrado
coffee	café	m	Bebida; grano; cafeína
coffin	ataúd	m	Caja mortuoria; recipiente para el difunto
coin	moneda	f	Dinero; divisa; disco metálico
coincidence	coincidencia	f	Ocurrencia casual; eventos simultáneos
cola	cola	f	Refresco carbonatado; bebida oscura
cold	resfriado	m	Baja temperatura; enfermedad; frialdad
collaboration	colaboración	f	Trabajo conjunto; cooperación; esfuerzo común
collapse	colapso	m	Falla repentina; derrumbe; crisis
collar	cuello	m	Parte del cuello de la prenda; banda
collateral	garantía	f	Seguridad prometida para pagar préstamo
colleague	colega	m	Compañero de trabajo; asociado; par
collection	colección	f	Recopilación; acumulación; conjunto
college	universidad	f	Escuela; institución educativa superior
colonel	coronel	m	Oficial militar; comandante de alto rango
colony	colonia	f	Asentamiento; territorio bajo control extranjero
color	color	m	Tono; tinte; apariencia cromática
coloring	coloración	f	Proceso de agregar color; pigmentación
Colosseum	Coliseo	m	Anfiteatro romano antiguo grande
column	columna	f	Pilar; artículo; soporte vertical
comb	peine	m	Dispositivo con dientes para el cabello
combat	combate	m	Lucha; batalla; guerra; enfrentamiento
combination	combinación	f	Mezcla; unión; código de seguridad
comedy	comedia	f	Espectáculo divertido; entretenimiento humorístico
comer	recién llegado	m	Persona que llega; cosa con potencial
comet	cometa	m	Cuerpo celeste con cola brillante
comfort	comodidad	f	Facilidad física; consuelo; lujo
comic	cómic	m	Historia ilustrada; historieta humorística
command	comando	m	Orden; control; instrucción; autoridad
commander	comandante	m	Líder militar; jefe; director
comment	comentario	m	Observación; nota; opinión
commentary	comentario	m	Observaciones explicativas sobre un evento
commerce	comercio	m	Negocio; compra y venta; actividad comercial
commercial	comercial	m	Anuncio publicitario; publicidad empresarial
commission	comisión	f	Tarifa; autorización; comité; tarea
commitment	compromiso	m	Promesa; dedicación; obligación
committee	comité	m	Grupo; junta; panel; consejo
common	común	m	Área compartida; tierra pública; ordinario
commonwealth	mancomunidad	f	Comunidad política; riqueza compartida
communication	comunicación	f	Contacto; mensaje; interacción; intercambio
communion	comunión	f	Compartir pensamientos; sacramento cristiano
communism	comunismo	m	Sistema político con propiedad común
communist	comunista	m	Partidario de la ideología comunista
community	comunidad	f	Vecindario; sociedad; grupo local
companion	compañero	m	Amigo; pareja; persona que acompaña
company	compañía	f	Empresa; firma; corporación; sociedad
comparative	comparativo	m	Forma comparativa de adjetivo o adverbio
comparison	comparación	f	Contraste; evaluación; análisis entre cosas
compass	brújula	f	Instrumento de navegación; compás de dibujo
compassion	compasión	f	Simpatía; empatía; bondad; misericordia
compensation	compensación	f	Pago; recompensa; salario; indemnización
competence	competencia	f	Habilidad para hacer algo bien
competition	competencia	f	Concurso; rivalidad; desafío deportivo
compilation	recopilación	f	Colección de elementos reunidos juntos
complaint	queja	f	Reclamo; crítica; objeción; protesta
completion	finalización	f	Acción de terminar o completar algo
complexion	tez	f	Color y apariencia natural de la piel
complexity	complejidad	f	Complicación; naturaleza intrincada; dificultad
complication	complicación	f	Elemento complejo o confuso; dificultad
compliment	cumplido	m	Expresión de elogio; halago cortés
composer	compositor	m	Creador musical; persona que escribe música
composition	composición	f	Obra musical; estructura; arreglo; escrito
compost	compost	m	Materia orgánica descompuesta para fertilizar
compound	compuesto	m	Mezcla química; área cerrada; complejo
compromise	compromiso	m	Acuerdo por concesión mutua; arreglo
compulsion	compulsión	f	Impulso irresistible a comportarse de cierta manera
computer	computadora	f	Máquina; dispositivo; procesador electrónico
comrade	camarada	m	Compañero o colega; amigo leal
conceit	vanidad	f	Orgullo excesivo en uno mismo
concentration	concentración	f	Enfoque; atención; densidad; reunión
concept	concepto	m	Idea; noción; principio; pensamiento
conception	concepción	f	Formación de idea; inicio de embarazo
concern	preocupación	f	Inquietud; asunto; negocio; cuidado
concert	concierto	m	Presentación musical; recital en vivo
concession	concesión	f	Cosa otorgada o cedida; privilegio
conclusion	conclusión	f	Fin; resultado; decisión; desenlace
concrete	hormigón	m	Material de construcción; cemento y agregado
condemnation	condena	f	Expresión de desaprobación; censura
condition	condición	f	Estado; requisito; situación; salud
condominium	condominio	m	Apartamento de propiedad individual
conduct	conducta	f	Comportamiento; forma de actuar
conductor	director	m	Líder de orquesta; cobrador de tren
conference	conferencia	f	Reunión; convención; cumbre profesional
confession	confesión	f	Admisión de culpa o error; reconocimiento
confidence	confianza	f	Seguridad; certeza; fe en capacidades
confinement	confinamiento	m	Estado de estar encerrado o limitado
conflict	conflicto	m	Disputa; guerra; desacuerdo; choque
confusion	confusión	f	Desconcierto; desorden; incertidumbre; caos
conglomerate	conglomerado	m	Gran corporación con negocios diversos
congratulation	felicitación	f	Expresión de alegría por logro conseguido
congregation	congregación	f	Grupo reunido para adoración religiosa
congress	congreso	m	Asamblea; legislatura; parlamento nacional
conjunction	conjunción	f	Combinación; palabra conectora en gramática
connection	conexión	f	Enlace; relación; contacto; vínculo
conqueror	conquistador	m	Persona que conquista territorio
conquest	conquista	f	Acto de conquistar; territorio conquistado
conscience	conciencia	f	Sentido moral; voz interior; ética
conscious	consciente	m	Estado de estar despierto y alerta
consciousness	consciencia	f	Estado de estar consciente; percepción mental
conscription	conscripción	f	Reclutamiento obligatorio para el servicio estatal
consequence	consecuencia	f	Resultado o efecto; desenlace de acción
consideration	consideración	f	Pensamiento cuidadoso; atención a factores
consignment	consignación	f	Lote de mercancías enviadas; envío
consistency	consistencia	f	Uniformidad en textura o comportamiento
consolation	consuelo	m	Alivio recibido tras pérdida; confort
consortium	consorcio	m	Asociación de organizaciones que trabajan juntas
conspiracy	conspiración	f	Plan secreto para acto ilegal o dañino
constable	alguacil	m	Oficial de policía con autoridad limitada
constellation	constelación	f	Grupo de estrellas formando patrón reconocible
constitution	constitución	f	Principios fundamentales que gobiernan un estado
constraint	restricción	f	Limitación impuesta; factor que limita acción
construction	construcción	f	Proceso de edificar; estructura construida
consulate	consulado	m	Oficina de un cónsul; misión diplomática
consultancy	consultoría	f	Práctica que provee asesoría experta
consultation	consulta	f	Reunión para buscar consejo sobre asunto
consulting	consultoría	f	Negocio de proveer asesoría profesional
consumer	consumidor	m	Persona que compra bienes para uso personal
consumption	consumo	m	Uso de recursos; acción de comer o beber
contact	contacto	m	Encuentro; comunicación; persona conocida útil
container	contenedor	m	Objeto usado para guardar o transportar algo
contamination	contaminación	f	Acción de hacer algo impuro con sustancia
contempt	desprecio	m	Sentimiento de que algo no vale consideración
content	contenido	m	Cosas contenidas; información sustantiva
contention	contienda	f	Desacuerdo acalorado; punto defendido
contest	concurso	m	Competencia; evento donde personas compiten
context	contexto	m	Circunstancias; entorno; trasfondo de evento
continent	continente	m	Gran extensión de tierra en el mundo
contingent	contingente	m	Grupo formando parte de grupo mayor
continuation	continuación	f	Acción de llevar adelante sin interrupción
continuity	continuidad	f	Existencia ininterrumpida de algo
contour	contorno	m	Perfil de figura; línea en mapa de elevación
contract	contrato	m	Acuerdo escrito ejecutable por ley
contraction	contracción	f	Proceso de hacerse más pequeño; forma abreviada
contractor	contratista	m	Persona o empresa que provee materiales
contrary	contrario	m	Opuesto o reverso de algo diferente
contrast	contraste	m	Diferencia notable; yuxtaposición de elementos
contribution	contribución	f	Algo dado; participación en resultado
control	control	m	Poder para dirigir o influenciar; regulación
controversy	controversia	f	Desacuerdo prolongado sobre opinión pública
convenience	conveniencia	f	Facilidad de proceder sin dificultad; comodidad
convention	convención	f	Reunión grande; conferencia de profesionales
conversation	conversación	f	Intercambio informal de ideas mediante palabras
converse	converso	m	Opuesto o reverso de declaración; relación inversa
conversion	conversión	f	Proceso de cambiar de una forma a otra
conveyance	transporte	m	Acción de transportar de un lugar a otro
conviction	convicción	f	Creencia firme; veredicto de culpabilidad
cook	cocinero	m	Persona que prepara comida como trabajo
cookery	cocina	f	Práctica de preparar alimentos; artes culinarias
cookie	galleta	f	Pastel dulce pequeño redondo y plano
cooking	cocina	f	Práctica de preparar comida combinando ingredientes
cool	frescura	f	Temperatura baja; compostura calmada
cooperation	cooperación	f	Acción de trabajar juntos hacia meta común
coordinate	coordenada	f	Valor que especifica posición de punto
cop	policía	m	Oficial de policía que hace cumplir la ley
copper	cobre	m	Elemento metálico rojizo usado en electricidad
copy	copia	f	Cosa hecha para verse como otra; ejemplar
copyright	derechos	m	Derecho legal exclusivo de reproducir obra
coral	coral	m	Sustancia dura secretada por pólipos marinos
cord	cordón	m	Material flexible de hebras retorcidas; cable
cordial	cordial	m	Bebida dulce de frutas; licor de jugo
core	núcleo	m	Parte central o más importante; centro
cork	corcho	m	Sustancia flotante de corteza de alcornoque
corn	maíz	m	Cereal principal de región; trigo o maíz
corner	esquina	f	Lugar donde dos lados se encuentran; rincón
corporal	cabo	m	Rango militar sobre soldado raso y bajo sargento
corporation	corporación	f	Empresa grande autorizada como entidad legal
corps	cuerpo	m	Subdivisión principal de fuerza armada
correction	corrección	f	Cambio que rectifica error; acción de corregir
correlation	correlación	f	Relación mutua entre dos o más cosas
correspondence	correspondencia	f	Cartas o correos enviados; comunicación escrita
correspondent	corresponsal	m	Persona que escribe reportes para periódico
corridor	corredor	m	Pasaje en edificio con habitaciones
corruption	corrupción	f	Conducta deshonesta de quienes tienen poder
cosmetic	cosmético	m	Producto aplicado para mejorar apariencia
cosmos	cosmos	m	Universo visto como sistema ordenado
cost	costo	m	Cantidad de dinero necesaria para comprar
costume	disfraz	m	Conjunto de ropa para representar personaje
cottage	cabaña	f	Casa pequeña y simple en zona rural
cotton	algodón	m	Sustancia fibrosa blanca para hacer textiles
couch	sofá	m	Mueble largo tapizado para sentarse varias personas
cough	tos	f	Expulsión repentina de aire de pulmones
council	consejo	m	Cuerpo de personas elegido para decisiones
counsel	asesoría	f	Consejo dado formal o profesionalmente
counseling	asesoramiento	m	Provisión de asistencia profesional psicológica
count	recuento	m	Determinación del número total; punto
countenance	semblante	m	Rostro de persona; expresión facial
counter	mostrador	m	Accesorio plano para transacciones; oposición
country	país	m	Nación con gobierno propio; áreas rurales
countryside	campo	m	Tierra y paisaje de área rural fuera de ciudades
county	condado	m	División territorial para fines administrativos
coup	golpe	m	Toma violenta de poder; acción exitosa notable
couple	pareja	f	Dos individuos considerados juntos; relación romántica
courage	valor	m	Habilidad de hacer algo que asusta; fortaleza
courier	mensajero	m	Persona empleada para entregar mensajes rápidamente
course	curso	m	Ruta o dirección seguida; serie de lecciones
court	tribunal	m	Juzgado; área para deportes; corte real
courtesy	cortesía	f	Comportamiento educado que muestra respeto
courthouse	juzgado	m	Edificio donde se celebra tribunal judicial
courtroom	sala	f	Lugar donde tribunal de justicia se reúne
courtship	cortejo	m	Período durante el cual se desarrolla relación
cousin	primo	m	Hijo del tío o tía; pariente común
cover	cubierta	f	Algo puesto sobre objeto para proteger; refugio
coverage	cobertura	f	Extensión en que algo está cubierto; protección
cow	vaca	f	Hembra adulta de ganado vacuno para leche
coward	cobarde	m	Persona que carece de valor para enfrentar peligro
crab	cangrejo	m	Crustáceo con caparazón plano y pinzas
crack	grieta	f	Línea donde algo se dividió sin romper
cracker	galleta	f	Galleta delgada y seca para comer con queso
cradle	cuna	f	Cama pequeña para bebé con balancines
craft	artesanía	f	Actividad que involucra hacer cosas a mano
cram	empollón	m	Estudio intensivo en corto período para examen
cramp	calambre	m	Contracción muscular involuntaria dolorosa
crane	grúa	f	Máquina alta para mover objetos pesados
crash	choque	m	Colisión violenta entre vehículos; falla súbita
crawl	gateo	m	Acto de moverse en manos y rodillas
cream	crema	f	Líquido graso blanco que sube de la leche
creation	creación	f	Acción de traer algo a la existencia
creator	creador	m	Persona que trae algo a la existencia
creature	criatura	f	Animal o ser especialmente no humano
credit	crédito	m	Reconocimiento por logro; arreglo de pago
creditor	acreedor	m	Persona a quien se debe dinero
creed	credo	m	Sistema de creencias religiosas; principios
creek	arroyo	m	Corriente menor de río; entrada estrecha
creep	arrastre	m	Movimiento lento cerca del suelo; deformación gradual
crescent	creciente	f	Forma curva de luna menguante o creciente
crew	tripulación	f	Grupo que trabaja junto en barco o avión
crib	cuna	f	Cama pequeña con lados altos para bebé
crime	crimen	m	Acción punible por ley; actividad ilegal
criminal	criminal	m	Persona que ha cometido delito punible
crisis	crisis	f	Tiempo de dificultad intensa que requiere acción
criterion	criterio	m	Principio por el cual algo puede juzgarse
critic	crítico	m	Persona que expresa opiniones desfavorables
criticism	crítica	f	Expresión de desaprobación; análisis de méritos
crocodile	cocodrilo	m	Reptil semiacuático depredador grande con mandíbulas
crop	cultivo	m	Planta cultivada como alimento; cosecha
cross	cruz	f	Marca formada por líneas que se cruzan
crossing	cruce	m	Lugar donde rutas se cruzan o se puede cruzar
crouch	posición	f	Posición con rodillas dobladas y cuerpo inclinado
crow	cuervo	m	Ave negra grande de familia córvida; canto
crowd	multitud	f	Gran número de personas reunidas desordenadamente
crown	corona	f	Adorno de cabeza de monarca; parte superior
cruelty	crueldad	f	Indiferencia o placer en causar dolor
cruise	crucero	m	Viaje en barco por placer visitando puertos
crumb	migaja	f	Fragmento pequeño de pan o pastel
crunch	crujido	m	Sonido fuerte al morder algo crujiente; crisis
crusade	cruzada	f	Campaña vigorosa por cambio; expedición medieval
crush	enamoramiento	m	Infatuación intensa pero breve por alguien
crust	corteza	f	Parte exterior dura de pan; capa exterior
crutch	muleta	f	Palo largo con pieza cruzada como apoyo
cry	grito	m	Grito fuerte expresando emoción; apelación urgente
crystal	cristal	m	Sustancia sólida transparente; vidrio de calidad
cube	cubo	m	Forma geométrica tridimensional con seis caras
cuckoo	cuco	m	Ave conocida por poner huevos en otros nidos
cucumber	pepino	m	Fruta cilíndrica verde con pulpa acuosa
cuddle	abrazo	m	Abrazo prolongado expresando afecto; sostén cercano
cuff	puño	m	Parte final de manga donde se dobla material
cult	culto	m	Sistema de veneración religiosa; grupo religioso
cultivation	cultivo	m	Acción de preparar tierra para cultivos
culture	cultura	f	Artes y costumbres de nación particular
cup	taza	f	Recipiente pequeño para beber con asa
cure	cura	f	Sustancia que alivia enfermedad; solución a problema
curfew	toque de queda	m	Regulación de permanecer en casa durante horas
curiosity	curiosidad	f	Deseo fuerte de saber o aprender algo
curl	rizo	m	Forma enrollada o en espiral; mechón de cabello
currency	moneda	f	Sistema de dinero de uso general en país
current	corriente	f	Cuerpo de agua o aire moviéndose; flujo eléctrico
curriculum	currículo	m	Materias que comprenden curso de estudio
curry	curry	m	Plato con salsa de especias del sur de Asia
curse	maldición	f	Expresión solemne para invocar daño sobrenatural
curtain	cortina	f	Material suspendido para cubrir ventana o puerta
curve	curva	f	Línea que se desvía gradualmente de ser recta
cushion	cojín	m	Bolsa suave de tela rellena para sentarse
custard	natilla	f	Postre dulce hecho con leche y huevos
custody	custodia	f	Cuidado protector; encarcelamiento o confinamiento
custom	costumbre	f	Manera tradicional de comportarse en sociedad
customer	cliente	m	Persona que compra bienes o servicios
cut	corte	m	Abertura hecha cortando; reducción de cantidad
cutback	recorte	m	Reducción en algo típicamente gasto o provisión
cycle	ciclo	m	Serie de eventos repetidos regularmente en orden
cycling	ciclismo	m	Deporte de montar bicicleta para recreación
dad	papá	m	Padre; término informal para padre masculino
daffodil	narciso	m	Planta bulbosa con flores amarillas de primavera
daily	diario	m	Periódico publicado cada día excepto domingo
dairy	lechería	f	Edificio para procesamiento de leche y productos
daisy	margarita	f	Planta de pradera con flores blancas amarillas
dam	represa	f	Barrera a través de río para retener agua
damage	daño	m	Perjuicio físico que afecta valor o función
damn	maldición	f	Expresión de enojo, sorpresa o frustración
dance	baile	m	Serie de movimientos al ritmo de música
dancer	bailarín	m	Persona que baila o cuya profesión es bailar
dandelion	diente de león	m	Hierba con flores amarillas y semillas plumosas
danger	peligro	m	Posibilidad de sufrir daño o lesión
dare	desafío	m	Reto para hacer algo peligroso o temerario
dark	oscuridad	f	Ausencia de luz; tiempo cuando está oscuro
darkness	tinieblas	f	Ausencia parcial o total de luz; ignorancia
darling	querido	m	Persona amada; alguien tratado con afecto
dart	dardo	m	Proyectil puntiagudo lanzado como arma o en juego
dash	carrera	f	Movimiento rápido en dirección particular; pizca
data	datos	m	Hechos y estadísticas recopilados para análisis
database	base de datos	f	Conjunto estructurado de datos en computadora
date	fecha	f	Día particular del mes o año; cita romántica
daughter	hija	f	Niña en relación con sus padres; descendiente
dawn	amanecer	m	Primera luz en el cielo antes del amanecer
day	día	m	Período de veinticuatro horas como unidad de tiempo
daybreak	alba	f	Tiempo cuando aparece luz por la mañana
daylight	luz	f	Luz natural del día; período entre amanecer y ocaso
daytime	día	m	Tiempo entre amanecer y ocaso con luz natural
daze	aturdimiento	m	Estado de confusión causado por golpe o choque
dazzle	deslumbramiento	m	Cualidad de ser extremadamente brillante
dead	muertos	m	Personas que han muerto; período más frío
deadline	plazo	m	Fecha límite para completar o presentar algo
deadlock	punto muerto	m	Situación sin progreso por desacuerdo fundamental
deal	trato	m	Acuerdo entre partes para beneficio mutuo
dealer	comerciante	m	Persona o negocio que compra y vende bienes
dealership	concesionario	m	Negocio autorizado para vender producto particular
dealing	negociación	f	Acción de comprar y vender mercancía; tratamiento
dear	querido	m	Persona amada o apreciada; forma de cariño
death	muerte	f	Acción de morir o ser matado; fin de la vida
debate	debate	m	Discusión formal sobre tema con argumentos opuestos
debt	deuda	f	Algo especialmente dinero que se debe a otro
debtor	deudor	m	Persona o institución que debe suma a otro
decade	década	f	Período de diez años como los años ochenta
deceit	engaño	m	Acción de engañar ocultando o tergiversando verdad
December	diciembre	m	Duodécimo y último mes del año gregoriano
decency	decencia	f	Comportamiento conforme a estándares de moralidad
deception	decepción	f	Acto de causar que alguien crea algo no verdadero
decision	decisión	f	Conclusión alcanzada después de consideración
deck	cubierta	f	Estructura de tablones formando plataforma o piso
declaration	declaración	f	Declaración formal o explícita; anuncio oficial
decline	declive	m	Pérdida gradual de fuerza, números o calidad
decoration	decoración	f	Proceso de adornar algo; ornamento o embellecimiento
decrease	disminución	f	Proceso de volverse más pequeño o menos en tamaño
decree	decreto	m	Orden oficial emitida por autoridad legal; fallo
dedication	dedicación	f	Cualidad de estar comprometido con tarea o propósito
deduction	deducción	f	Acción de restar algo de total; inferencia lógica
deep	profundidad	f	El mar u océano; extensión vasta o parte profunda
deer	ciervo	m	Animal ungulado con astas ramificadas óseas
default	incumplimiento	m	Falta de cumplir obligación especialmente préstamo
defeat	derrota	f	Instancia de ser derrotado; acto de vencer
defect	defecto	m	Deficiencia, imperfección o carencia en algo
defendant	acusado	m	Individuo o entidad acusada en tribunal de justicia
defense	defensa	f	Acción de defender de ataque o resistir
deficiency	deficiencia	f	Falta o escasez de algo esencial o requerido
deficit	déficit	m	Cantidad por la cual algo es demasiado pequeño
definition	definición	f	Declaración del significado exacto de palabra
deflation	deflación	f	Acción de desinflar; reducción de nivel de precios
degree	grado	m	Cantidad o nivel en que algo sucede; título académico
deity	deidad	f	Dios o diosa en religión politeísta; estatus divino
delay	retraso	m	Período de tiempo por el cual algo se pospone
delegate	delegado	m	Persona enviada para representar a otros en conferencia
delegation	delegación	f	Cuerpo de delegados; acción de delegar autoridad
delicacy	delicadeza	f	Algo bueno de comer que es caro o raro
delight	deleite	m	Gran placer o satisfacción; algo que da placer
delivery	entrega	f	Acción de entregar cartas o bienes; parto
delta	delta	m	Terreno triangular en desembocadura de río; letra griega
deluge	diluvio	m	Inundación severa; cantidad abrumadora de algo
demand	demanda	f	Solicitud insistente; deseo de consumidores por bienes
democracy	democracia	f	Sistema de gobierno por población mediante representantes
demonstration	manifestación	f	Acción de mostrar existencia de algo; reunión pública
denial	negación	f	Acción de declarar algo no verdadero; rechazo
denim	mezclilla	f	Tela resistente de algodón típicamente azul para jeans
denomination	denominación	f	Rama religiosa reconocida; valor nominal de billete
density	densidad	f	Grado de compactación de sustancia; cantidad de masa
dentist	dentista	m	Persona calificada para tratar enfermedades dentales
department	departamento	m	División de organización grande con área específica
departure	salida	f	Acción de dejar lugar; desviación de curso usual
dependency	dependencia	f	Estado de confiar o ser controlado por alguien
deportation	deportación	f	Acción de deportar extranjero de país; expulsión
deposit	depósito	m	Suma de dinero puesta en cuenta bancaria; capa
deposition	deposición	f	Acción de deponer a alguien de cargo; testimonio
depreciation	depreciación	f	Disminución del valor de activo con el tiempo
depression	depresión	f	Desaliento severo; lugar hundido; declive económico
depth	profundidad	f	Distancia desde superficie hacia abajo; complejidad
deputy	diputado	m	Persona designada para actuar como sustituto
deregulation	desregulación	f	Eliminación de regulaciones gubernamentales en industria
descent	descenso	m	Acción de moverse hacia abajo; linaje o ascendencia
description	descripción	f	Relato hablado o escrito de persona u objeto
desert	desierto	m	Área árida de paisaje con poca precipitación
design	diseño	m	Plan o dibujo producido para mostrar función de algo
