en	meaning_en	example_en
die	Cube for games; tool for shaping.	Six-sided die determined game outcome.
diet	Food regularly consumed.	Healthy diet improved energy levels significantly.
difference	Distinction; variation; contrast; gap.	Cultural difference enriched global understanding perspectives.
difficulty	Problem; challenge; obstacle; hardship.	Math difficulty challenged even advanced students.
diffraction	Bending of waves around obstacles.	Light diffraction created beautiful rainbow patterns.
dig	Excavate earth; understand.	Archaeological dig uncovered ancient Roman artifacts.
digestion	Process of breaking down food.	Healthy digestion requires proper chewing habits.
dignity	Quality of being worthy of respect.	Human dignity deserves universal recognition always.
dime	A ten-cent coin; a small denomination of US currency.	Rare dime was worth collector's fortune.
dimension	A measurable extent of some kind.	Fourth dimension remains theoretical physics concept.
dining	The act of eating a meal; consuming food in a formal setting.	Fine dining experience exceeded all expectations.
dinner	Meal; supper; feast; banquet.	Family dinner brought everyone together nightly.
dinosaur	Extinct giant reptile.	Tyrannosaurus dinosaur dominated prehistoric landscape millions.
dip	Brief downward movement.	Stock market dip concerned nervous investors.
diploma	Certificate of graduation.	College diploma opened career opportunities widely.
diplomacy	Management of international relations.	Skillful diplomacy prevented regional war conflict.
diplomat	Official representing country.	Experienced diplomat negotiated peace treaty successfully.
direction	Way; guidance; path; instruction.	Clear direction helped team achieve goals.
director	Manager; leader; filmmaker; head.	Film director won prestigious international award.
directory	A book listing people or organizations.	Phone directory contained local business listings.
dirt	Substance that makes something unclean.	Rich garden dirt supported healthy plant growth.
disability	Impairment; handicap; incapacity; limitation.	Physical disability never limited personal achievements.
disadvantage	Unfavorable condition; drawback; handicap; weak point.	Economic disadvantage motivated educational success drive.
disagreement	Difference of opinion; dispute; conflict; discord.	Political disagreement sparked heated public debate.
disappointment	Letdown; sadness from unmet expectations; frustration.	Bitter disappointment taught valuable life lessons.
disapproval	Negative judgment; rejection; condemnation.	Parental disapproval changed teenager's behavior patterns.
disarmament	Reduction of weapons; demilitarization; peace process.	Nuclear disarmament promoted global peace efforts.
disaster	Catastrophe; calamity; tragedy; crisis.	Natural disaster displaced thousands of families.
discard	Throwing away; rejection; unwanted item.	Careful discard prevented environmental pollution problems.
discharge	Release; dismissal; electrical output; emission.	Hospital discharge required complete recovery confirmation.
discipline	Control; field; punishment; training.	Personal discipline achieved long-term success goals.
disclosure	Revelation; making known; exposure; confession.	Financial disclosure revealed hidden corporate assets.
disco	Dance club; discotheque; dance music venue.	Saturday night disco attracted dancing crowds.
discomfort	Unease; mild pain; awkwardness; inconvenience.	Physical discomfort signaled underlying health issues.
discord	Disagreement; conflict; lack of harmony; strife.	Family discord required professional mediation intervention.
discount	Price reduction; rebate; deduction; markdown.	Student discount made textbooks more affordable.
discouragement	Loss of confidence; dismay; deterrent; disheartening.	Temporary discouragement motivated eventual comeback success.
discourse	Conversation; formal speech; discussion; dialogue.	Intellectual discourse elevated academic conference discussions.
discovery	Finding; detection; revelation; new knowledge.	Scientific discovery revolutionized medical treatment approaches.
discredit	Loss of reputation; damage to credibility; dishonor.	Public discredit ended political career permanently.
discrimination	Unfair treatment; prejudice; ability to distinguish; bias.	Racial discrimination violated fundamental human rights.
discussion	Talk; conversation; debate; dialogue.	Group discussion generated innovative solution ideas.
disease	Illness; sickness; disorder; ailment.	Rare disease required specialized treatment protocol.
disgrace	Shame; dishonor; loss of respect; scandal.	Public disgrace forced immediate resignation decision.
disgust	Strong dislike; revulsion; nausea; repugnance.	Moral disgust motivated social justice activism.
dish	Plate; food; container; meal.	Traditional dish represented cultural heritage perfectly.
dishonor	Shame; disgrace; loss of honor; disrespect.	Family dishonor required generations to repair.
disk	Disc; circle; storage; record.	Computer disk stored important backup data.
dismissal	Firing from job; rejection; sending away; discharge.	Unfair dismissal violated employment contract terms.
disorder	Confusion; illness; lack of order; disturbance.	Anxiety disorder required professional therapeutic treatment.
dispatch	Sending; message; speed; killing.	Urgent dispatch delivered critical military orders.
displacement	Movement; relocation; substitution; volume.	Population displacement followed natural disaster events.
display	Show; exhibition; screen; demonstration.	Museum display showcased ancient Egyptian artifacts.
disposal	Getting rid of; arrangement; control; discarding.	Waste disposal required proper environmental protocols.
disposition	Arrangement; temperament; tendency; disposal.	Cheerful disposition brightened workplace atmosphere daily.
dispute	Argument; disagreement; conflict; debate.	Border dispute lasted several diplomatic decades.
dissatisfaction	Discontent; unhappiness; displeasure; annoyance.	Customer dissatisfaction prompted immediate service improvements.
dissolution	Dissolving; breakup; termination; decomposition.	Marriage dissolution required legal mediation assistance.
distance	Space; gap; remoteness; length.	Physical distance couldn't weaken emotional bonds.
distinction	Difference; honor; excellence; discrimination.	Academic distinction earned scholarship funding opportunities.
distortion	Deformation; misrepresentation; twist; alteration.	Sound distortion damaged audio equipment quality.
distraction	Diversion; interruption; amusement; inattention.	Constant distraction reduced workplace productivity levels.
distress	Suffering; anguish; hardship; trouble.	Emotional distress required professional therapeutic support.
distribution	Delivery; spread; allocation; sharing.	Food distribution helped disaster relief efforts.
distributor	Dealer; wholesaler; device that distributes.	Authorized distributor supplied genuine replacement parts.
district	Area; region; zone; territory.	Historic district preserved architectural heritage buildings.
disturbance	Disruption; disorder; commotion; interference.	Noise disturbance violated community peace ordinance.
ditch	Trench; channel; drainage; abandonment.	Irrigation ditch watered agricultural crops efficiently.
diversion	Entertainment; detour; distraction; deviation.	Traffic diversion redirected vehicles around construction.
diversity	Variety; difference; range; multiculturalism.	Cultural diversity enriched community experiences significantly.
dividend	Profit share; bonus; benefit; return.	Quarterly dividend rewarded loyal patient investors.
divinity	Godhood; theology; divine nature; deity.	Ancient divinity influenced cultural religious practices.
division	Separation; department; section; math operation.	Math division challenged elementary school students.
divorce	Marriage dissolution; separation; split; break.	Amicable divorce protected children's emotional welfare.
dock	Wharf; pier; harbor; court defendant area.	Fishing boat returned to harbor dock.
doctor	Medical practitioner; physician; person with doctorate.	Family doctor provided comprehensive healthcare services.
doctrine	Teaching; principle; belief; policy.	Religious doctrine guided community moral standards.
document	A written or printed paper providing information.	Legal document required notarized signature verification.
dog	Canine; pet; animal; hound.	Loyal dog protected family from intruders.
dogma	Doctrine; belief; principle; established teaching.	Religious dogma influenced cultural social practices.
doll	Toy figure; puppet; attractive woman; model.	Antique doll became valuable collector's treasure.
dollar	Currency; money; bill; unit.	Silver dollar dated from nineteenth century.
dolphin	Marine mammal; intelligent sea creature; cetacean.	Playful dolphin entertained tourists at oceanarium.
domain	Territory; field; internet address; realm.	Website domain generated significant online traffic.
domestic	Household worker; servant; home-related; national.	Trusted domestic maintained household efficiently daily.
domination	Control; rule; dominance; supremacy.	Market domination required strategic business planning.
dominion	Control; territory; domain; sovereignty.	British dominion extended across multiple continents.
don	Spanish title; university teacher; crime boss.	Respected don taught classical literature courses.
donation	Gift; contribution; charitable giving; offering.	Generous donation funded scholarship program completely.
donkey	Small horse-like animal; ass; stubborn person.	Sure-footed donkey carried supplies up mountain.
donut	Ring-shaped cake; doughnut; fried sweet bread.	Glazed donut provided sweet morning energy.
doom	Fate; destruction; ruin; death; terrible destiny.	Impending doom motivated urgent evacuation plans.
door	Entrance; opening; barrier; access.	Front door welcomed visitors with warmth.
doorway	Entrance; opening; passage; portal.	Narrow doorway required sideways maneuvering carefully.
dope	Drug; stupid person; information; thick liquid.	Police raid uncovered illegal dope operation.
dork	Socially awkward person; nerd; foolish person.	Class dork became successful computer entrepreneur.
dormitory	Residence hall; student housing; sleeping quarters.	College dormitory housed freshman students comfortably.
dose	Amount of medicine; portion; quantity; measured amount.	Prescribed dose relieved patient's chronic pain.
dot	A small round mark.	Tiny dot marked treasure map location.
double	Duplicate; pair; twice the amount; twofold.	Body double performed dangerous stunt sequences.
doubt	Uncertainty; question; suspicion; hesitation.	Nagging doubt prevented confident decision making.
down	Descent; soft feathers; downward direction.	Goose down provided excellent insulation warmth.
downtown	City center; business district; urban core.	Busy downtown attracted shoppers and tourists.
dozen	Twelve items; group of twelve; baker dozen.	Fresh dozen eggs came from farm.
draft	Preliminary; wind; selection; military service.	Cold draft made room uncomfortably chilly.
dragon	Mythical creature; legendary beast; fierce person.	Ancient dragon guarded treasure hoard jealously.
drama	Play; theater; conflict; emotion.	Shakespearean drama captivated theater audience completely.
drawer	A sliding compartment in furniture.	Kitchen drawer organized cooking utensils neatly.
drawing	Picture; sketch; art; illustration.	Pencil drawing captured subject's likeness perfectly.
dream	Sleep vision; aspiration; hope; fantasy.	Childhood dream became successful adult career.
dress	Clothing; garment; attire; outfit.	Wedding dress was family heirloom treasure.
drill	Boring tool; practice exercise; military training.	Fire drill prepared students for emergencies.
drink	Beverage; liquid; alcohol; consumption.	Refreshing drink cooled overheated summer workers.
drive	Drive; motivation; road; journey.	Scenic drive revealed beautiful mountain vistas.
driver	Operator; chauffeur; person; motorist.	Experienced driver navigated heavy traffic safely.
drop	Fall; decrease; liquid; abandon.	Single raindrop triggered emotional childhood memory.
drug	Medicine; narcotic; substance; medication.	Prescription drug controlled chronic pain effectively.
drugstore	Pharmacy; medicine shop; chemist shop.	Neighborhood drugstore provided essential healthcare supplies.
drum	Musical instrument; cylindrical container; percussion.	African drum created hypnotic rhythmic patterns.
duck	Water bird; waterfowl; quick lowering movement.	Wild duck swam gracefully across pond.
duckling	Young duck; baby duck; small duck.	Fluffy duckling followed mother everywhere obediently.
due	Debt; something owed; expected; owed.	Library book was overdue by weeks.
duke	Nobleman; high-ranking aristocrat; royal title.	Wealthy duke owned vast estate lands.
dump	Waste site; garbage place; act of dumping.	City dump processed tons of waste.
dumpling	Small ball of dough; stuffed pastry; steamed food.	Pork dumpling was grandmother's specialty recipe.
duration	Length of time; period; span; continuance.	Project duration exceeded original timeline estimates.
dust	Particles; dirt; powder; debris.	Thick dust covered abandoned furniture completely.
duty	Obligation; responsibility; tax; work.	Civic duty motivated active community participation.
dynamics	Forces; energy; motion; changing relationships.	Family dynamics changed after divorce proceedings.
dynasty	Ruling family; succession of rulers; royal line.	Ming dynasty ruled China for centuries.
each	Individual; every single one.	Each of the budget items required careful analysis.
eagle	Large bird of prey; symbol of power; raptor.	Majestic eagle soared above mountain peaks.
ear	Hearing organ; corn part; attention; sense.	Sharp ear detected subtle musical changes.
early	Beginning; dawn; before the usual time.	Early morning provided peaceful productive hours.
earth	Planet; soil; ground; world.	Rich earth supported abundant plant growth.
earthquake	Ground shaking; seismic activity; tremor.	Major earthquake damaged city infrastructure extensively.
east	Direction; orient; sunrise; region.	Sun rises every morning in east.
echo	Reflected sound; repetition; reverberation; imitation.	Mountain echo repeated shouted words clearly.
economics	Financial study; economic science; money matters.	Macroeconomics examines national financial systems comprehensively.
economy	Financial system; thrift; management; market.	National economy recovered from recession gradually.
edge	Border; sharp side; advantage; margin.	Knife edge required careful handling always.
edition	A particular version of a published text.	First edition book was extremely valuable.
editor	Person who edits; reviewer; publisher; journalist.	Newspaper editor reviewed articles before publication.
education	Learning; teaching; schooling; knowledge.	Quality education opened countless future opportunities.
eel	Snake-like fish; elongated aquatic creature.	Electric eel generated powerful defensive shocks.
effect	Result; consequence; impact; influence.	Medication effect reduced patient symptoms significantly.
effectiveness	The degree to which something succeeds.	Treatment effectiveness exceeded medical expectations completely.
efficiency	The state of achieving maximum productivity.	Energy efficiency reduced monthly utility costs.
effort	Attempt; work; energy; endeavor.	Team effort accomplished seemingly impossible project.
egg	Oval reproductive body; bird egg; ovum.	Farm-fresh egg provided protein-rich breakfast nutrition.
ego	Self; pride; self-esteem; personality.	Inflated ego prevented honest self-reflection opportunities.
eight	The number eight; the digit 8; a quantity of eight items.	Lucky number eight brought gambling fortune.
either	Alternative; one or the other; any one of two.	Difficult choice offered no clear winner.
elbow	Arm joint; bend; corner; nudge.	Tennis elbow caused persistent chronic pain.
election	Voting; choice; campaign; democracy.	Presidential election determined nation's future direction.
electricity	Electrical power; electric energy; current.	Storm disrupted neighborhood electricity for hours.
electronics	Electronic devices; technology; circuits; gadgets.	Consumer electronics advanced rapidly each year.
element	Component; part; substance; factor.	Key element determined project success completely.
elephant	Large mammal; tusked animal; pachyderm.	African elephant wandered across savanna peacefully.
elevator	Lift; vertical transport; moving platform.	Broken elevator forced stair climbing exercise.
elimination	The complete removal of something.	Waste elimination improved production efficiency significantly.
email	Electronic mail sent over the internet.	Urgent email required immediate response attention.
emergency	A serious unexpected situation.	Medical emergency required immediate hospital transport.
emission	The production and discharge of something.	Carbon emission contributed to climate change.
emotion	Feeling; sentiment; passion; mood.	Overwhelming emotion brought tears of joy.
emperor	Supreme ruler; monarch; sovereign; imperial leader.	Roman emperor conquered vast territorial expanses.
emphasis	Stress; importance; highlight; accent.	Special emphasis highlighted critical project requirements.
empire	Large territory; dominion; realm; kingdom.	British empire spanned multiple continents historically.
employee	Worker; staff; personnel; member.	Dedicated employee received promotion recognition reward.
employer	Boss; company; person who hires; manager.	Fair employer provided excellent benefits.
employment	Work; job; hiring; occupation.	Full-time employment provided financial stability security.
end	End; conclusion; finish; death.	Movie end surprised audience with twist.
ending	Conclusion; finale; termination; completion.	Happy ending satisfied romantic story expectations.
endowment	Natural ability; donated money.	University endowment funded scholarship programs generously.
endurance	Ability to withstand hardship.	Physical endurance improved with consistent training.
enemy	Foe; opponent; adversary; rival.	Former enemy became trusted ally eventually.
energy	Power; force; vigor; strength.	Renewable energy reduced environmental pollution significantly.
enforcement	Act of ensuring compliance.	Law enforcement maintained community safety standards.
engagement	Commitment; betrothal; involvement; participation.	Community engagement improved local government transparency.
engineer	Technical expert; designer; builder; mechanic.	Software engineer developed innovative mobile applications.
England	Country in Britain.	Historic England preserved ancient cultural landmarks.
English	Language of England.	Modern English evolved from medieval origins.
enjoyment	Pleasure; fun; satisfaction; delight.	Music enjoyment enhanced quality of life.
enlargement	Process of making bigger.	Photo enlargement revealed hidden details clearly.
enlightenment	Spiritual insight; intellectual movement.	Age of enlightenment transformed European thought.
enrollment	Act of registering.	College enrollment increased dramatically this year.
ensemble	Group performing together.	String ensemble performed classical music beautifully.
entail	Involve as necessary consequence.	Project completion will entail overtime work.
enterprise	Business; company; venture; undertaking.	Successful enterprise created numerous employment opportunities.
entertainment	Amusement; show; recreation; fun.	Live entertainment drew large weekend crowds.
enthusiasm	Eagerness; passion; zeal; excitement.	Teacher's enthusiasm inspired student learning motivation.
entity	Being; organization; existence; thing.	Legal entity protected business owners personally.
entrance	Entry; doorway; admission; access.	Grand entrance impressed all visiting guests.
entry	Entrance; admission; record; item.	Diary entry recorded important life events.
environment	Surroundings; nature; conditions; setting.	Healthy environment supported children's development naturally.
envy	Resentful longing for others.	Petty envy poisoned workplace relationships permanently.
enzyme	Protein that catalyzes reactions.	Digestive enzyme broke down complex food.
epidemic	Widespread occurrence of disease.	Influenza epidemic affected entire school district.
episode	Event; TV show part; incident; occurrence.	Final episode concluded dramatic television series.
epoch	Distinctive period in history.	Victorian epoch transformed British society completely.
equality	Fairness; equal treatment; sameness; parity.	Gender equality advanced through persistent advocacy.
equation	Mathematical formula; balance; equality.	Algebra equation challenged advanced mathematics students.
equator	Imaginary line around Earth.	Tropical equator experiences consistent warm temperatures.
equipment	Tools; apparatus; gear; supplies.	Safety equipment protected workers from hazards.
equity	Fairness; ownership value.	Home equity increased significantly over years.
eraser	Tool for removing marks.	Pink eraser removed pencil mistakes cleanly.
erection	Building construction; physiological state.	Bridge erection required advanced engineering expertise.
error	Mistake; fault; wrong; inaccuracy.	Computer error caused data loss problems.
eruption	Sudden violent emission.	Volcanic eruption created spectacular light show.
escape	Flight; getting away; evasion; exit.	Daring escape plan succeeded against odds.
escort	Person accompanying another.	Security escort protected visiting diplomat safely.
essence	Intrinsic nature.	Vanilla essence enhanced dessert flavor naturally.
establishment	Institution; business; founding; organization.	Fine dining establishment attracted wealthy clientele.
estate	Property; land; inheritance; real estate.	Country estate featured beautiful landscaped gardens.
esteem	Respect and admiration.	High esteem reflected lifetime achievements recognition.
estimate	Approximation; guess; evaluation; assessment.	Cost estimate exceeded original budget projections.
estimation	Process of estimating.	Accurate estimation required careful data analysis.
eternal	Lasting forever.	Eternal love transcended time and space.
eternity	Infinite time; endless duration; time without beginning or end.	Waiting felt like endless eternity.
ethic	Moral principle.	Work ethic determined professional success outcomes.
etiquette	Conventional rules of behavior.	Proper etiquette impressed formal dinner guests.
euphemism	Mild expression for harsh reality.	Political euphemism softened controversial policy language.
euro	European currency.	Strong euro facilitated international trade relationships.
Europe	Continent north of Africa.	Medieval Europe experienced significant cultural transformation.
evacuation	Removal from dangerous place.	Emergency evacuation saved thousands of lives.
eve	Evening before; night before; twilight.	Christmas eve brought family together joyfully.
evening	Night time; dusk; twilight; eventide.	Quiet evening brought peaceful family relaxation.
event	Happening; occurrence; activity; incident.	Special event celebrated company's anniversary success.
evergreen	Plant keeping leaves year-round.	Pine evergreen provided year-round garden color.
everlasting	Lasting forever.	Everlasting friendship survived decades of change.
evidence	Proof; testimony; indication; sign.	Forensic evidence solved decade-old criminal case.
evil	Profound immorality.	Ancient evil threatened innocent village people.
evolution	Development; change; progress; transformation.	Human evolution spanned millions of years.
ex	A former romantic partner; an ex-boyfriend or ex-girlfriend.	Her friendly ex maintained a respectful and cordial relationship.
exaggeration	Overstatement of fact.	Wild exaggeration made story incredibly entertaining.
exam	Test; examination; assessment; evaluation.	Final exam determined semester grade completely.
examination	Test; inspection; checkup; scrutiny.	Medical examination revealed underlying health issues.
example	Sample; instance; illustration; model.	Perfect example demonstrated complex mathematical concepts.
exception	Exclusion; special case; deviation; anomaly.	Rare exception proved general rule validity.
excess	Amount beyond normal.	Sugar excess contributed to health problems.
exchange	Trade; swap; conversion; market.	Currency exchange facilitated international business transactions.
excitement	Thrill; arousal; stimulation; enthusiasm.	Childhood excitement made birthdays magical experiences.
exclamation	Sudden cry expressing emotion.	Loud exclamation startled quiet library patrons.
excursion	Short journey for pleasure.	Weekend excursion explored nearby historical sites.
excuse	Reason; justification; apology; pretext.	Weak excuse failed to convince skeptical.
execution	Carrying out; performance; death penalty; implementation.	Flawless execution impressed demanding client completely.
executive	Manager; leader; administrator; officer.	Senior executive guided company through crisis.
exemption	Process of being freed.	Tax exemption saved nonprofit organization money.
exercise	Physical activity; practice; training; drill.	Daily exercise improved cardiovascular health significantly.
exertion	Physical or mental effort.	Intense exertion left athlete completely exhausted.
exhaust	Waste gases from engine.	Car exhaust polluted urban air quality.
exhibition	Display; show; exposition; demonstration.	Art exhibition showcased contemporary local artists.
exile	State of being banished.	Political exile lasted twenty difficult years.
existence	Being; presence; life; reality.	Human existence involves constant learning growth.
exodus	Mass departure; large-scale migration or evacuation of people.	Biblical exodus shaped religious cultural identity.
expanse	Wide continuous area.	Vast desert expanse stretched beyond horizon.
