en	meaning_en	example_en
project	An individual or collaborative enterprise.	Science project demonstrated renewable energy principles.
projection	An estimate based on present trends.	Weather projection predicted week-long rainfall period.
prominence	State of being important or famous; conspicuousness; high position.	Mountain prominence dominated surrounding landscape dramatically.
promise	A declaration that one will do something.	Wedding promise bound couple together forever.
promotion	Activity that supports the growth of something.	Job promotion recognized exceptional performance achievements.
pronunciation	The way words are spoken; articulation; manner of speech.	Correct pronunciation improved language learning success.
proof	Evidence that establishes a fact.	DNA proof confirmed suspect's guilt conclusively.
propaganda	Information used to promote a political cause.	War propaganda influenced public opinion strongly.
property	A thing or things belonging to someone.	Rental property generated steady monthly income.
prophecy	A prediction of future events; divine revelation; foretelling.	Ancient prophecy predicted catastrophic natural disaster.
proportion	A part considered in relation to the whole.	Architectural proportion created harmonious building design.
proposal	A plan or suggestion put forward.	Marriage proposal surprised unsuspecting romantic partner.
proposition	A statement or assertion; proposal; offer; undertaking.	Business proposition offered profitable investment opportunity.
propriety	Conformity to accepted standards; appropriateness; correctness of behavior.	Social propriety governed Victorian era manners.
prose	Written language in ordinary form.	Beautiful prose captured reader's imagination completely.
prosecution	Legal proceedings against defendant; pursuit of legal case.	Criminal prosecution sought maximum sentence penalty.
prosecutor	Legal official who conducts prosecution; district attorney.	Experienced prosecutor presented compelling evidence today.
prospect	The possibility of something happening.	Job prospect improved after advanced degree.
prosperity	The state of being prosperous.	Economic prosperity lifted living standards significantly.
protection	The action of protecting someone or something.	Environmental protection preserved wildlife habitat successfully.
protectionism	Economic policy of restricting imports; trade protection; isolationism.	Trade protectionism shielded domestic industries effectively.
protector	One who protects; guardian; defender; safeguard device.	Screen protector prevented smartphone display damage.
protest	A statement of dissent or disapproval.	Peaceful protest demanded social justice reform.
province	A principal administrative division.	Canadian province implemented new taxation policies.
provision	The action of providing something.	Food provision sustained expedition members safely.
psychology	The scientific study of mind and behavior.	Cognitive psychology explained human learning processes.
public	Ordinary people in general.	Concerned public demanded government accountability transparency.
publication	A book or article made available to public.	Scientific publication presented groundbreaking research findings.
punch	A blow with the fist.	Boxing punch knocked opponent down.
purchase	The action of buying something.	Online purchase arrived faster than expected.
purpose	The reason for which something exists.	Life purpose motivated daily actions consistently.
pursuit	The action of following or chasing.	Police pursuit ended with arrest tonight.
quality	The standard of something measured.	Product quality exceeded customer expectations significantly.
quantity	The amount or number of something.	Food quantity satisfied entire family gathering.
quarter	Each of four equal parts.	Business quarter showed improved financial performance.
queen	The female ruler of an independent state.	British queen celebrated platinum jubilee magnificently.
question	A sentence worded to elicit information.	Difficult question challenged student's understanding deeply.
race	A competition of speed or endurance.	Marathon race tested runner's endurance limits.
radio	Equipment for receiving programs.	Vintage radio played classical music softly.
rain	Water falling from clouds.	Summer rain refreshed drought-stricken garden beautifully.
range	The area of variation between limits.	Mountain range stretched across entire horizon.
rank	A position in the hierarchy of armed forces.	Military rank determined command responsibility level.
rate	A measure expressing a relation.	Interest rate affected mortgage payment amounts.
ratio	The quantitative relation between two amounts.	Golden ratio appeared in natural patterns.
reach	The extent or range.	Internet reach connected global audiences instantly.
reaction	An action performed in response to something.	Chemical reaction produced colorful explosive display.
reading	The action of reading written or printed matter.	Evening reading provided relaxing bedtime routine.
ready	Prepared for action; willing; available; in suitable condition.	The troops were at the ready for immediate deployment.
real	Reality; genuine thing; actual; genuine.	Bitter real shattered childhood dreams and fantasies.
reality	The world or state of things as they exist.	Virtual reality transformed gaming entertainment completely.
realization	The act of becoming aware; achievement of goal; understanding.	Sudden realization revealed hidden truth finally.
rear	The back part; to bring up children; to rise up on hind legs.	Car rear sustained damage during collision.
reason	A cause, explanation, or justification.	Valid reason explained unexpected absence today.
rebate	A partial refund; discount; money returned after payment.	Manufacturer rebate reduced appliance purchase cost.
rebellion	An act of violent resistance to authority.	Teenage rebellion challenged parental authority directly.
recall	To remember; to bring back; official order to return defective products.	Product recall addressed serious safety concerns.
receipt	A written acknowledgment of payment.	Store receipt confirmed warranty coverage terms.
receiver	A person who receives something; part of telephone; radio equipment.	Football receiver caught touchdown pass perfectly.
reception	The action of receiving something.	Wedding reception celebrated marriage joyfully tonight.
receptor	A structure that responds to stimuli; nerve ending; cellular component.	Pain receptor transmitted warning signals immediately.
recess	A break between sessions; alcove; temporary cessation; school break.	School recess allowed children outdoor play.
recession	A period of economic decline; withdrawal; temporary depression.	Economic recession affected employment rates nationwide.
recitation	The action of reciting; oral delivery; repetition from memory.	Poetry recitation demonstrated student's memorization skills.
recognition	Identification of someone or something.	Facial recognition unlocked smartphone security system.
recollection	The action of remembering; memory; recalled experience.	Vague recollection suggested childhood summer vacation.
recommendation	A suggestion that something is good.	Doctor recommendation led to specialist consultation.
reconnaissance	Military observation of enemy; preliminary survey; scouting.	Aerial reconnaissance revealed enemy troop movements.
reconstruction	The action of rebuilding; restoration; recreation of past events.	Post-war reconstruction rebuilt devastated city infrastructure.
record	A thing constituting evidence about past.	Medical record documented patient's treatment history.
recourse	A source of help; legal remedy; resort to something for assistance.	Legal recourse protected tenant rights effectively.
recovery	A return to a normal state of health.	Full recovery required months of rehabilitation.
recreation	Activity done for enjoyment.	Outdoor recreation provided healthy stress relief.
red	The color red; blood color; danger signal; communist.	Bright red signaled immediate danger warning.
reduction	The action of making something smaller.	Cost reduction improved company profit margins.
redundancy	The state of being no longer needed; job loss; unnecessary duplication.	Mass redundancy affected hundreds of employees.
redwood	A very tall coniferous tree; the wood from this tree; reddish timber.	Giant redwood towered above forest canopy.
reed	A tall grass-like plant; thin strip in musical instruments; marsh plant.	Clarinet reed produced beautiful musical tones.
reference	The action of mentioning something.	Job reference confirmed candidate's excellent performance.
refinement	The process of purifying; elegance; improvement; sophistication.	Oil refinement produced gasoline from crude.
reflection	The throwing back of light or heat.	Mirror reflection showed morning appearance clearly.
reflex	Automatic response to stimulus; instinctive reaction; quick response.	Knee reflex tested neurological function accurately.
reform	The action of reforming an institution.	Educational reform improved student achievement significantly.
refraction	Bending of light when passing through different medium; deflection.	Light refraction created rainbow spectrum beautifully.
refreshment	Light snack or drink; the giving of fresh strength; revitalization.	Afternoon refreshment energized tired conference attendees.
refuge	Shelter from danger; place of safety; wildlife sanctuary.	Mountain refuge provided shelter during storm.
refugee	A person who has fled their country.	War refugee sought asylum in neighboring.
refusal	The indication of being unwilling to do something.	Polite refusal declined unwanted dinner invitation.
regard	Consideration or concern for something.	Mutual regard strengthened professional working relationship.
regime	A government or system of rule.	Military regime controlled country for decades.
regiment	A military unit; to organize strictly; systematic training.	Infantry regiment prepared for overseas deployment.
region	An area or division with definable characteristics.	Mountainous region attracted adventurous hiking enthusiasts.
register	Official list or record; to record formally; cash machine.	Voter register documented eligible citizen names.
registration	The action of recording or enrolling.	Course registration required early online submission.
registry	A place where records are kept; official list; registration office.	Wedding registry contained gift preferences carefully.
regret	A feeling of sadness about something.	Deep regret followed hasty decision making.
regulation	A rule made by an authority.	Safety regulation prevented workplace accidents effectively.
rehabilitation	Process of restoration to normal life; recovery program; restoration.	Drug rehabilitation program restored healthy lifestyle.
rehearsal	A practice performance of a play.	Dress rehearsal prepared cast for opening.
reign	The period during which a monarch rules.	Peaceful reign brought prosperity to kingdom.
reimbursement	Repayment of expenses; compensation; refund of money spent.	Expense reimbursement covered business travel costs.
reindeer	Large deer of Arctic regions; caribou; Christmas animal symbol.	Santa's reindeer delivered presents worldwide magically.
reinforcement	Additional support or strengthening; extra troops; strengthening material.	Steel reinforcement strengthened concrete foundation significantly.
rejection	The dismissing of a proposal or idea.	Job rejection motivated career improvement efforts.
relation	The way in which things are connected.	Family relation traced ancestry back centuries.
relationship	The way two people or groups regard each other.	Healthy relationship required mutual trust daily.
relative	A person connected by blood or marriage.	Distant relative attended family reunion celebration.
relaxation	The state of being free from tension.	Deep relaxation followed stressful workweek successfully.
relay	A race between teams of runners.	Olympic relay broke previous world record.
release	The action of setting someone free.	Prisoner release followed legal appeal victory.
reliance	Dependence on something; trust; confidence in something.	Complete reliance created unhealthy dependency relationship.
relic	Object from the past; remains; historical artifact; remnant.	Ancient relic revealed civilization's cultural practices.
relief	A feeling of reassurance and relaxation.	Immediate relief followed successful surgery completion.
religion	The belief in a superhuman power.	Organized religion provided community spiritual guidance.
relish	Great enjoyment or a condiment.	Spicy relish enhanced hamburger flavor perfectly.
relocation	Movement to new location; the act of moving; transfer.	Job relocation required family lifestyle adjustment.
remain	To stay; what is left; to continue to exist.	Archaeological remain revealed ancient settlement patterns.
remainder	Part left over; what remains; surplus; leftover amount.	Math remainder challenged elementary school students.
remark	A comment or observation; to say something; notable point.	Casual remark sparked heated political debate.
remedy	A medicine or treatment for a disease.	Herbal remedy provided natural healing alternative.
remembrance	Memory of person or event; act of remembering; memorial.	War remembrance honored fallen soldiers sacrifice.
reminiscence	Enjoyable memory of past; recollection; nostalgic thinking.	Childhood reminiscence brought warm happy feelings.
remnant	Small remaining part; leftover piece; remainder.	Fabric remnant created beautiful patchwork quilt.
remuneration	Payment for services; compensation; salary; reward.	Fair remuneration attracted skilled professional candidates.
Renaissance	The revival of art and literature.	The Italian Renaissance produced magnificent artistic masterpieces.
rendezvous	A meeting at agreed time and place; appointment; to meet.	Secret rendezvous occurred at midnight bridge.
renewal	The act of extending validity; restoration; fresh start.	Spring renewal brought hope after winter.
renown	Fame; widespread reputation; celebrity status.	International renown followed Nobel Prize victory.
rental	Payment for use of property; rented item; lease fee.	Car rental provided vacation transportation convenience.
repair	The action of fixing something.	Roof repair prevented further water damage.
repayment	The action of paying back; return of money borrowed.	Loan repayment required monthly budget planning.
repetition	The action of repeating; doing again; recurring event.	Daily repetition improved piano playing skills.
replacement	The action of replacing someone or something.	Part replacement restored machine functionality completely.
reply	A verbal or written answer.	Prompt reply confirmed meeting attendance today.
report	An account given of a particular matter.	Weather report predicted afternoon thunderstorms accurately.
reporter	Person who reports news; journalist; correspondent.	Investigative reporter exposed government corruption scandal.
repose	Rest or sleep; peaceful state; to rest; tranquility.	Afternoon repose refreshed tired mind completely.
representation	The description of someone in a particular way.	Legal representation ensured fair trial proceedings.
representative	A person chosen to act for others.	Union representative negotiated better working conditions.
repression	The action of suppressing; restraint; psychological blocking.	Political repression silenced opposition voices completely.
reproach	Expression of disapproval; criticism; to express disapproval.	Gentle reproach corrected child's misbehavior kindly.
reproduction	Production of offspring; copy of something; biological process.	Animal reproduction ensures species survival naturally.
reptile	Cold-blooded vertebrate animal; snake, lizard, or turtle; scaly animal.	Desert reptile adapted to extreme temperatures.
republic	Government by elected representatives; state without monarch.	Democratic republic protected citizens' voting rights.
republican	Supporting republic form of government; member of Republican Party.	Lifelong republican supported conservative political values.
reputation	The beliefs held about someone.	Professional reputation required years of excellence.
request	An act of asking politely for something.	Urgent request demanded immediate management attention.
research	The systematic investigation of materials.	Medical research discovered breakthrough cancer treatment.
reservation	The action of reserving something.	Dinner reservation secured popular restaurant table.
reserve	A supply of something kept for future use.	Emergency reserve provided financial security backup.
resident	A person who lives somewhere permanently.	Longtime resident remembered neighborhood history fondly.
resolution	A firm decision to do something.	New year resolution focused on health.
resource	A stock or supply that can be drawn on.	Natural resource required sustainable management practices.
respect	A feeling of deep admiration.	Mutual respect strengthened workplace relationships significantly.
response	A reaction to something.	Quick response prevented emergency situation escalation.
responsibility	The state of being responsible for something.	Parental responsibility required constant vigilant attention.
rest	Cease work or movement in order to relax.	Weekend rest restored energy after exhaustion.
restaurant	A place where people pay to sit and eat.	Fine restaurant served exceptional cuisine nightly.
result	A consequence, effect, or outcome.	Test result revealed unexpected medical condition.
retirement	The action of leaving one's job permanently.	Early retirement allowed travel dream pursuit.
return	An act of coming or going back.	Safe return relieved worried family members.
revenue	Income generated by a business.	Annual revenue exceeded projected financial targets.
review	A formal assessment or examination.	Movie review influenced weekend entertainment choices.
revolution	A forcible overthrow of a government.	French revolution changed European political landscape.
reward	A thing given in recognition of service.	Cash reward motivated employee performance improvement.
rice	A cereal grain that is the seed of grass.	Brown rice provided nutritious dinner foundation.
ride	A journey made on a horse, vehicle, etc.	The scenic ride revealed beautiful mountain landscapes.
ring	A circular band worn as ornament.	Wedding ring symbolized eternal love commitment.
risk	A situation involving exposure to danger.	Financial risk required careful investment planning.
river	A large natural stream of water.	Mighty river carved canyon through rock.
road	A wide way leading from one place to another.	Winding road led through forest hills.
rock	The hard mineral material of the earth.	Granite rock formed mountain peak foundation.
role	An actor's part in a play or film.	Leading role launched successful acting career.
room	A space that can be occupied.	Sunny room overlooked beautiful garden view.
root	The part of plant normally below ground.	Tree root extended deep into soil.
row	A number of people standing in a line.	Front row provided excellent concert visibility.
rugby	A team sport played with oval ball; contact sport; English school origin game.	Rugby match featured intense physical competition.
ruin	The remains of destroyed building.	Ancient ruin revealed historical architectural secrets.
rule	One of a set of explicit regulations.	Safety rule prevented workplace injuries effectively.
ruler	A person exercising government or dominion.	Wise ruler governed kingdom justly.
ruling	Official decision; judgment by court; governing; controlling.	Court ruling established important legal precedent.
rumble	Deep rolling sound; to make such sound; street fight; continuous noise.	Thunder rumble warned of approaching storm.
run	An act or spell of running.	Morning run energized body for day.
runner	Person who runs; athlete; messenger; sliding part; carpet strip.	Marathon runner crossed finish line triumphantly.
rupture	Breaking or bursting; hernia; to break apart; breach in relations.	Muscle rupture required immediate surgical repair.
rush	A sudden quick movement toward something.	Morning rush created heavy traffic congestion.
Russian	A person from Russia; the Russian language; relating to Russia.	Native russian taught language classes fluently.
rustle	Soft crackling sound; to make such sound; to steal cattle; to obtain.	Leaf rustle created peaceful forest soundtrack.
rye	A cereal grain; whiskey made from rye; grass grown for grain.	Rye bread provided hearty sandwich foundation.
sack	A large bag made of hessian.	Potato sack stored garden harvest efficiently.
sacrifice	An act of giving up something valued.	Parental sacrifice ensured children's college education.
saddle	A seat fastened on the back of horse.	Leather saddle provided comfortable riding support.
sadness	Feeling of sorrow; unhappiness; dejection; melancholy state.	Deep sadness followed unexpected pet loss.
safety	The condition of being protected from danger.	Workplace safety prevented industrial accidents effectively.
sage	Wise person; aromatic herb; very wise; experienced advisor.	Ancient sage provided valuable life wisdom.
sail	A piece of material extended to catch wind.	White sail captured ocean breeze perfectly.
sailing	The activity of traveling by boat; sport of boat racing; navigation.	Ocean sailing offered peaceful weekend escape.
sailor	Person who works on ship; mariner; naval person; seafarer.	Experienced sailor navigated treacherous waters safely.
saint	A person acknowledged as holy.	Catholic saint inspired millions through charity.
sake	Purpose; benefit; rice wine; reason.	Warm sake complemented sushi dinner perfectly.
salad	A cold dish of mixed raw vegetables.	Caesar salad provided healthy lunch option.
salary	A fixed regular payment.	Competitive salary attracted qualified job candidates.
sale	The exchange of a commodity for money.	Garage sale cleared unwanted household items.
sales	The activity of selling; amount sold; marketing department; revenue.	Monthly sales exceeded quarterly targets successfully.
salesman	A man whose job involves selling.	Experienced salesman closed deals consistently daily.
salmon	A large fish that lives in both fresh and salt water.	Grilled salmon provided healthy omega-3 nutrients.
salon	An establishment where a hairdresser works.	Upscale salon offered luxury beauty treatments.
salt	A white crystalline substance.	Sea salt enhanced vegetable flavor naturally.
salvation	Deliverance from sin and its consequences.	Spiritual salvation brought inner peace finally.
samosa	Fried pastry with savory filling; Indian snack food; triangular pastry.	Spicy samosa satisfied afternoon hunger perfectly.
samurai	Japanese warrior class; feudal military nobility; honor-bound fighter.	Honorable samurai served feudal lord faithfully.
sanction	Official permission; penalty imposed by law; to approve; punitive measure.	Economic sanction restricted international trade severely.
sanctuary	Sacred place; refuge for wildlife; place of safety; holy area.	Wildlife sanctuary protected endangered species successfully.
sand	Loose granular substance.	White sand created beautiful beach landscape.
sandal	Open shoe held by straps; light footwear; summer shoe.	Leather sandal provided comfortable summer footwear.
sandwich	Two pieces of bread with filling.	Turkey sandwich satisfied lunchtime hunger completely.
sandy	Covered with sand; sandy color; gritty texture; resembling sand.	Beach sandy felt warm beneath bare summer feet.
sap	Fluid in plants; to weaken gradually; vital fluid; foolish person.	Maple sap produced delicious natural syrup.
sapphire	Blue precious gemstone; bright blue color; valuable crystal.	Rare sapphire adorned royal crown magnificently.
sarcasm	Ironic or mocking language; bitter wit; scornful remarks.	Sharp sarcasm concealed underlying hurt feelings.
sardine	Small oily fish; canned fish; crowded together like sardines.	Canned sardine provided convenient protein source.
satellite	An artificial body placed in orbit around earth.	Communication satellite transmitted global television signals.
satire	Literary work exposing vice; mockery; ironic criticism; humorous attack.	Political satire exposed government corruption cleverly.
satisfaction	Fulfillment of one's wishes or needs.	Job satisfaction improved workplace productivity significantly.
Saturday	The seventh day of the week; weekend day; day before Sunday.	Lazy Saturday provided much-needed relaxation time.
saturn	Sixth planet from Sun with rings; Roman god of agriculture.	Beautiful saturn displayed magnificent ring system.
sauce	A liquid condiment or dressing for food.	Tomato sauce enhanced pasta flavor perfectly.
sausage	Minced meat enclosed in a cylindrical case.	Spicy sausage added flavor to pizza.
saving	Money kept; preservation; economy; rescue.	Regular saving accumulated substantial retirement fund.
savior	Person who saves others; rescuer; Christ in Christianity; deliverer.	Heroic savior rescued drowning child bravely.
savor	To taste and enjoy; distinctive flavor; to appreciate; to relish.	Chocolate savor lingered pleasantly after dessert.
say	To speak words; to state; opportunity to express opinion; utterance.	Final say determined project direction completely.
scale	A range of values forming a standard system.	Richter scale measured earthquake intensity accurately.
scan	To examine closely; to read quickly; medical imaging; to survey.	MRI scan revealed brain tumor location.
scandal	An action or event causing general public outrage.	Political scandal dominated newspaper headlines today.
scar	A mark left on the skin by a healed wound.	Surgical scar marked childhood appendectomy site.
scarcity	State of being scarce; shortage; rarity; insufficiency.	Water scarcity threatened desert community survival.
