en	meaning_en	example_en
vacation	Holiday; break; rest; time off.	Summer vacation created lasting family memories.
vaccine	Medicine preventing disease; immunization; protective injection.	Childhood vaccine prevented serious disease outbreaks.
vacuum	Empty space; cleaning device; absence of matter.	Powerful vacuum removed embedded carpet dirt.
validity	State of being valid; truthfulness; legitimacy; soundness.	Document validity required official verification process.
valley	Low land; depression; basin; hollow.	Fertile valley supported agricultural communities.
valuation	Assessment of worth; appraisal; estimation; value determination.	Property valuation exceeded initial expectations greatly.
value	Worth; importance; price; principle.	Core value guided ethical business decisions.
van	Vehicle for transport; moving truck; delivery vehicle.	Delivery van transported packages across town.
vanilla	Flavoring spice; ice cream flavor; plant extract; plain.	Pure vanilla extract enhanced dessert flavor.
vanity	Excessive pride; conceit; futility; dressing table.	Antique vanity contained grandmother's jewelry collection.
vapor	Gas form of liquid; steam; mist; evaporated substance.	Water vapor formed clouds overhead.
variation	Difference; change; modification; alternate version.	Slight variation improved product performance significantly.
variety	Diversity; assortment; type; range.	Wide variety satisfied different customer preferences.
varnish	Protective coating; wood finish; to apply coating; gloss.	Clear varnish preserved wood's natural beauty.
vase	Container for flowers; decorative vessel; ornamental pot.	Crystal vase displayed roses beautifully.
vault	Secure room; underground chamber; to jump over; bank safe.	Bank vault contained valuable customer deposits.
vegetable	Edible plant; plant food; garden produce; green food.	Fresh vegetable salad provided healthy nutrition.
vegetation	Plant life; flora; plant growth; plant cover.	Lush vegetation thrived in tropical climate.
veil	Face covering; thin fabric; to cover; concealment.	Delicate veil completed bridal ensemble perfectly.
vein	Blood vessel; mineral deposit; distinctive quality; streak.	Gold vein discovery sparked mining rush.
velocity	Speed; rate of movement; swiftness; pace.	Wind velocity exceeded hurricane strength levels.
vendor	Seller; person selling goods; merchant; supplier.	Street vendor sold fresh fruit daily.
vengeance	Revenge; retaliation; punishment for wrong; payback.	Bitter vengeance consumed his thoughts completely.
venture	Business undertaking; risky project; to dare; enterprise.	Bold venture revolutionized online shopping experience.
venus	Second planet from sun; Roman goddess; morning star.	Bright venus appeared before sunrise daily.
verdict	Jury decision; judgment; conclusion; finding.	Unanimous verdict ended lengthy court trial.
verse	Poetry line; stanza; biblical passage; rhythmic writing.	Memorized verse provided daily spiritual guidance.
vertebra	Spine bone; backbone segment; spinal column unit.	Damaged vertebra caused severe back pain.
vest	Sleeveless garment; waistcoat; to give authority; undergarment.	Bulletproof vest protected officer during patrol.
veteran	Former soldier; experienced person; ex-military; old hand.	War veteran shared powerful personal stories.
veto	Power to reject; to refuse approval; prohibition; ban.	Presidential veto blocked controversial legislation immediately.
vibe	Feeling; atmosphere; mood; emotional sense.	Positive vibe filled room during celebration.
vibration	Shaking movement; oscillation; trembling; wave motion.	Constant vibration indicated mechanical problem developing.
vice	Bad habit; moral fault; gripping tool; deputy position.	Workshop vice held wood pieces firmly.
vicinity	Nearby area; neighborhood; surrounding region; proximity.	School vicinity enforced strict speed limits.
victim	Sufferer; casualty; prey; target.	Crime victim received counseling support services.
victor	Winner; champion; conqueror; successful person.	Gracious victor congratulated defeated opponents respectfully.
victory	Success in battle; triumph; winning; conquest.	Unexpected victory energized entire team morale.
video	Recording; film; visual; television.	Viral video reached millions within hours.
videoconference	Remote meeting via video; online conference; virtual meeting.	International videoconference connected global teams efficiently.
view	Sight; opinion; scene; perspective.	Panoramic view stretched across mountain valley.
village	Small town; community; settlement; hamlet.	Quaint village attracted tourists seeking tranquility.
villain	Bad person; criminal; evil character; antagonist.	Movie villain revealed surprising backstory twist.
vine	Climbing plant; grape plant; trailing plant; creeper.	Ivy vine covered old brick wall.
vinegar	Sour liquid; acidic condiment; preservative; cooking ingredient.	Balsamic vinegar enhanced salad flavor dramatically.
vineyard	Grape growing area; winery land; wine production site.	Family vineyard produced award-winning wines annually.
vintage	Wine year; old and valuable; classic style; aged quality.	Rare vintage commanded premium auction price.
viola	String musical instrument; flower; larger violin; purple flower.	Orchestra viola section provided rich harmonies.
violation	Breaking of rule; infringement; transgression; breach.	Traffic violation resulted in expensive fine.
violence	Physical force; aggression; brutality; harmful behavior.	Domestic violence required immediate intervention services.
violet	Purple flower; purple color; bluish-purple shade.	Delicate violet bloomed early in spring.
violin	String musical instrument; fiddle; bowed instrument.	Antique violin produced exceptionally warm tones.
violinist	Person who plays violin; violin player; string musician.	Talented violinist performed complex concerto flawlessly.
virgin	Person who has never had sex; pure; untouched; new.	Pristine virgin wilderness preserved natural ecosystem balance.
Virginia	US state; eastern state; historical state; tobacco region.	Historic Virginia preserved colonial architecture beautifully.
virtue	Moral goodness; good quality; merit; righteousness.	Patience virtue helped during difficult times.
virus	Infection; disease; computer malware; pathogen.	Computer virus corrupted important system files.
visa	Travel permit; entry authorization; official endorsement.	Tourist visa allowed three-month stay abroad.
visibility	Ability to see; clarity; how far one can see; prominence.	Poor visibility delayed numerous flights today.
vision	Sight; dream; goal; foresight.	Clear vision guided company expansion plans.
visitor	Person who visits; guest; tourist; caller.	Foreign visitor explored local cultural sites.
vital	Essential; important for life; crucial; necessary.	Steady vital signs indicated patient recovery.
vitamin	Nutrient for health; dietary supplement; essential compound.	Daily vitamin supplement improved overall health.
vocabulary	Words known; word collection; language knowledge; lexicon.	Extensive vocabulary enhanced written communication skills.
vocation	Occupation; calling; profession; career; job.	Teaching vocation required patience and dedication.
vogue	Fashion; popular style; trend; current mode.	Current vogue favored minimalist design aesthetic.
voice	Sound; speech; opinion; expression.	Powerful voice commanded immediate attention.
void	Emptiness; empty space; invalid; null.	Eerie void filled abandoned warehouse completely.
volcano	Mountain with molten rock; geological formation; erupting landform.	Active volcano threatened nearby villages constantly.
volley	Series of shots; tennis shot; simultaneous discharge; barrage.	Quick volley won decisive tennis point.
volleyball	Team sport with net; ball game; court sport; six-player game.	Beach volleyball tournament attracted skilled athletes.
volt	Unit of electrical potential; electrical measurement; power unit.	Standard volt measured electrical circuit strength.
voltage	Electrical pressure; electric potential difference; power level.	High voltage powered industrial machinery safely.
volume	Amount; book; sound level; capacity.	Large volume contained complete poetry collection.
volunteer	Person who offers help freely; to offer service; unpaid helper.	Dedicated volunteer organized community food drive.
vomit	To expel stomach contents; throw up; sick feeling; regurgitation.	Sudden vomit indicated food poisoning symptoms.
vortex	Whirling mass; spiral motion; whirlpool; rotating flow.	Water vortex formed in draining bathtub.
vote	Ballot; choice; election; decision.	Decisive vote determined election outcome finally.
voucher	Certificate for goods; discount coupon; receipt; payment proof.	Gift voucher provided shopping flexibility.
vow	Solemn promise; pledge; marriage promise; commitment.	Wedding vow expressed eternal love commitment.
voyage	Long journey by sea; trip; expedition; ocean travel.	Maiden voyage tested ship's seaworthiness thoroughly.
wade	To walk through water; to proceed slowly; shallow water walking.	Children loved to wade through creek.
wage	Salary; pay; earnings; compensation.	Minimum wage increase helped struggling families.
wail	Loud cry of pain; to cry loudly; mourning sound; lament.	Mournful wail echoed through empty halls.
waist	Part of body between ribs and hips; narrow part; middle section.	Belt around waist held pants securely.
wait	Delay; pause; expectation; staying.	Long wait tested everyone's patience considerably.
waiter	Male restaurant server; person serving food; dining attendant.	Friendly waiter recommended excellent wine pairing.
waitress	Female restaurant server; woman serving food; dining attendant.	Experienced waitress memorized complex orders easily.
walk	Stroll; path; gait; journey.	Morning walk improved both health and mood.
wall	Barrier; partition; structure; boundary.	Stone wall protected garden from wind.
wallet	Small case for money; billfold; purse; card holder.	Leather wallet contained important identification documents.
walnut	Edible nut; tree producing walnuts; brain-shaped nut; hardwood.	Black walnut created beautiful furniture finish.
waltz	Ballroom dance; three-beat music; to dance waltz; graceful dance.	Viennese waltz captivated ballroom audience.
wane	To decrease; decline; moon phase; to diminish.	Moon wane marked end of lunar cycle.
want	Desire; wish; need; requirement.	Basic want motivated personal achievement efforts.
war	War; conflict; battle; struggle.	Civil war divided families and communities.
ward	Hospital section; person under care; to guard; district.	Pediatric ward decorated with cheerful murals.
wardrobe	Collection of clothes; closet; clothing storage; costumes.	Winter wardrobe required significant storage space.
ware	Manufactured goods; pottery; products; merchandise.	Kitchen ware displayed attractively in showroom.
warfare	Armed fighting; military operations; combat; battle.	Modern warfare relies on technological advantage.
warm	Heat; comfortable temperature; moderately hot.	Gentle warm breeze carried spring fragrance.
warp	To bend out of shape; distortion; to twist; deformation.	Heat caused wood warp in storage.
warrant	Legal document; authorization; guarantee; to justify.	Search warrant authorized police investigation thoroughly.
warranty	Guarantee of quality; promise to repair; product assurance.	Extended warranty covered unexpected repair costs.
warrior	Fighter; soldier; person engaged in battle; combatant.	Brave warrior defended village from invaders.
warship	Military vessel; naval ship; armed ship; battle ship.	Powerful warship patrolled territorial waters constantly.
wartime	Period during war; time of conflict; war period.	Difficult wartime tested national unity greatly.
wash	Washing; cleaning process; laundry; cleansing.	Quick wash removed stubborn stains effectively.
washington	US state; capital city; first US president; northwestern state.	Rainy washington weather created lush forests.
wasp	Stinging insect; yellow and black insect; flying pest.	Angry wasp defended nest from intruders.
waste	Garbage; loss; squandering; refuse.	Recycling reduced household waste significantly.
watch	Timepiece; observation; guard; monitoring.	Antique watch passed through three generations.
water	Water; liquid; H2O; drink.	Clean water remains essential for survival.
watercolor	Paint mixed with water; painting technique; transparent paint.	Delicate watercolor captured sunset beauty perfectly.
waterfall	Water falling from height; cascade; natural water feature.	Majestic waterfall attracted thousands of tourists.
watermelon	Large green fruit; summer fruit; juicy red fruit; melon.	Sweet watermelon refreshed picnic guests.
waterproof	Resistant to water; impermeable; water-resistant; sealed.	Durable waterproof coating protected outdoor furniture.
watt	Unit of electrical power; power measurement; energy unit.	Sixty watt bulb illuminated small room.
wave	Water movement; gesture; vibration; surge.	Ocean wave crashed against rocky shoreline.
wavelength	Distance between wave peaks; radio frequency; light measurement.	Radio wavelength transmitted signals across ocean.
wax	Solid substance from bees; to polish; candle material.	Beeswax created natural furniture polish.
way	Method; path; manner; direction.	Innovative way solved complex engineering problem.
weakness	Frailty; flaw; vulnerability; defect.	Greatest weakness became source of strength.
wealth	Riches; prosperity; fortune; abundance.	Inherited wealth funded charitable foundation establishment.
weapon	Arm; tool of war; instrument; device.	Ancient weapon displayed in museum collection.
weather	Climate; conditions; atmosphere; temperature.	Unpredictable weather disrupted outdoor event plans.
wedding	Marriage ceremony; union; celebration; nuptials.	Beautiful wedding celebrated love between partners.
Wednesday	Third day of week; day after Tuesday; mid-week day.	Busy Wednesday marked middle of work week.
weed	Unwanted plant; to remove unwanted plants; marijuana.	Persistent weed required careful garden maintenance.
week	Week; seven days; period; cycle.	Busy week included meetings and deadlines.
weekday	Monday to Friday; working day; business day.	Typical weekday began with morning commute.
weekend	Saturday and Sunday; time off; leisure time.	Relaxing weekend recharged energy for work week.
weep	To cry; shed tears; to mourn; lament.	Quiet weep released accumulated emotional stress.
weight	Heaviness; mass; burden; importance.	Heavy weight required multiple people lifting.
weirdo	Strange person; odd individual; eccentric; unusual person.	Class weirdo became successful innovative entrepreneur.
welfare	Well-being; social assistance; health and happiness; aid.	Child welfare programs protected vulnerable youth.
west	Direction; region; occidental; sunset side.	American west attracted settlers with promise.
westward	Toward the west; in western direction; going west.	Pioneers traveled westward seeking new opportunities.
wet	Wetness; moisture; dampness; water.	Morning wet from dew covered garden plants.
whale	Large marine mammal; ocean giant; cetacean; massive sea creature.	Majestic whale breached surface near boat.
wheat	Cereal grain; bread ingredient; agricultural crop; golden grain.	Golden wheat fields stretched toward horizon.
wheel	Circular object; steering device; rotation; cycle.	Potter's wheel shaped clay into beautiful vessels.
wheelchair	Chair with wheels for disabled; mobility aid; medical equipment.	Modern wheelchair featured advanced electronic controls.
wheels	Multiple circular rolling objects; vehicle; car; transportation.	New wheels improved vehicle performance dramatically.
whelk	Marine snail; edible sea mollusk; spiral shell creature.	Fresh whelk served at seafood restaurants.
while	During the time; period of time; although; whereas.	Short while passed before results arrived.
whip	Flexible striking tool; to beat; to move quickly.	Circus performer cracked whip with precision timing.
whirl	To spin rapidly; rotating motion; swirl; rapid movement.	Dance whirl created colorful dress movement.
whirlwind	Spinning wind; tornado; very fast activity; chaotic situation.	Emotional whirlwind followed unexpected news announcement.
whiskey	Alcoholic drink; distilled spirit; amber liquor; strong drink.	Scottish whiskey aged twelve years in oak.
whisper	Soft quiet speech; to speak softly; gentle sound.	Quiet whisper carried secrets across room.
white	The color white; snow color; purity; brightness.	Pure white symbolized peace in many cultures.
wholesale	Selling in large quantities; bulk sales; trade sales.	Bulk wholesale prices reduced retail costs significantly.
why	For what reason; the reason; explanation; cause.	Persistent why from children tested parental patience daily.
widow	Woman whose husband died; bereaved wife; surviving spouse.	Young widow started new business after loss.
width	Distance from side to side; breadth; measurement across.	Road width determined traffic flow capacity.
wife	Married woman; spouse; partner; mate.	Dedicated wife supported family through difficult times.
wig	Artificial hair covering; hairpiece; false hair; head covering.	Theatrical wig transformed actor's appearance completely.
wild	Wilderness; nature; untamed; natural.	Protected wild areas preserve endangered species habitats.
will	Intention; document; determination; testament.	Legal will distributed assets among family members.
willow	Tree with drooping branches; flexible wood tree; graceful tree.	Weeping willow provided shade beside pond.
wince	To flinch from pain; grimace; involuntary reaction; recoil.	Visible wince revealed hidden injury pain.
wind	Air movement; breeze; breath; gas.	Strong wind toppled trees along coastal areas.
windfall	Unexpected gain; fallen fruit; lucky fortune; bonus.	Stock market windfall funded early retirement plans.
window	Opening; glass panel; opportunity; computer interface.	Large window flooded room with natural light.
wine	Alcoholic beverage; grape drink; fermented juice.	Vintage wine paired perfectly with aged cheese.
wink	To close one eye briefly; quick eye signal; hint; brief moment.	Playful wink signaled secret understanding between friends.
winner	Person who wins; champion; victor; successful person.	Lottery winner donated half to charity.
winter	Cold season; harsh time; dormant period.	Harsh winter tested everyone's resilience and preparation.
wintertime	Winter season; cold weather period; snowy months.	Cozy wintertime brought families together indoors.
wire	Metal thread; cable; telegram; connection.	Copper wire conducted electricity throughout building.
wireless	Without wires; radio communication; Wi-Fi; remote connection.	Fast wireless network enabled remote working.
wisconsin	US state; midwestern state; dairy state; Great Lakes state.	Rural wisconsin produces excellent cheese varieties.
wisdom	Deep knowledge; good judgment; intelligence; understanding.	Ancient wisdom guided modern ethical decisions.
wish	Desire; hope; want; aspiration.	Birthday wish came true unexpectedly that year.
wit	Quick humor; intelligence; clever speech; mental sharpness.	Sharp wit made her popular dinner guest.
witch	Person practicing magic; sorceress; magical woman; enchantress.	Friendly witch helped lost children find home.
witness	Person who sees event; to observe; testimony giver; spectator.	Reliable witness provided crucial court testimony.
woe	Great sorrow; distress; trouble; misfortune.	Financial woe plagued struggling small businesses.
wolf	Wild canine; pack hunter; predatory animal; fierce animal.	Lone wolf howled beneath full moon.
woman	Woman; female adult; lady; person.	Brave woman led civil rights movement.
wonder	Amazement; miracle; curiosity; marvel.	Childlike wonder filled museum visitors' faces.
wonton	Chinese dumpling; filled pasta; Asian food; soup dumpling.	Homemade wonton soup warmed cold winter evening.
wood	Timber; forest; material; trees.	Oak wood crafted durable furniture pieces.
woodland	Area covered with trees; forest; wooded area; tree land.	Ancient woodland harbored rare species and biodiversity.
wool	Sheep hair; soft fiber; warm material; animal fleece.	Merino wool created softest sweaters and scarves.
woolen	Made of wool; wool fabric; warm clothing; wool material.	Thick woolen blanket provided warmth during winter.
word	Term; expression; promise; speech.	Single word changed entire conversation meaning.
work	Job; effort; labor; task.	Hard work eventually produced remarkable results.
worker	Employee; laborer; person; staff.	Dedicated worker earned promotion through consistent effort.
workflow	Sequence of work processes; work procedure; operational flow.	Efficient workflow reduced project completion time.
workforce	Group of workers; employees; labor force; working population.	Diverse workforce brings innovative perspectives and solutions.
workload	Amount of work; task burden; job quantity; work volume.	Manageable workload improved employee satisfaction significantly.
workplace	Location of work; office; work environment; job site.	Modern workplace emphasizes collaboration and flexibility.
workweek	Working days of week; business week; Monday to Friday.	Standard workweek consists of forty productive hours.
world	World; earth; globe; universe.	Digital world transformed communication methods globally.
worm	Long soft animal; earthworm; crawling creature; parasite.	Garden worm improved soil through natural composting.
worry	Concern; anxiety; fear; trouble.	Constant worry affected her sleep quality.
worship	Religious devotion; to honor God; reverence; adoration.	Sunday worship brought community members together.
worth	Value; merit; importance; price.	Antique worth exceeded initial appraisal estimate.
wound	Injury; cut; to injure; damage; hurt.	Deep wound required immediate medical attention.
wrap	To cover; packaging; to enclose; covering material.	Plastic wrap preserved leftover food freshness.
wreck	Destroyed remains; to destroy; ruin; accident.	Shipwreck discovery revealed ancient maritime history.
wrench	Tool for gripping; to twist; spanner; to pull forcefully.	Adjustable wrench tightened bolts of various sizes.
wrestling	Combat sport; grappling; physical contest; fighting sport.	Olympic wrestling requires strength and tactical skill.
wrist	Joint between hand and arm; connecting joint; hand connection.	Tennis injury caused painful wrist inflammation.
writer	Person who writes; author; scribe; literary creator.	Famous writer published bestselling mystery novel.
wrong	Mistake; error; incorrect; improper.	He could not tell right from wrong.
x-ray	Medical imaging; electromagnetic radiation; to examine with x-rays.	Chest x-ray revealed no signs of infection.
xanadu	Idyllic place; paradise; utopia; perfect location.	Poet described tropical island as earthly xanadu.
xenon	Noble gas element; chemical element; inert gas; lighting gas.	Car headlights use bright xenon gas technology.
xenophobia	Fear of foreigners; hatred of strangers; prejudice against outsiders.	Education helps combat xenophobia and cultural prejudice.
xerox	Photocopy; to make copies; copying machine; duplicate.	Office xerox machine produced clear document copies.
xmas	Christmas; holiday celebration; December 25th; festive season.	Family xmas gathering included traditional feast.
xylitol	Sugar substitute; artificial sweetener.	Dental xylitol gum helped prevent tooth decay.
xylophone	Percussion instrument; wooden bar instrument; musical instrument.	School xylophone taught children basic musical notes.
yak	Large hairy ox; Tibetan animal; mountain cattle; to talk constantly.	Tibetan yak provided milk and transportation.
yard	Garden; courtyard; measurement; area.	Backyard garden produced fresh vegetables all summer.
yarn	Spun thread; wool thread; story; tale.	Soft yarn created beautiful sweaters for family.
year	Year; twelve months; period; age.	Successful year brought business growth and expansion.
yellow	The color yellow; sun color; golden color; cowardice.	Bright yellow sunflowers dominated summer garden landscape.
yen	Japanese currency; strong desire; craving; longing.	Exchange rate converted dollars to yen efficiently.
yes	Affirmative answer; agreement; positive response; approval.	Resounding yes from voters supported the referendum proposal.
yesterday	Day before today; previous day; recent past; former time.	Children played outside all day yesterday afternoon.
yield	To produce; give way; surrender; harvest; return.	Crop yield increased after improved irrigation system.
yogurt	Fermented milk product; creamy dairy food; healthy snack.	Greek yogurt provided protein for breakfast meal.
yoke	Harness for oxen; burden; to join together; oppression.	Wooden yoke enabled oxen to pull heavy cart.
young	Not old; youthful; recent; juvenile; new.	Wildlife sanctuary provided shelter for orphaned young animals.
youth	Young people; early life; adolescence; vigor of young age.	Local youth organized environmental cleanup campaign.
zeal	Great enthusiasm; passion; fervor; dedication.	Religious zeal motivated missionaries to travel globally.
zebra	Striped African animal; black and white horse-like animal.	Wild zebra grazed peacefully in African savanna.
zeppelin	Large airship; dirigible; inflatable aircraft; air balloon.	Historic zeppelin carried passengers across Atlantic Ocean.
zero	Number 0; nothing; none; starting point.	Temperature dropped to zero during winter storm.
zest	Enthusiasm; citrus peel; energy; keen enjoyment.	Lemon zest brightened cake frosting with citrus flavor.
zip	Fastener; to close; speed; postal code.	Broken zip prevented jacket from closing properly.
zodiac	Astrological system; star signs; celestial belt; horoscope system.	Chinese zodiac assigns animals to birth years.
zone	Area; region; district; sector.	Quiet zone helped students concentrate during exams.
