en	meaning_en	example_en
abbey	A building or buildings occupied by a community of monks or nuns.	Westminster Abbey has hosted coronations for centuries of British monarchs.
abbreviation	A shortened form of a word or phrase.	Medical professionals commonly use 'Dr.' as an abbreviation for Doctor.
ability	Possession of the means or skill to do something.	Her ability to solve complex problems impressed the entire team.
abnormality	The quality of being unusual or different from normal.	Doctors investigate any abnormality found during medical examinations.
abortion	The deliberate termination of a pregnancy.	Medical professionals provide counseling regarding abortion procedures.
absence	Lack; not being present; missing; vacancy.	Her absence from the meeting was noted by everyone on the committee.
absolute	Certainty; completeness; something without limits or conditions.	Philosophers debate whether moral absolute exists or if ethics are relative.
abstract	Summary; concept; idea separated from concrete reality.	The author provided an abstract of the research paper.
abstraction	The quality of dealing with ideas rather than events.	Mathematical abstraction helps solve complex theoretical problems.
absurd	Nonsense; something unreasonable or illogical.	The comedy show embraced the absurd with illogical humor.
absurdity	State of being ridiculous; foolishness; nonsense; illogical situation.	She couldn't help but laugh at the absurdity of wearing formal clothes to paint the fence.
abundance	A very large quantity of something.	Natural forests provide an abundance of wildlife habitats.
abuse	The improper use of something or cruel treatment of someone.	Substance abuse affects millions of people worldwide.
academy	A school for special training or higher education.	She enrolled in a prestigious academy to study classical music.
accent	Pronunciation; emphasis; stress; dialect.	His British accent made him easily recognizable in the American city.
access	Entry; approach; availability; admission.	Students need a special card to gain access to the university library.
accessory	An additional item that complements something.	She bought a beautiful necklace as an accessory for her wedding dress.
accident	Mishap; crash; unplanned event; injury.	Insurance companies investigate every accident claim thoroughly.
accommodation	Lodging; adjustment; compromise; housing.	Tourists book accommodation months in advance for popular destinations.
accomplishment	Something that has been achieved successfully.	Graduating from university was her greatest accomplishment so far.
accord	An official agreement or treaty.	A diplomatic accord was reached between the two countries.
account	Report; record; bill; explanation.	She gave a detailed account of what happened during the meeting.
accounting	The action or process of keeping financial accounts.	Small businesses need proper accounting to track expenses and income.
accumulation	The acquisition or gradual gathering of something.	Wealth accumulation requires disciplined saving and smart investments.
achievement	Accomplishment; success; attainment; feat.	Winning the championship was the team's greatest achievement this year.
acid	Chemical; sour substance; corrosive; bitter.	Battery acid is extremely dangerous and requires protective equipment.
acquaintance	A person one knows slightly.	I met an old acquaintance from college at the coffee shop today.
acquisition	Obtaining; purchase; gaining; learning.	Google's acquisition of YouTube transformed online video sharing.
acquittal	Legal judgment of not guilty.	After reviewing all evidence, the jury reached an acquittal verdict.
acre	A unit of land area equal to 4,840 square yards.	Farmers typically plant corn on every available acre of their land.
act	A thing done; a deed or action.	His generous act of helping strangers made everyone proud.
acting	Performing as actor; temporary duty; theatrical performance; pretending.	She decided to pursue a career in acting after graduating from drama school.
action	Activity; deed; behavior; movement.	Quick action saved the company from bankruptcy.
activity	Action; pursuit; task; movement.	Reading is her favorite activity during weekend afternoons.
actor	Performer; player; participant; agent.	Tom Hanks is an actor known for his versatility.
actress	A female performer in theater, film, or television.	Meryl Streep became an actress after studying drama at Yale.
actuality	Actual existence; reality.	Theory is one thing, but actuality often proves more complicated than expected.
adaptation	Adjustment; modification; version; evolution.	Netflix produced a successful adaptation of the popular book series.
addiction	The condition of being dependent on a particular substance.	Overcoming addiction requires professional help and strong support.
addition	Extra; supplement; increase; math operation.	Building an addition costs less than moving to a bigger house.
additive	A substance added to improve or preserve something.	Manufacturers must list every additive on food labels.
address	Location; speech; handling; residence.	Please write your home address clearly on the envelope.
adherence	Steady devotion to belief or practice.	Her adherence to the diet plan helped her achieve her goals.
administration	Management; government; control; leadership.	Each presidential administration faces unique challenges.
admiral	A senior naval officer.	Nelson became an admiral after decades of naval service.
admiration	Respect and warm approval.	His admiration for her courage was evident in his words.
admission	Entry; confession; acknowledgment; acceptance.	His admission of guilt surprised everyone in court.
adornment	Decoration; ornament; embellishment; decorative item.	Jewelry serves as both adornment and investment.
adult	Grown person; mature; full-grown; of age.	Every adult in the community has the right to vote in elections.
advance	Progress; improvement; loan; forward movement.	Scientific advance often comes from unexpected discoveries.
advantage	Benefit; edge; profit; superiority.	Having experience in the field gave him a clear advantage over other candidates.
adventure	Exciting experience; journey; quest; exploration.	Their mountain climbing adventure took them to incredible heights.
adversary	An opponent or enemy.	Respecting your adversary makes you a better competitor.
adversity	Difficult or unpleasant situation.	She showed great strength in overcoming adversity during tough times.
advertisement	Commercial; promotion; ad; publicity.	The company launched a new advertisement.
advertiser	Person who advertises; company promoting products; marketing professional.	Major advertiser shifted their budget from TV to social media.
advice	Counsel; guidance; suggestion; recommendation.	His wise advice helped me make the right decision about my career.
adviser	A person who gives advice in a particular field.	Presidents rely on each adviser for specialized expertise.
advocacy	Public support for or recommendation of a particular cause.	Her advocacy for environmental protection inspired many people to take action.
affair	Matter; event; relationship; business.	The political affair dominated headlines for several weeks.
affection	Fondness; love; warmth; tenderness.	The mother's affection for her children was evident in everything she did.
affidavit	Sworn written statement used as evidence.	The witness signed an affidavit confirming what she had seen.
affinity	Natural liking; attraction; relationship.	Her affinity for classical music led her to become a professional violinist.
aftercare	Care provided after treatment or surgery.	Proper aftercare is essential for a full recovery from the operation.
afternoon	Time between noon and evening.	School children walk home during the afternoon hours.
age	Length of life; era; period; maturity.	The golden age of cinema produced many timeless classics.
agency	Organization providing services; action; power.	The travel agency helped us plan our perfect vacation.
agenda	List of items to be discussed; program.	The meeting agenda included five important topics for discussion.
agent	Representative; spy; factor; broker.	The real estate agent showed us several beautiful houses in the neighborhood.
aggregate	Total sum or collection of separate parts.	The aggregate of all donations exceeded our fundraising goal.
agitation	State of anxiety; unrest; stirring.	The political agitation in the region led to widespread protests.
agony	Extreme physical or mental suffering.	The patient was in agony until the doctor administered pain medication.
agreement	Contract; accord; harmony; deal.	Both parties signed the agreement after weeks of careful negotiation.
agriculture	Farming; cultivation of crops and livestock.	Modern agriculture uses technology to increase crop yields significantly.
aid	Help; assistance; support; relief.	The international aid arrived just in time to help disaster victims.
aide	Assistant; helper; supporter.	The presidential aide carried important documents in her briefcase.
aim	Purpose; goal; target; intention.	Her aim was to complete the marathon in under four hours.
air	Atmosphere; gas mixture; broadcast.	The fresh mountain air felt wonderful after living in the city.
airhead	Silly or stupid person.	Despite being called an airhead, she proved everyone wrong with her brilliant ideas.
airport	A complex for aircraft operations.	The busy airport handles hundreds of flights every day.
airway	Route regularly used by aircraft.	The commercial airway connects major cities across the continent.
alarm	Warning signal; device that alerts.	The fire alarm woke everyone in the building immediately.
alaska	Largest state in the United States.	Alaska is known for its incredible wilderness and wildlife.
album	Collection of photographs or music recordings.	The wedding album contains beautiful memories from their special day.
alcohol	Chemical compound; intoxicating substance in drinks.	The doctor advised him to avoid alcohol while taking the medication.
alcoholism	Addiction to alcoholic drinks.	Alcoholism is a serious disease that requires professional treatment.
alibi	Claim of being elsewhere when crime occurred.	The suspect's alibi was verified by security camera footage.
alien	Foreign; extraterrestrial being; outsider.	The science fiction movie featured a friendly alien from another planet.
alignment	Arrangement in a straight line.	The car's wheel alignment needs to be adjusted for better handling.
all	Everything; entirety; the whole quantity or extent of something.	All was forgiven after the heartfelt apology.
all-nighter	Activity lasting through the night.	The college student pulled an all-nighter to finish his research paper.
allegiance	Loyalty; faithfulness; devotion.	Citizens pledge their allegiance to the country during the ceremony.
allergy	Hypersensitive reaction to substance.	Her allergy to peanuts requires her to carry emergency medication.
alliance	Union; partnership; coalition; agreement.	The military alliance strengthened security cooperation between the nations.
alligator	Large reptile found in swamps.	The massive alligator sunned itself on the riverbank peacefully.
allocation	Distribution; assignment; apportionment.	The budget allocation for education increased significantly this year.
allotment	Portion assigned; small garden plot.	His allotment of vegetables provides fresh produce for the family.
allowance	Money given regularly; permitted amount.	The child earns her weekly allowance by completing household chores.
alloy	Metal made by combining two or more metals.	The titanium alloy is both lightweight and incredibly strong.
ally	A country or person that cooperates with another.	France has been a trusted ally of the United States for centuries.
almond	Edible seed; oval-shaped nut from almond tree.	She added sliced almond to the salad for extra crunch.
alpaca	South American mammal related to llama.	The soft alpaca wool makes incredibly warm and comfortable sweaters.
alpha	First letter of Greek alphabet; dominant individual.	The alpha of the wolf pack leads and protects the entire group.
alphabet	Set of letters used in writing system.	Children learn the alphabet before they can read complete words.
alternative	Option; choice; substitute; different.	Solar power provides a clean alternative to fossil fuel energy.
altitude	Height above sea level or ground level.	The airplane reached its cruising altitude of 35,000 feet.
alto	The lowest female singing voice.	The choir director assigned her to sing alto in the upcoming concert.
amateur	Person who does activity for pleasure not money.	The talented amateur won the photography contest.
amber	Fossilized tree resin.	The ancient insect preserved in amber provides valuable scientific information.
ambiguity	Uncertainty of meaning.	The legal document's ambiguity led to confusion among the lawyers.
ambition	Strong desire for success or achievement.	Her ambition to become a doctor motivated years of dedicated study.
amendment	Change or addition to legal document.	The constitutional amendment guarantees freedom of speech for all citizens.
America	Continent or commonly United States.	America is known for its diverse culture and natural beauty.
American	Relating to or characteristic of America or Americans.	The American is known for his generosity.
amethyst	Purple variety of quartz gemstone.	Amethyst crystals form naturally in volcanic rock cavities.
ammunition	Projectiles fired from weapons.	The soldiers carefully counted their ammunition before the training exercise.
amnesty	An official pardon for people who have committed crimes.	The government declared amnesty for political prisoners during the peace process.
amount	Quantity; a particular quantity of something.	The amount of rainfall this month broke all previous records.
ampere	Unit of electric current measurement.	A single ampere is a unit of electric current.
amplitude	The maximum extent of vibration or oscillation.	The sound wave's amplitude determines how loud we perceive the noise.
amusement	Entertainment or pleasure from something enjoyable.	The children's amusement at the circus was evident in their laughter.
anagram	Word formed by rearranging letters of another word.	The word 'listen' is a perfect anagram of 'silent'.
analogy	A comparison between similar things to explain or clarify.	The teacher used a simple analogy to explain the complex scientific concept.
analysis	Detailed examination of elements or structure.	The financial analysis revealed significant problems with the company's budget.
anarchy	Absence of government or organized authority.	The country descended into anarchy after the government collapsed.
anatomy	The study of body structure and organization.	Medical students spend years studying human anatomy in great detail.
ancestor	A person from whom one is descended; forefather.	She traced her family tree back to an ancestor from the 1700s.
angel	A spiritual being believed to act as attendant or messenger of God.	An angel appeared to the shepherds in biblical stories.
anger	A strong feeling of annoyance, displeasure, or hostility.	Road rage demonstrates dangerous anger behind the wheel.
angle	A space between two intersecting lines or surfaces at or close to the point where they meet.	The photographer adjusted the camera angle to capture the perfect shot.
animal	A living organism that feeds on organic matter, typically having specialized sense organs and nervous system.	Every animal in the zoo receives specialized care from trained veterinarians.
animation	The technique of making drawings, models, or puppets appear to move.	The Disney animation brought beloved characters to life on the screen.
ankle	The joint connecting the foot with the leg; the area around this joint.	The runner twisted her ankle during the marathon but finished the race.
anniversary	The date on which an event took place in a previous year.	They celebrated their wedding anniversary with a romantic dinner.
announcement	A public or formal notice announcing something.	The principal made an important announcement during the morning assembly.
announcer	A person who announces something, especially on radio or television.	The sports announcer's excitement made the game even more thrilling.
annoyance	The feeling of being irritated or slightly angry.	The constant noise from construction became a daily annoyance for residents.
answer	A response to a question, problem, or situation.	She knew the correct answer to every question on the exam.
ant	Small insect	The hardworking ant carried food many times its own weight.
antarctic	South polar region	The Antarctic contains most of the world's fresh water in ice form.
antelope	Swift horned animal	The graceful antelope bounded across the African savanna.
anthem	A rousing song identified with a particular group or cause.	The national anthem played before every football game.
anthropology	The study of humankind.	Her degree in anthropology prepared her for fieldwork with indigenous cultures.
antibiotic	A medicine that inhibits the growth of bacteria.	The doctor prescribed an antibiotic to treat the bacterial infection.
antibody	Blood protein produced to counteract antigens.	The antibody helps the immune system fight off dangerous viruses.
anticipation	Feeling of expectation; looking forward to something.	The anticipation before opening presents made Christmas morning special.
antidote	A medicine to counteract poison.	The hospital kept the antidote ready for potential snakebite victims.
antique	A valuable old object	The vase was a valuable antique.
antiquity	The ancient past	The museum's collection spans from antiquity to the present day.
antiseptic	A substance that prevents infection.	The nurse applied antiseptic to clean the wound thoroughly.
anxiety	Worry	Public speaking causes anxiety for many people.
anybody	Person; individual; any person at all.	Anybody can learn to play the piano with enough practice.
anyone	Individual; person; any person whatsoever; unspecified person.	Anyone interested in volunteering should contact the organizer.
anything	Object; matter; any object or matter whatever.	Anything left on the table will be thrown away at closing time.
anywhere	Place; location; in or to any place.	You can find good coffee anywhere in this neighborhood.
apartment	Flat	The cozy apartment overlooks the busy city street below.
apathy	Lack of interest, enthusiasm, or concern.	The voters' apathy toward the election worried civic leaders.
ape	A large primate without a tail.	The intelligent ape learned to use simple tools to find food.
aperture	An opening, hole, or gap.	The photographer adjusted the camera's aperture for better depth of field.
apex	The highest point or peak.	Reaching the apex of the mountain took six hours of difficult climbing.
apocalypse	The complete final destruction of the world.	Many ancient texts describe an apocalypse ending human civilization.
apology	An expression of regret	His sincere apology helped repair their damaged friendship.
apostrophe	Punctuation mark	Remember to use an apostrophe in contractions like 'don't' and 'can't'.
apparatus	Equipment for a particular purpose.	The scientific apparatus required careful calibration before each experiment.
apparel	Clothing and accessories	The store specializes in athletic apparel for professional athletes.
appeal	Request	The charity's appeal for donations raised thousands of dollars.
appearance	Look	His neat appearance made a positive impression at the job interview.
appetite	A natural desire to satisfy a bodily need, especially for food.	The delicious smell increased everyone's appetite for dinner.
appetizer	Small first course	The shrimp appetizer was the perfect start to the elegant meal.
applause	Clapping hands	The thunderous applause lasted for several minutes after the performance.
apple	Round fruit	The crisp red apple provided a healthy and satisfying snack.
appliance	A device designed for a particular use.	Every modern kitchen needs essential appliances like refrigerators.
applicant	A person who applies for something.	The qualified applicant impressed everyone during the interview process.
application	Use	The software application helps students organize their homework assignments.
appointment	Meeting	She scheduled a doctor's appointment for next Tuesday morning.
appraisal	An assessment of worth or quality.	The home appraisal determined the property's current market value.
appreciation	Recognition of the full worth of something.	Her appreciation for classical music grew after attending the concert.
apprehension	Anxiety or fear that something bad will happen.	His apprehension about the surgery was completely understandable.
apprentice	Person learning trade from skilled employer.	The young apprentice learned carpentry skills from the master craftsman.
apprenticeship	Training period	The apprenticeship program lasted three years and included hands-on experience.
approach	Method	Their innovative approach to the problem yielded surprising results.
appropriation	Taking for use	The budget appropriation for education increased by ten percent this year.
approval	Consent	The project received unanimous approval from the city council.
apricot	Orange stone fruit	The sweet apricot made a perfect addition to the fruit salad.
April	The fourth month of the year.	April brings warm weather and beautiful spring flowers.
apron	A protective garment worn over clothes while cooking.	She tied her grandmother's apron around her waist before baking cookies.
aquatic	Water organism	A water lily is a type of aquatic.
arab	Person from Arabic-speaking countries.	The Arab sold beautiful handwoven carpets in the marketplace.
arbitration	Settlement of dispute by neutral third party.	The labor arbitration resolved the contract dispute fairly for both sides.
arc	A part of the circumference of a circle.	The rainbow formed a perfect arc across the clear blue sky.
arch	A curved structure spanning an opening.	The stone arch has stood strong for over three centuries.
archaeologist	A person who studies human history through excavation.	The archaeologist discovered pottery fragments from ancient civilizations.
archaeology	The study of human activity through material remains.	Her study of archaeology led to exciting discoveries in Egypt.
archer	Person who shoots with bow and arrow.	The skilled archer hit the bullseye with remarkable accuracy.
archipelago	Group of islands	The archipelago consists of over fifty small tropical islands.
architect	A person who designs buildings.	The famous architect designed several iconic buildings in the city.
architecture	Building design	The Gothic architecture of the cathedral inspires millions of visitors.
archive	A collection of historical documents or records.	The university archive contains manuscripts dating back four centuries.
arctic	Extremely cold northern polar region.	The Arctic ice is melting due to climate change effects.
area	Region	The residential area has excellent schools and parks for families.
arena	A level area surrounded by seats for spectators.	The basketball arena can hold over twenty thousand excited fans.
argument	Debate	Their argument about politics lasted well into the evening.
aristocracy	Highest class in society	The aristocracy lived in magnificent palaces throughout the countryside.
arithmetic	The branch of mathematics dealing with numbers.	Basic arithmetic skills are essential for everyday financial decisions.
arizona	Southwestern US state	Arizona is famous for its stunning desert landscapes and Grand Canyon.
arm	Limb	The pitcher threw with his dominant arm.
armament	Military weapons and equipment.	The country increased its armament spending due to regional tensions.
armor	Protective covering worn in combat.	The medieval knight's armor protected him during fierce battles.
army	Military	The army conducted training exercises in the remote desert region.
aroma	A distinctive pleasant smell.	The delicious aroma of fresh bread filled the entire bakery.
arrangement	Organization	The flower arrangement created a beautiful centerpiece for the dinner table.
array	An impressive display or range of something.	The buffet featured an impressive array of international dishes.
arrest	The action of seizing someone to hold them in custody.	The arrest was made peacefully without any complications.
arrival	Coming	The arrival of spring brought warm weather and blooming flowers.
arrow	A shaft with a pointed head shot from a bow.	The arrow flew straight and true toward the target.
arsenal	Collection of weapons	The military arsenal contained equipment for various types of operations.
art	Creative work or skill; creative expression in visual, auditory, or performing forms.	The museum's collection of art includes masterpieces from every major period.
artery	A blood vessel carrying blood away from the heart.	The blocked artery required immediate surgical intervention.
artichoke	Edible flower bud of Mediterranean plant.	The grilled artichoke made an excellent appetizer for the dinner party.
article	Item	The journalist wrote an article about the recent event.
artillery	Large military weapons	The artillery unit provided support during the military exercise.
artist	Creator	The talented artist painted landscapes that captured nature's beauty.
ascent	Act of climbing or going up.	The mountaineer's ascent took twelve hours of continuous climbing.
ash	The powdery residue left after burning.	The volcanic ash covered everything within a fifty-mile radius.
Asia	Largest continent on Earth.	Asia contains more than half of the world's total population.
aspect	Side	Every aspect of the project was carefully planned and executed.
aspiration	Hope or ambition of achieving something.	Her aspiration to become a doctor motivated years of dedicated study.
